ID,Title,Release Year,Moby Score,URL,Genres
142804,007: Blood Stone,2010,6.85,https://www.mobygames.com/game/142804/007-blood-stone/,"Action, Shooter, Licensed, Spy / espionage, Stealth, Behind view, Direct control"
88776,007: Quantum of Solace,2008,6.62,https://www.mobygames.com/game/88776/007-quantum-of-solace/,"Action, Shooter, Licensed, Spy / espionage, Beat 'em up / brawler, Behind view, Diagonal-down, 2D scrolling, Point and select"
185779,1 vs. 100,2008,,https://www.mobygames.com/game/185779/1-vs-100/,"Game show / trivia / quiz, Licensed, Puzzle"
84507,1 vs. 100,2008,,https://www.mobygames.com/game/84507/1-vs-100/,"Simulation, Game show / trivia / quiz, Licensed"
126170,100 All-Time Favorites,2009,,https://www.mobygames.com/game/126170/100-all-time-favorites/,"Strategy / tactics, Sports, Chess, Board game, Cards / tiles, Gambling, Bowling, Pool / snooker"
86813,100 Classic Games,2011,,https://www.mobygames.com/game/86813/100-classic-games/,Compilation
142453,1001 Touch Games,2011,,https://www.mobygames.com/game/142453/1001-touch-games/,"Strategy / tactics, Board game, Cards / tiles, Hidden object, Puzzle, Mini-games"
86818,101-in-1 Explosive Megamix,2009,5.37,https://www.mobygames.com/game/86818/101-in-1-explosive-megamix/,"Action, Fixed / flip-screen, Mini-games, Direct control"
142459,101-in-1 Sports Megamix,2010,,https://www.mobygames.com/game/142459/101-in-1-sports-megamix/,"Sports, Mini-games"
48329,12,2008,,https://www.mobygames.com/game/48329/12/,"Action, Racing / Driving, Arcade, Top-down, Compilation, Puzzle, Mini-games"
215642,12 Family Games,2008,,https://www.mobygames.com/game/215642/12-family-games/,"Action, Racing / Driving, Arcade, Top-down, Side view, Platform, Shooter, Puzzle elements, 2D scrolling, Fixed / flip-screen, Mini-games, Tile matching puzzle, Direct control"
144220,1500DS Spirits Vol. 10: Igo,2008,,https://www.mobygames.com/game/144220/1500ds-spirits-vol-10-igo/,"Strategy / tactics, Board game"
144157,1500DS Spirits Vol. 1: Mahjong,2007,,https://www.mobygames.com/game/144157/1500ds-spirits-vol-1-mahjong/,"Strategy / tactics, Cards / tiles"
144158,1500DS Spirits Vol. 2: Shogi,2007,,https://www.mobygames.com/game/144158/1500ds-spirits-vol-2-shogi/,"Strategy / tactics, Board game"
144172,1500DS Spirits Vol. 5: Hanafuda,2007,,https://www.mobygames.com/game/144172/1500ds-spirits-vol-5-hanafuda/,"Strategy / tactics, Cards / tiles"
144173,1500DS Spirits Vol. 6: Trump,2007,,https://www.mobygames.com/game/144173/1500ds-spirits-vol-6-trump/,"Strategy / tactics, Cards / tiles"
144178,1500DS Spirits Vol. 8: Darts,2007,,https://www.mobygames.com/game/144178/1500ds-spirits-vol-8-darts/,"Sports, Darts / target shooting"
144219,1500DS Spirits Vol. 9: Futari-uchi Mahjong,2007,,https://www.mobygames.com/game/144219/1500ds-spirits-vol-9-futari-uchi-mahjong/,"Strategy / tactics, Cards / tiles"
142467,18 Classic Card Games,2010,,https://www.mobygames.com/game/142467/18-classic-card-games/,"Strategy / tactics, Cards / tiles"
43860,1912: Titanic Mystery,2010,,https://www.mobygames.com/game/43860/1912-titanic-mystery/,"1st-person, Hidden object, Puzzle, Contemporary"
144338,2 Disney Games: Phineas and Ferb / Phineas and Ferb: Ride Again,2011,,https://www.mobygames.com/game/144338/2-disney-games-phineas-and-ferb-phineas-and-ferb-ride-again/,Compilation
153094,2 in 1: Mahjong / Mahjong: Eine Reise um die Welt,2012,,https://www.mobygames.com/game/153094/2-in-1-mahjong-mahjong-eine-reise-um-die-welt/,Compilation
106756,2-in-1 Party Pack: Shrek's Carnival Craze Party Games / Madagascar Kartz,2010,,https://www.mobygames.com/game/106756/2-in-1-party-pack-shreks-carnival-craze-party-games-madagascar-k/,Compilation
36224,4 Elements,2011,,https://www.mobygames.com/game/36224/4-elements/,"Side view, Fantasy, Hidden object, Puzzle, Fixed / flip-screen, Falling block puzzle, Tile matching puzzle, Point and select"
62900,4 Game Fun Pack: Monopoly / Boggle / Yahtzee / Battleship,2005,,https://www.mobygames.com/game/62900/4-game-fun-pack-monopoly-boggle-yahtzee-battleship/,"Strategy / tactics, 1st-person, Board game, Compilation, Licensed, Puzzle, Word construction"
87110,50 Classic Games,2009,,https://www.mobygames.com/game/87110/50-classic-games/,"Chess, Cards / tiles, Gambling, Compilation, Puzzle"
142489,50 More Classic Games,2011,,https://www.mobygames.com/game/142489/50-more-classic-games/,"Strategy / tactics, Chess, Cards / tiles, Gambling, Puzzle, Mini-games"
37584,7 Wonders II,2009,6.57,https://www.mobygames.com/game/37584/7-wonders-ii/,"Side view, Puzzle, Fixed / flip-screen, Falling block puzzle, Tile matching puzzle, Point and select, Asia, Egypt (Ancient), Europe, Classical antiquity, Middle East"
32004,7 Wonders of the Ancient World,2007,6.36,https://www.mobygames.com/game/32004/7-wonders-of-the-ancient-world/,"Side view, Puzzle, Fixed / flip-screen, Falling block puzzle, Tile matching puzzle, Point and select, Egypt (Ancient), Classical antiquity, Middle East"
37160,7 Wonders: Treasures of Seven,2011,,https://www.mobygames.com/game/37160/7-wonders-treasures-of-seven/,"Side view, Puzzle, Fixed / flip-screen, Falling block puzzle, Tile matching puzzle, Point and select, Africa, Asia, Europe, Classical antiquity, Middle East"
120101,7th Dragon,2009,,https://www.mobygames.com/game/120101/7th-dragon/,"Top-down, Role-playing (RPG), Fantasy, 2D scrolling, Japanese-style RPG (JRPG)"
142494,8BallAllstars,2009,,https://www.mobygames.com/game/142494/8ballallstars/,"Sports, 1st-person, Top-down, Pool / snooker, Turn-based, Direct control"
49690,999: Nine Hours · Nine Persons · Nine Doors,2009,8.1,https://www.mobygames.com/game/49690/999-nine-hours-nine-persons-nine-doors/,"Adventure, 1st-person, Puzzle elements, Detective / mystery, Anime / Manga, Visual novel, Thriller, Fixed / flip-screen, Point and select"
115802,A Witch's Tale,2009,,https://www.mobygames.com/game/115802/a-witchs-tale/,"Role-playing (RPG), Anime / Manga, Fantasy, Turn-based, Diagonal-down, 2D scrolling"
87125,Absolute BrickBuster,2007,,https://www.mobygames.com/game/87125/absolute-brickbuster/,"Paddle / Pong, Puzzle"
87126,Absolute Chess,2007,,https://www.mobygames.com/game/87126/absolute-chess/,"Simulation, Strategy / tactics, Chess"
87127,Absolute Reversi,2007,,https://www.mobygames.com/game/87127/absolute-reversi/,"Strategy / tactics, Top-down, Board game, Turn-based, Fixed / flip-screen, Point and select"
45325,Ace Attorney Investigations: Miles Edgeworth,2009,7.73,https://www.mobygames.com/game/45325/ace-attorney-investigations-miles-edgeworth/,"Adventure, Simulation, Side view, Puzzle elements, Detective / mystery, Anime / Manga, 3rd-person (Other), Contemporary"
32773,Advance Wars: Days of Ruin,2008,8.28,https://www.mobygames.com/game/32773/advance-wars-days-of-ruin/,"Strategy / tactics, Top-down, Isometric, Post-apocalyptic, Turn-based"
19271,Advance Wars: Dual Strike,2005,8.68,https://www.mobygames.com/game/19271/advance-wars-dual-strike/,"Strategy / tactics, Side view, Anime / Manga, Turn-based, Diagonal-down"
87135,Adventure Time: Hey Ice King Why'd You Steal Our Garbage?!!,2012,,https://www.mobygames.com/game/87135/adventure-time-hey-ice-king-whyd-you-steal-our-garbage/,"Action, Side view, Fantasy, Licensed, 2D scrolling"
142854,AFL Mascot Manor,2009,,https://www.mobygames.com/game/142854/afl-mascot-manor/,"Action, Platform, Licensed, Behind view, Direct control, Oceania"
52151,Again,2009,5.98,https://www.mobygames.com/game/52151/again/,"Adventure, 1st-person, Puzzle elements, Detective / mystery, Contemporary"
47565,Agatha Christie: The ABC Murders,2009,5.72,https://www.mobygames.com/game/47565/agatha-christie-the-abc-murders/,"Adventure, 1st-person, Puzzle elements, Detective / mystery, Licensed, 3rd-person (Other), Graphic adventure, Interwar"
37820,Age of Empires: Mythologies,2008,7.81,https://www.mobygames.com/game/37820/age-of-empires-mythologies/,"Strategy / tactics, Isometric, Fantasy, Turn-based, Multiple units/characters control, Egypt (Ancient), Classical antiquity, Turn-based strategy (TBS)"
21473,Age of Empires: The Age of Kings,2006,7.79,https://www.mobygames.com/game/21473/age-of-empires-the-age-of-kings/,"Strategy / tactics, Isometric, Turn-based, Diagonal-down, Medieval, Turn-based strategy (TBS)"
87139,Air Traffic Chaos,2008,,https://www.mobygames.com/game/87139/air-traffic-chaos/,Simulation
48924,Akagawa Jirō Mystery: Tsuki no Hikari - Shizumeru Kane no Satsujin,2008,,https://www.mobygames.com/game/48924/akagawa-jiro-mystery-tsuki-no-hikari-shizumeru-kane-no-satsujin/,"Adventure, 1st-person, Detective / mystery"
74080,ALC no 10-Punkan Eigo Master: Shokyū,2007,,https://www.mobygames.com/game/74080/alc-no-10-punkan-eigo-master-shokyu/,"1st-person, Educational, Reading / writing, Foreign language"
45516,Alex Rider: Stormbreaker,2006,5.75,https://www.mobygames.com/game/45516/alex-rider-stormbreaker/,"Action, Licensed, Spy / espionage, Stealth, 3rd-person (Other)"
142518,Aliens in the Attic,2009,6.11,https://www.mobygames.com/game/142518/aliens-in-the-attic/,"Action, Side view, Platform, Shooter, Puzzle elements, Licensed, 2D scrolling"
53230,Aliens: Infestation,2011,7.51,https://www.mobygames.com/game/53230/aliens-infestation/,"Action, Sci-fi / futuristic, Side view, Platform, Metroidvania, Licensed, Survival horror, 2D scrolling"
84967,All Star Cheer Squad,2008,,https://www.mobygames.com/game/84967/all-star-cheer-squad/,"Action, Simulation, Music / rhythm"
87175,Alpha and Omega,2010,,https://www.mobygames.com/game/87175/alpha-and-omega/,"Action, Sports, Golf, Licensed, Mini-games"
87177,Alvin & The Chipmunks: Chipwrecked,2011,,https://www.mobygames.com/game/87177/alvin-the-chipmunks-chipwrecked/,"Action, Music / rhythm, 3rd-person (Other)"
61233,Alvin and the Chipmunks,2007,,https://www.mobygames.com/game/61233/alvin-and-the-chipmunks/,"Action, Simulation, Licensed, Music / rhythm, 3rd-person (Other)"
87179,Alvin and the Chipmunks: The Squeakquel,2009,,https://www.mobygames.com/game/87179/alvin-and-the-chipmunks-the-squeakquel/,"Action, Music / rhythm, 3rd-person (Other)"
31784,The Aly & AJ Adventure,2007,,https://www.mobygames.com/game/31784/the-aly-aj-adventure/,"Action, Licensed, Music / rhythm, 3rd-person (Other), Mini-games"
87180,Amazing Adventures: The Forgotten Ruins,2008,,https://www.mobygames.com/game/87180/amazing-adventures-the-forgotten-ruins/,"Hidden object, Puzzle"
62410,The Amazing Spider-Man,2012,,https://www.mobygames.com/game/62410/the-amazing-spider-man/,"Action, Side view, Licensed, 2D scrolling"
142538,America's Next Top Model,2010,,https://www.mobygames.com/game/142538/americas-next-top-model/,"Simulation, Licensed, Mini-games"
87182,American Girl: Julie Finds a Way,2007,,https://www.mobygames.com/game/87182/american-girl-julie-finds-a-way/,"Adventure, Licensed, Mini-games, Contemporary"
51122,American Girl: Kit Mystery Challenge!,2008,,https://www.mobygames.com/game/51122/american-girl-kit-mystery-challenge/,"Adventure, Detective / mystery, Licensed, 3rd-person (Other), Interwar"
87184,AMF Bowling Pinbusters!,2008,,https://www.mobygames.com/game/87184/amf-bowling-pinbusters/,"Sports, Licensed, Bowling"
180029,Angelique Duet,2006,,https://www.mobygames.com/game/180029/angelique-duet/,"Simulation, Anime / Manga, Romance, Life / social simulation"
216195,Anguna,2008,,https://www.mobygames.com/game/216195/anguna/,"Action, Puzzle elements, Fantasy, Diagonal-down, 2D scrolling, Direct control"
45296,Animal Boxing,2008,,https://www.mobygames.com/game/45296/animal-boxing/,"Sports, 1st-person, Boxing"
20448,Animal Crossing: Wild World,2005,8.37,https://www.mobygames.com/game/20448/animal-crossing-wild-world/,"Simulation, Meditative / Zen, Persistent, Diagonal-down, Life / social simulation, Point and select, Direct control, Regional differences"
79818,Animal Genius,2007,,https://www.mobygames.com/game/79818/animal-genius/,"Educational, Ecology / nature, Puzzle"
142669,Animal Life: Dinosaurs,2011,,https://www.mobygames.com/game/142669/animal-life-dinosaurs/,"Action, Educational, Game show / trivia / quiz, Puzzle elements, Ecology / nature, Mini-games"
142697,Animal Life: North America,2011,,https://www.mobygames.com/game/142697/animal-life-north-america/,"Educational, Game show / trivia / quiz, Ecology / nature, Puzzle, Fixed / flip-screen, Mini-games"
87194,Animal Paradise,2008,,https://www.mobygames.com/game/87194/animal-paradise/,Simulation
142569,Animal Paradise Wild,2009,,https://www.mobygames.com/game/142569/animal-paradise-wild/,"Simulation, Mini-games"
87195,Animal Planet: Emergency Vets,2009,,https://www.mobygames.com/game/87195/animal-planet-emergency-vets/,"Simulation, Licensed"
142570,Animal Planet: Vet Collection,2010,,https://www.mobygames.com/game/142570/animal-planet-vet-collection/,Compilation
87196,Animal Planet: Vet Life,2009,,https://www.mobygames.com/game/87196/animal-planet-vet-life/,Simulation
22073,"Animaniacs: Lights, Camera, Action!",2005,5.71,https://www.mobygames.com/game/22073/animaniacs-lights-camera-action/,"Action, Platform, Isometric, Puzzle elements, Licensed, Music / rhythm, Diagonal-down"
24299,Animates,2007,,https://www.mobygames.com/game/24299/animates/,"Simulation, 3rd-person (Other)"
21580,Ankh,2008,6.02,https://www.mobygames.com/game/21580/ankh/,"Adventure, Puzzle elements, 3rd-person (Other), Graphic adventure, Egypt (Ancient)"
28631,Anno 1701: Dawn of Discovery,2007,7.91,https://www.mobygames.com/game/28631/anno-1701-dawn-of-discovery/,"Simulation, Strategy / tactics, Real-time, Isometric, Diagonal-down, 2D scrolling, City building / construction simulation, North America, Sea pirates / Caribbean, South America, Age of Discovery / Enlightenment"
67262,Ant Nation,2009,,https://www.mobygames.com/game/67262/ant-nation/,"Strategy / tactics, Real-time, Side view, Diagonal-down"
32813,Apollo Justice: Ace Attorney,2007,7.54,https://www.mobygames.com/game/32813/apollo-justice-ace-attorney/,"Adventure, Simulation, 1st-person, Puzzle elements, Detective / mystery, Anime / Manga, Fixed / flip-screen"
35371,Aquarium by DS,2007,,https://www.mobygames.com/game/35371/aquarium-by-ds/,"Simulation, 3rd-person (Other)"
31437,Arctic Tale,2007,,https://www.mobygames.com/game/31437/arctic-tale/,"Action, Top-down, Licensed"
38864,Are You Smarter Than a 5th Grader?,2007,,https://www.mobygames.com/game/38864/are-you-smarter-than-a-5th-grader/,"Simulation, 1st-person, Game show / trivia / quiz, Licensed"
87258,Are You Smarter Than A 5th Grader?: Back To School,2010,,https://www.mobygames.com/game/87258/are-you-smarter-than-a-5th-grader-back-to-school/,"Educational, Game show / trivia / quiz, Licensed"
142573,Are You Smarter Than a 5th Grader?: Game Time,2009,,https://www.mobygames.com/game/142573/are-you-smarter-than-a-5th-grader-game-time/,"Game show / trivia / quiz, Licensed, Puzzle"
87257,Are You Smarter Than a 5th Grader?: Make The Grade,2008,,https://www.mobygames.com/game/87257/are-you-smarter-than-a-5th-grader-make-the-grade/,"Educational, Game show / trivia / quiz, Licensed"
38161,Arkanoid DS,2007,6.29,https://www.mobygames.com/game/38161/arkanoid-ds/,"Strategy / tactics, Arcade, Side view, Paddle / Pong, Fixed / flip-screen"
87260,Army Men: Soldiers of Misfortune,2008,5.5,https://www.mobygames.com/game/87260/army-men-soldiers-of-misfortune/,Action
51422,Around the World in 80 Days,2010,,https://www.mobygames.com/game/51422/around-the-world-in-80-days/,"Side view, Puzzle, Fixed / flip-screen, Falling block puzzle, Tile matching puzzle, Point and select, Industrial Age"
87261,Art Academy,2010,,https://www.mobygames.com/game/87261/art-academy/,"Simulation, Educational, Graphics / art"
43430,Arthur and the Invisibles: The Game,2007,6.58,https://www.mobygames.com/game/43430/arthur-and-the-invisibles-the-game/,"Action, Simulation, Arcade, Real-time, Managerial / business simulation, Licensed"
151481,Arthur and the Revenge of Maltazard,2009,,https://www.mobygames.com/game/151481/arthur-and-the-revenge-of-maltazard/,"Action, Licensed, Mini-games"
142580,ASH: Archaic Sealed Heat,2007,,https://www.mobygames.com/game/142580/ash-archaic-sealed-heat/,"Role-playing (RPG), Turn-based, 3rd-person (Other), Diagonal-down, Japanese-style RPG (JRPG), Tactical RPG"
16476,Asphalt: Urban GT,2004,6.17,https://www.mobygames.com/game/16476/asphalt-urban-gt/,"Racing / Driving, Arcade, Behind view, Vehicle simulator, Automobile, Street racing"
25820,Asphalt: Urban GT 2,2006,6.79,https://www.mobygames.com/game/25820/asphalt-urban-gt-2/,"Racing / Driving, Arcade, Behind view, Vehicle simulator, Automobile, Street racing"
58917,Assassin's Creed II: Discovery,2009,6.94,https://www.mobygames.com/game/58917/assassins-creed-ii-discovery/,"Action, Side view, Platform, Stealth, 2D scrolling"
32661,Assassin's Creed: Altaïr's Chronicles,2008,6.06,https://www.mobygames.com/game/32661/assassins-creed-altairs-chronicles/,"Action, Side view, Fantasy, Stealth, 2D scrolling, Middle East"
40171,Asterix at the Olympic Games,2007,,https://www.mobygames.com/game/40171/asterix-at-the-olympic-games/,"Action, Sports, Arcade, Side view, Licensed, Diagonal-down, Direct control"
142597,Astro Boy: The Video Game,2009,,https://www.mobygames.com/game/142597/astro-boy-the-video-game/,"Action, Side view, Shooter, Licensed, Beat 'em up / brawler, 2D scrolling, Direct control"
100311,Astro Invaders,2010,,https://www.mobygames.com/game/100311/astro-invaders/,"Action, Sci-fi / futuristic, Arcade, Side view, Shooter, Fixed / flip-screen, Space flight, Sea pirates / Caribbean"
80433,Astrology,2009,,https://www.mobygames.com/game/80433/astrology/,"Educational, Licensed, Health / nutrition, Sociology, Mental training"
79004,Astrology DS: The Stars in your Hands,2009,,https://www.mobygames.com/game/79004/astrology-ds-the-stars-in-your-hands/,"1st-person, Educational, Religion, Health / nutrition, Fixed / flip-screen, Mini-games, Point and select, Menu structures"
36165,Astérix & Obélix XXL 2: Mission: Wifix,2006,,https://www.mobygames.com/game/36165/asterix-obelix-xxl-2-mission-wifix/,"Action, Side view, Puzzle elements, Fighting, Fantasy, Licensed, 2D scrolling, Classical antiquity"
144750,Astérix: Brain Trainer,2008,,https://www.mobygames.com/game/144750/asterix-brain-trainer/,"Educational, Licensed, Mental training, Classical antiquity"
192724,Astérix: These Romans Are Crazy!,2009,,https://www.mobygames.com/game/192724/asterix-these-romans-are-crazy/,"Action, Strategy / tactics, Side view, Board game, Licensed, Turn-based, 2D scrolling, Fixed / flip-screen, Mini-games, Party game, Direct control, Classical antiquity"
53898,Atari Greatest Hits: Volume 1,2010,,https://www.mobygames.com/game/53898/atari-greatest-hits-volume-1/,Compilation
53899,Atari Greatest Hits: Volume 2,2011,,https://www.mobygames.com/game/53899/atari-greatest-hits-volume-2/,Compilation
142652,Atelier Annie: Alchemists of Sera Island,2009,,https://www.mobygames.com/game/142652/atelier-annie-alchemists-of-sera-island/,"Simulation, Managerial / business simulation, Role-playing (RPG), City building / construction simulation"
68906,Atelier Annie: Alchemists of Sera Island (Premium Box),2009,,https://www.mobygames.com/game/68906/atelier-annie-alchemists-of-sera-island-premium-box/,"Physical extras, Special edition"
52554,Atlantic Quest,2012,,https://www.mobygames.com/game/52554/atlantic-quest/,"Side view, Puzzle, Fixed / flip-screen, Falling block puzzle, Tile matching puzzle, Point and select"
201338,Atoms!,2010,,https://www.mobygames.com/game/201338/atoms/,"Strategy / tactics, Board game, Turn-based, Fixed / flip-screen"
23744,ATV Quad Frenzy,2005,4.6,https://www.mobygames.com/game/23744/atv-quad-frenzy/,"Racing / Driving, Off-roading, Behind view, Vehicle simulator"
87269,ATV Quad Kings,2010,,https://www.mobygames.com/game/87269/atv-quad-kings/,"Racing / Driving, 3rd-person (Other), Behind view, Track racing"
142680,ATV Wild Ride,2011,,https://www.mobygames.com/game/142680/atv-wild-ride/,"Racing / Driving, Off-roading, Tricks / stunts, Behind view, Direct control"
31503,ATV: Thunder Ridge Riders / Monster Trucks Mayhem,2007,,https://www.mobygames.com/game/31503/atv-thunder-ridge-riders-monster-trucks-mayhem/,"Racing / Driving, Off-roading, Compilation, Licensed, Vehicle simulator"
54334,Au pays des Pooyoos: Activités d'éveil,2009,,https://www.mobygames.com/game/54334/au-pays-des-pooyoos-activites-deveil/,"Educational, Math / logic, Reading / writing, Pre-school / toddler, Graphics / art, Licensed"
39806,Avalon Code,2008,7.09,https://www.mobygames.com/game/39806/avalon-code/,"Action, Top-down, Role-playing (RPG), Anime / Manga, Fantasy, Action RPG"
141043,Avatar: The Last Airbender,2006,6.79,https://www.mobygames.com/game/141043/avatar-the-last-airbender/,"Action, Top-down, Puzzle elements, Anime / Manga, Fantasy, Licensed, RPG elements, Asia"
142730,Avatar: The Last Airbender - Into the Inferno,2008,,https://www.mobygames.com/game/142730/avatar-the-last-airbender-into-the-inferno/,"Action, Puzzle elements, Anime / Manga, Licensed, 3rd-person (Other), Diagonal-down, Direct control"
86606,Avatar: The Last Airbender - The Burning Earth,2007,,https://www.mobygames.com/game/86606/avatar-the-last-airbender-the-burning-earth/,"Action, Anime / Manga, Fantasy, Licensed, Diagonal-down, 2D scrolling, RPG elements, Asia"
37457,Away: Shuffle Dungeon,2008,6.65,https://www.mobygames.com/game/37457/away-shuffle-dungeon/,"Action, Top-down, Puzzle elements, Role-playing (RPG), Anime / Manga, Fantasy, 3rd-person (Other)"
143009,B Team: Metal Cartoon Squad,2009,,https://www.mobygames.com/game/143009/b-team-metal-cartoon-squad/,"Action, Shooter, Diagonal-down"
31504,B-17: Fortress in the Sky,2007,5.11,https://www.mobygames.com/game/31504/b-17-fortress-in-the-sky/,"Action, 1st-person, Top-down, Flight / aviation, Shooter, World War II"
144147,Baby Life,2008,,https://www.mobygames.com/game/144147/baby-life/,"Simulation, Life / social simulation"
84999,Baby Pals,2007,,https://www.mobygames.com/game/84999/baby-pals/,"Simulation, Educational, Health / nutrition, Life / social simulation"
87272,Babysitting Mania,2008,,https://www.mobygames.com/game/87272/babysitting-mania/,"Simulation, 3rd-person (Other), Diagonal-down"
52700,The Bachelor: The Videogame,2010,,https://www.mobygames.com/game/52700/the-bachelor-the-videogame/,"Simulation, Licensed, Mini-games"
87273,Back at the Barnyard: Slop Bucket Games,2008,,https://www.mobygames.com/game/87273/back-at-the-barnyard-slop-bucket-games/,"Sports, Compilation"
41576,Backgammon,2009,,https://www.mobygames.com/game/41576/backgammon/,"Strategy / tactics, Top-down, Board game"
44460,Backyard Baseball '09,2008,,https://www.mobygames.com/game/44460/backyard-baseball-09/,"Sports, Top-down, Baseball, 3rd-person (Other)"
52698,Backyard Baseball '10,2009,,https://www.mobygames.com/game/52698/backyard-baseball-10/,"Sports, Top-down, Baseball, 3rd-person (Other)"
24509,Backyard Basketball 2007,2007,,https://www.mobygames.com/game/24509/backyard-basketball-2007/,"Sports, Side view, Basketball, Licensed"
142731,Backyard Football,2007,,https://www.mobygames.com/game/142731/backyard-football/,"Sports, Football (American), Licensed, Diagonal-down"
87275,Backyard Football '09,2008,,https://www.mobygames.com/game/87275/backyard-football-09/,"Sports, Football (American)"
87276,Backyard Hockey,2007,,https://www.mobygames.com/game/87276/backyard-hockey/,"Sports, Hockey"
142747,Backyard Sports: Rookie Rush,2010,,https://www.mobygames.com/game/142747/backyard-sports-rookie-rush/,"Sports, Football (American)"
87277,Backyard Sports: Sandlot Sluggers,2010,,https://www.mobygames.com/game/87277/backyard-sports-sandlot-sluggers/,"Sports, Baseball"
78199,The Backyardigans,2009,,https://www.mobygames.com/game/78199/the-backyardigans/,"Educational, Math / logic, Pre-school / toddler, Music, Licensed, Music / rhythm, Puzzle, 3rd-person (Other)"
194030,Bae Yong-joon to Manabu Kankoku-go DS,2009,,https://www.mobygames.com/game/194030/bae-yong-joon-to-manabu-kankoku-go-ds/,"Educational, Foreign language, Fixed / flip-screen, Point and select"
85214,Bakugan: Battle Brawlers,2009,,https://www.mobygames.com/game/85214/bakugan-battle-brawlers/,"Action, Strategy / tactics, Anime / Manga, Licensed, Turn-based, Trading / collectible card"
136647,Bakugan: Battle Brawlers (Battle Pack),2009,,https://www.mobygames.com/game/136647/bakugan-battle-brawlers-battle-pack/,"Physical extras, Special edition"
136646,Bakugan: Battle Brawlers (Collector's Edition),2009,,https://www.mobygames.com/game/136646/bakugan-battle-brawlers-collectors-edition/,"Physical extras, Special edition"
87278,Bakugan: Battle Trainer,2010,,https://www.mobygames.com/game/87278/bakugan-battle-trainer/,"Action, Role-playing (RPG), Anime / Manga, Licensed"
90587,Bakugan: Defenders of the Core,2010,,https://www.mobygames.com/game/90587/bakugan-defenders-of-the-core/,"Action, Anime / Manga, Licensed, 3rd-person (Other)"
142751,Bakugan: Defenders of the Core (Limited Edition),2010,,https://www.mobygames.com/game/142751/bakugan-defenders-of-the-core-limited-edition/,"Physical extras, Special edition"
87280,Bakugan: Rise of the Resistance,2011,,https://www.mobygames.com/game/87280/bakugan-rise-of-the-resistance/,"Action, Role-playing (RPG), Anime / Manga, Licensed, Diagonal-down, Tower defense"
85489,Balloon Pop,2009,,https://www.mobygames.com/game/85489/balloon-pop/,"Action, Puzzle, Tile matching puzzle"
31442,Balls of Fury,2007,5.91,https://www.mobygames.com/game/31442/balls-of-fury/,"Action, Sports, 1st-person, Licensed, Ping pong / table tennis"
69482,Band Hero,2009,6.94,https://www.mobygames.com/game/69482/band-hero/,"Action, Simulation, Music / rhythm, 3rd-person (Other)"
36363,Bangai-O Spirits,2008,8.11,https://www.mobygames.com/game/36363/bangai-o-spirits/,"Action, Sci-fi / futuristic, Arcade, Side view, Shooter, Anime / Manga, Mecha / giant robot"
