ID,Title,Release Year,Moby Score,URL,Genres
39729,Peggle: Dual Shot,2009,7.99,https://www.mobygames.com/game/39729/peggle-dual-shot/,"Strategy / tactics, Side view"
90439,The Penguins of Madagascar,2010,,https://www.mobygames.com/game/90439/the-penguins-of-madagascar/,"Action, Licensed, Mini-games"
90440,The Penguins of Madagascar: Dr. Blowhole Returns Again!,2011,,https://www.mobygames.com/game/90440/the-penguins-of-madagascar-dr-blowhole-returns-again/,"Action, Puzzle elements, Fantasy, Licensed, 3rd-person (Other), 2D scrolling, Direct control, Motion control"
143187,Peppa Pig: Fun and Games,2010,,https://www.mobygames.com/game/143187/peppa-pig-fun-and-games/,"Educational, Side view, Pre-school / toddler, Licensed, Mini-games"
128841,Peppa Pig: The Game,2009,,https://www.mobygames.com/game/128841/peppa-pig-the-game/,"Educational, Side view, Pre-school / toddler, Licensed"
51371,Percy Jackson and The Olympians: The Lightning Thief,2010,,https://www.mobygames.com/game/51371/percy-jackson-and-the-olympians-the-lightning-thief/,"Role-playing (RPG), Fantasy, Licensed, Turn-based, 3rd-person (Other)"
86588,Personal Trainer: Math,2008,,https://www.mobygames.com/game/86588/personal-trainer-math/,"1st-person, Educational, Math / logic"
89640,Personal Trainer: Walking,2009,,https://www.mobygames.com/game/89640/personal-trainer-walking/,"Educational, Health / nutrition"
157823,PES 2008: Pro Evolution Soccer,2008,,https://www.mobygames.com/game/157823/pes-2008-pro-evolution-soccer/,"Sports, Football (European) / Soccer"
156957,Pet Adoption Center,2008,,https://www.mobygames.com/game/156957/pet-adoption-center/,Simulation
89641,Pet Alien: An Intergalactic Puzzlepalooza,2007,,https://www.mobygames.com/game/89641/pet-alien-an-intergalactic-puzzlepalooza/,"Action, Licensed, Puzzle, Diagonal-down, Direct control"
89643,Pet Pals: Animal Doctor,2008,,https://www.mobygames.com/game/89643/pet-pals-animal-doctor/,Simulation
89642,Pet Pals: New Leash on Life,2010,,https://www.mobygames.com/game/89642/pet-pals-new-leash-on-life/,Simulation
89644,Pet Vet: Down Under,2009,,https://www.mobygames.com/game/89644/pet-vet-down-under/,"Simulation, Oceania"
30999,Peter Jackson's King Kong: The Official Game of the Movie,2005,4.4,https://www.mobygames.com/game/30999/peter-jacksons-king-kong-the-official-game-of-the-movie/,"Action, 1st-person, Shooter, Licensed, 3rd-person (Other), Interwar"
175028,Peter Pan,2008,,https://www.mobygames.com/game/175028/peter-pan/,"Puzzle, Mini-games"
183464,Petit Eva: Evangelion @ Game,2008,,https://www.mobygames.com/game/183464/petit-eva-evangelion-game/,"Action, Side view, Puzzle elements, Anime / Manga, Licensed, Puzzle, Comedy, 2D scrolling, Fixed / flip-screen, Dating simulation, Mini-games, Point and select, Japan (Modern/Futuristic)"
157119,Petz Fantasy: Moonlight Magic,2010,,https://www.mobygames.com/game/157119/petz-fantasy-moonlight-magic/,"Simulation, Mini-games"
157117,Petz Fantasy: Sunshine Magic,2010,,https://www.mobygames.com/game/157117/petz-fantasy-sunshine-magic/,"Simulation, Mini-games"
89766,Petz Fashion: Dogz and Catz,2009,,https://www.mobygames.com/game/89766/petz-fashion-dogz-and-catz/,Simulation
85001,Petz Rescue: Endangered Paradise,2008,,https://www.mobygames.com/game/85001/petz-rescue-endangered-paradise/,"Simulation, Educational, Ecology / nature"
89772,Petz Rescue: Ocean Patrol,2008,,https://www.mobygames.com/game/89772/petz-rescue-ocean-patrol/,Simulation
89773,Petz Rescue: Wildlife Vet,2008,,https://www.mobygames.com/game/89773/petz-rescue-wildlife-vet/,"Simulation, 1st-person, Real-time, 3rd-person (Other), Point and select, Contemporary"
33532,Petz: Bunnyz,2008,,https://www.mobygames.com/game/33532/petz-bunnyz/,"Simulation, 3rd-person (Other)"
157159,Petz: Bunnyz Bunch,2011,,https://www.mobygames.com/game/157159/petz-bunnyz-bunch/,Simulation
34015,Petz: Catz 2,2007,,https://www.mobygames.com/game/34015/petz-catz-2/,"Simulation, 3rd-person (Other)"
89760,Petz: Catz Clan,2008,,https://www.mobygames.com/game/89760/petz-catz-clan/,Simulation
157225,Petz: Catz Playground,2010,,https://www.mobygames.com/game/157225/petz-catz-playground/,Simulation
33502,Petz: Dogz 2,2006,,https://www.mobygames.com/game/33502/petz-dogz-2/,"Simulation, Cards / tiles, Puzzle elements, 3rd-person (Other)"
89763,Petz: Dogz Fashion,2007,,https://www.mobygames.com/game/89763/petz-dogz-fashion/,Simulation
89764,Petz: Dogz Pack,2008,,https://www.mobygames.com/game/89764/petz-dogz-pack/,Simulation
87606,Petz: Dogz Talent Show,2009,,https://www.mobygames.com/game/87606/petz-dogz-talent-show/,"Action, Simulation, 1st-person"
89765,Petz: Dolphinz Encounter,2009,,https://www.mobygames.com/game/89765/petz-dolphinz-encounter/,Simulation
34135,Petz: Hamsterz 2,2006,,https://www.mobygames.com/game/34135/petz-hamsterz-2/,"Simulation, 3rd-person (Other)"
89768,Petz: Hamsterz Superstarz,2009,,https://www.mobygames.com/game/89768/petz-hamsterz-superstarz/,Simulation
89769,Petz: Horseshoe Ranch,2009,,https://www.mobygames.com/game/89769/petz-horseshoe-ranch/,Simulation
34137,Petz: Horsez 2,2007,,https://www.mobygames.com/game/34137/petz-horsez-2/,"Simulation, Sports, Horse / derby, 3rd-person (Other)"
157286,Petz: Horsez Family,2010,,https://www.mobygames.com/game/157286/petz-horsez-family/,Simulation
67524,Petz: Monkeyz House,2008,,https://www.mobygames.com/game/67524/petz-monkeyz-house/,"Simulation, 3rd-person (Other)"
89770,Petz: Nursery,2009,,https://www.mobygames.com/game/89770/petz-nursery/,Simulation
157346,Petz: Nursery 2,2010,,https://www.mobygames.com/game/157346/petz-nursery-2/,Simulation
89771,Petz: Pony Beauty Pageant,2009,,https://www.mobygames.com/game/89771/petz-pony-beauty-pageant/,Simulation
157406,Petz: Puppyz & Kittenz,2011,,https://www.mobygames.com/game/157406/petz-puppyz-kittenz/,Simulation
34027,Petz: Wild Animals - Dolphinz,2007,,https://www.mobygames.com/game/34027/petz-wild-animals-dolphinz/,"Simulation, Managerial / business simulation, 3rd-person (Other)"
33613,Petz: Wild Animals - Tigerz,2008,,https://www.mobygames.com/game/33613/petz-wild-animals-tigerz/,"Simulation, 3rd-person (Other)"
51668,Phantasy Star Ø,2008,7.19,https://www.mobygames.com/game/51668/phantasy-star-ø/,"Sci-fi / futuristic, Role-playing (RPG), Anime / Manga, 3rd-person (Other)"
224053,Pharaoh’s Golden Amulet,2010,,https://www.mobygames.com/game/224053/pharaohs-golden-amulet/,"Hidden object, Puzzle, Egypt (Ancient)"
159459,Phil Taylor's Power Play Darts,2011,,https://www.mobygames.com/game/159459/phil-taylors-power-play-darts/,"Sports, 1st-person, Licensed, Darts / target shooting"
89774,Phineas and Ferb,2009,,https://www.mobygames.com/game/89774/phineas-and-ferb/,"Action, Racing / Driving, Platform, Fantasy, Licensed, Puzzle, 3rd-person (Other), 2D scrolling, Mini-games, Direct control"
89775,Phineas and Ferb: Across the 2nd Dimension,2011,,https://www.mobygames.com/game/89775/phineas-and-ferb-across-the-2nd-dimension/,"Action, 3rd-person (Other)"
89881,Phineas and Ferb: Quest for Cool Stuff,2013,,https://www.mobygames.com/game/89881/phineas-and-ferb-quest-for-cool-stuff/,"Action, Side view, Platform, Licensed, 2D scrolling"
144281,Phineas and Ferb: Ride Again,2010,,https://www.mobygames.com/game/144281/phineas-and-ferb-ride-again/,"Action, Side view, Platform, Licensed, 2D scrolling, Direct control"
20581,Phoenix Wright: Ace Attorney,2005,8.2,https://www.mobygames.com/game/20581/phoenix-wright-ace-attorney/,"Adventure, Simulation, 1st-person, Puzzle elements, Detective / mystery, Anime / Manga"
24748,Phoenix Wright: Ace Attorney - Justice for All,2006,7.74,https://www.mobygames.com/game/24748/phoenix-wright-ace-attorney-justice-for-all/,"Adventure, Simulation, 1st-person, Puzzle elements, Detective / mystery, Anime / Manga"
29944,Phoenix Wright: Ace Attorney - Trials and Tribulations,2007,8.01,https://www.mobygames.com/game/29944/phoenix-wright-ace-attorney-trials-and-tribulations/,"Adventure, Simulation, 1st-person, Puzzle elements, Detective / mystery, Anime / Manga"
51971,Photo Phantasy: Spot the Differences,2011,,https://www.mobygames.com/game/51971/photo-phantasy-spot-the-differences/,"Hidden object, Puzzle, Point and select"
160239,Pic Pic,2007,,https://www.mobygames.com/game/160239/pic-pic/,"Puzzle, Fixed / flip-screen, Point and select"
46970,Picross 3D,2009,7.99,https://www.mobygames.com/game/46970/picross-3d/,"Strategy / tactics, Point and select"
26428,Picross DS,2007,8.07,https://www.mobygames.com/game/26428/picross-ds/,"Top-down, Puzzle, 2D scrolling, Point and select"
127893,Pictionary,2010,,https://www.mobygames.com/game/127893/pictionary/,"Board game, Licensed, Turn-based, Puzzle, Fixed / flip-screen, Party game"
89777,PictoImage,2007,,https://www.mobygames.com/game/89777/pictoimage/,Puzzle
157449,Picture Puzzle Collection,2010,,https://www.mobygames.com/game/157449/picture-puzzle-collection/,Puzzle
89782,Pillow Pets,2011,,https://www.mobygames.com/game/89782/pillow-pets/,"Action, Side view, 3rd-person (Other)"
89783,Pimp My Ride: Street Racing,2009,,https://www.mobygames.com/game/89783/pimp-my-ride-street-racing/,"Racing / Driving, Licensed, 3rd-person (Other), Behind view, Automobile, Street racing"
31046,Ping Pals,2004,3.84,https://www.mobygames.com/game/31046/ping-pals/,Action
89785,Pinkalicious: It's Party Time,2011,,https://www.mobygames.com/game/89785/pinkalicious-its-party-time/,"Simulation, Licensed, Mini-games"
123994,Pinkalicious: It's Party Time / Silverlicious: Sweet Adventure,2013,,https://www.mobygames.com/game/123994/pinkalicious-its-party-time-silverlicious-sweet-adventure/,Compilation
28210,Pinky Street: Kira Kira Music Hour (Limited Edition),2006,,https://www.mobygames.com/game/28210/pinky-street-kira-kira-music-hour-limited-edition/,"Action, Simulation, Anime / Manga, Compilation, Licensed, Music / rhythm, 3rd-person (Other)"
41058,Pinocchio,,,https://www.mobygames.com/game/41058/pinocchio/,"Top-down, Cards / tiles, Turn-based, Puzzle, Tile matching puzzle, Point and select"
44072,Pipe Mania,2008,7.22,https://www.mobygames.com/game/44072/pipe-mania/,"Top-down, Real-time, Puzzle, Point and select"
77561,Pippi Långstrump,2012,6.77,https://www.mobygames.com/game/77561/pippi-langstrump/,"Action, Puzzle elements, Licensed, Diagonal-down"
23075,Pirates of the Caribbean: Dead Man's Chest,2006,6.32,https://www.mobygames.com/game/23075/pirates-of-the-caribbean-dead-mans-chest/,"Action, Licensed, 3rd-person (Other)"
86668,Pirates: Duels on the High Seas,2009,,https://www.mobygames.com/game/86668/pirates-duels-on-the-high-seas/,"Action, Top-down, Shooter, Naval / watercraft, Sea pirates / Caribbean"
89787,Planet 51: The Game,2009,,https://www.mobygames.com/game/89787/planet-51-the-game/,"Action, Licensed, Behind view"
31709,Planet Puzzle League,2007,8.3,https://www.mobygames.com/game/31709/planet-puzzle-league/,"Real-time, Side view, Puzzle, Fixed / flip-screen, Falling block puzzle, Tile matching puzzle, Point and select"
40621,Plants vs. Zombies,2011,7.89,https://www.mobygames.com/game/40621/plants-vs-zombies/,"Strategy / tactics, Real-time, Fantasy, Diagonal-down, Tower defense"
37483,Platinum Sudoku,2007,7.29,https://www.mobygames.com/game/37483/platinum-sudoku/,"Top-down, Puzzle"
157492,Playmobil Knights,2010,,https://www.mobygames.com/game/157492/playmobil-knights/,"Action, Top-down, Side view, Fantasy, Licensed, Mini-games, RPG elements, Direct control, Medieval"
143678,Playmobil Pirates,2008,,https://www.mobygames.com/game/143678/playmobil-pirates/,"Action, Side view, Platform, Puzzle elements, Naval / watercraft, Licensed, 2D scrolling, Mini-games, Sea pirates / Caribbean"
157592,Playmobil Top Agents,2010,,https://www.mobygames.com/game/157592/playmobil-top-agents/,"Action, Racing / Driving, Top-down, Side view, Licensed, Spy / espionage, 2D scrolling, Direct control"
40782,Pluk van de Petteflet,2009,,https://www.mobygames.com/game/40782/pluk-van-de-petteflet/,"1st-person, Educational, Math / logic, Reading / writing, Pre-school / toddler, Graphics / art, Licensed, 3rd-person (Other)"
89790,Plushees,2008,,https://www.mobygames.com/game/89790/plushees/,"Action, Mini-games"
100277,Pocoyó Racing,2012,,https://www.mobygames.com/game/100277/pocoyo-racing/,"Racing / Driving, Fantasy, Licensed, Behind view, Direct control, Automobile, Track racing"
70879,Pogo Island,2007,,https://www.mobygames.com/game/70879/pogo-island/,Compilation
24050,Point Blank DS,2006,6.88,https://www.mobygames.com/game/24050/point-blank-ds/,"Action, 1st-person, Arcade, Shooter"
50752,Pokémon Black Version,2010,8.46,https://www.mobygames.com/game/50752/pokemon-black-version/,"Role-playing (RPG), Fantasy, Turn-based, Diagonal-down, Japanese-style RPG (JRPG)"
59629,Pokémon Black Version 2,2012,7.97,https://www.mobygames.com/game/59629/pokemon-black-version-2/,"Role-playing (RPG), Anime / Manga, Fantasy, Turn-based, Diagonal-down, Japanese-style RPG (JRPG)"
55779,Pokémon Card Game: Asobikata DS,2011,,https://www.mobygames.com/game/55779/pokemon-card-game-asobikata-ds/,"Strategy / tactics, 1st-person, Turn-based, Trading / collectible card"
60206,Pokémon Conquest,2012,7.83,https://www.mobygames.com/game/60206/pokemon-conquest/,"Strategy / tactics, Isometric, Role-playing (RPG), Anime / Manga, Fantasy, Turn-based, War, Diagonal-down, Tactical RPG"
24898,Pokémon Dash,2004,5.67,https://www.mobygames.com/game/24898/pokemon-dash/,"Racing / Driving, Top-down, Fantasy, 2D scrolling"
79267,Pokémon Diamond & Pokémon Pearl DS Lite Bundle,2007,,https://www.mobygames.com/game/79267/pokemon-diamond-pokemon-pearl-ds-lite-bundle/,"Compilation, Physical extras, Special edition"
27727,Pokémon Diamond Version,2006,8.05,https://www.mobygames.com/game/27727/pokemon-diamond-version/,"Role-playing (RPG), Anime / Manga, Fantasy, Turn-based, Diagonal-down, Japanese-style RPG (JRPG)"
44513,Pokémon HeartGold Version,2009,8.52,https://www.mobygames.com/game/44513/pokemon-heartgold-version/,"Role-playing (RPG), Fantasy, Turn-based, Diagonal-down, Japanese-style RPG (JRPG), Regional differences"
24322,Pokémon Mystery Dungeon: Blue Rescue Team,2005,6.74,https://www.mobygames.com/game/24322/pokemon-mystery-dungeon-blue-rescue-team/,"Role-playing (RPG), Anime / Manga, Diagonal-down, Roguelike"
38532,Pokémon Mystery Dungeon: Explorers of Darkness,2007,6.49,https://www.mobygames.com/game/38532/pokemon-mystery-dungeon-explorers-of-darkness/,"Role-playing (RPG), Fantasy, Turn-based, Diagonal-down, Roguelike"
45482,Pokémon Mystery Dungeon: Explorers of Sky,2009,5.91,https://www.mobygames.com/game/45482/pokemon-mystery-dungeon-explorers-of-sky/,"Role-playing (RPG), Fantasy, Diagonal-down, Roguelike"
38531,Pokémon Mystery Dungeon: Explorers of Time,2007,6.46,https://www.mobygames.com/game/38531/pokemon-mystery-dungeon-explorers-of-time/,"Role-playing (RPG), Fantasy, Turn-based, Diagonal-down, Roguelike"
27755,Pokémon Pearl Version,2006,8.16,https://www.mobygames.com/game/27755/pokemon-pearl-version/,"Role-playing (RPG), Anime / Manga, Fantasy, Turn-based, Diagonal-down, Japanese-style RPG (JRPG)"
41397,Pokémon Platinum Version,2008,7.97,https://www.mobygames.com/game/41397/pokemon-platinum-version/,"Role-playing (RPG), Fantasy, Turn-based, Diagonal-down, Japanese-style RPG (JRPG)"
24889,Pokémon Ranger,2006,6.68,https://www.mobygames.com/game/24889/pokemon-ranger/,"Action, Isometric, Fantasy, Diagonal-down, RPG elements"
48934,Pokémon Ranger: Guardian Signs,2010,7.17,https://www.mobygames.com/game/48934/pokemon-ranger-guardian-signs/,"Action, Sci-fi / futuristic, Fantasy, Diagonal-down, RPG elements"
38538,Pokémon Ranger: Shadows of Almia,2008,6.75,https://www.mobygames.com/game/38538/pokemon-ranger-shadows-of-almia/,"Action, Fantasy, Diagonal-down, RPG elements"
44546,Pokémon SoulSilver Version,2009,8.61,https://www.mobygames.com/game/44546/pokemon-soulsilver-version/,"Role-playing (RPG), Fantasy, Turn-based, Diagonal-down, Japanese-style RPG (JRPG), Regional differences"
21634,Pokémon Trozei!,2005,6.71,https://www.mobygames.com/game/21634/pokemon-trozei/,"Real-time, Side view, Fantasy, Puzzle, Fixed / flip-screen, Falling block puzzle, Tile matching puzzle, Point and select"
50753,Pokémon White Version,2010,8.25,https://www.mobygames.com/game/50753/pokemon-white-version/,"Role-playing (RPG), Fantasy, Turn-based, Diagonal-down, Japanese-style RPG (JRPG)"
58348,Pokémon White Version 2,2012,8.0,https://www.mobygames.com/game/58348/pokemon-white-version-2/,"Role-playing (RPG), Anime / Manga, Fantasy, Turn-based, Japanese-style RPG (JRPG)"
72072,PokéPark: Asari Taikai DS,2005,,https://www.mobygames.com/game/72072/pokepark-asari-taikai-ds/,"Sports, Fishing, Anime / Manga"
12902,Polar Bowler,2008,,https://www.mobygames.com/game/12902/polar-bowler/,"Action, Sports, Bowling, 3rd-person (Other)"
17402,Polarium,2004,7.27,https://www.mobygames.com/game/17402/polarium/,"Real-time, Puzzle, Falling block puzzle"
35143,Pony Friends,2007,7.09,https://www.mobygames.com/game/35143/pony-friends/,"Simulation, Real-time, 3rd-person (Other)"
60542,Pony Friends 2,2010,,https://www.mobygames.com/game/60542/pony-friends-2/,"Simulation, Sports, Horse / derby, 3rd-person (Other)"
157691,Pony Friends: Now With 6 New Mini Breed Ponies,2008,,https://www.mobygames.com/game/157691/pony-friends-now-with-6-new-mini-breed-ponies/,Simulation
96012,Pony Luv,2008,,https://www.mobygames.com/game/96012/pony-luv/,"Simulation, Managerial / business simulation"
37405,Pop Cutie! Street Fashion Simulation,2008,,https://www.mobygames.com/game/37405/pop-cutie-street-fashion-simulation/,"Simulation, Real-time, Isometric, Managerial / business simulation, Anime / Manga"
89794,Poptropica Adventures,2012,,https://www.mobygames.com/game/89794/poptropica-adventures/,"Action, Side view"
54622,Populous DS,2008,6.11,https://www.mobygames.com/game/54622/populous-ds/,"Strategy / tactics, Real-time, Isometric, Managerial / business simulation, Diagonal-down"
159503,Postman Pat,2008,,https://www.mobygames.com/game/159503/postman-pat/,"Action, Licensed, Mini-games"
149816,Postman Pat: Special Delivery Service,2009,,https://www.mobygames.com/game/149816/postman-pat-special-delivery-service/,"Licensed, Puzzle, Fixed / flip-screen, Mini-games, Point and select"
51894,Powder,2007,,https://www.mobygames.com/game/51894/powder/,"Top-down, Role-playing (RPG), Turn-based, Roguelike"
157757,Power Play Pool,2007,,https://www.mobygames.com/game/157757/power-play-pool/,"Sports, 1st-person, Top-down, Pool / snooker, Direct control"
36916,Power Quiz: Allgemeinbildung,2008,,https://www.mobygames.com/game/36916/power-quiz-allgemeinbildung/,"Educational, Board game, Game show / trivia / quiz, Reading / writing, Music, Paddle / Pong, Geography, History, Graphics / art, Ecology / nature, Licensed, Religion, Foreign language, Science, Health / nutrition, Sociology"
49362,Power Quiz: Die Sport-Edition - D:SF,2009,,https://www.mobygames.com/game/49362/power-quiz-die-sport-edition-dsf/,"Educational, Board game, Game show / trivia / quiz, Basketball, Olympiad / mixed sports, Football (European) / Soccer, Paddle / Pong, Licensed"
49364,Power Quiz: GEOlino,2009,,https://www.mobygames.com/game/49364/power-quiz-geolino/,"Educational, Board game, Game show / trivia / quiz, Paddle / Pong, Geography, History, Graphics / art, Ecology / nature, Science, Health / nutrition"
89795,Power Rangers: Samurai,2011,,https://www.mobygames.com/game/89795/power-rangers-samurai/,"Action, Side view, Fantasy, Licensed"
142982,Power Rangers: Super Legends - 15th Anniversary,2007,,https://www.mobygames.com/game/142982/power-rangers-super-legends-15th-anniversary/,"Action, Side view, Platform, Puzzle elements, Fantasy, Licensed, Beat 'em up / brawler, 2D scrolling"
89796,Powerbike,2009,,https://www.mobygames.com/game/89796/powerbike/,"Racing / Driving, Motorcycle, 3rd-person (Other), Behind view"
142865,Powerplay Tennis,2007,,https://www.mobygames.com/game/142865/powerplay-tennis/,"Sports, Tennis, Diagonal-down"
143673,Powershot Pinball Constructor,2008,,https://www.mobygames.com/game/143673/powershot-pinball-constructor/,"Action, Simulation, Arcade, Top-down, Pinball, City building / construction simulation, Mini-games"
43774,Press Your Luck: 2010 Edition,2009,,https://www.mobygames.com/game/43774/press-your-luck-2010-edition/,"Strategy / tactics, Game show / trivia / quiz, Licensed, 3rd-person (Other)"
85497,Prey the Stars,2008,,https://www.mobygames.com/game/85497/prey-the-stars/,"Action, Fantasy, Puzzle"
144463,The Price is Right / Rayman: Raving Rabbids,2009,,https://www.mobygames.com/game/144463/the-price-is-right-rayman-raving-rabbids/,Compilation
90441,The Price Is Right,2008,,https://www.mobygames.com/game/90441/the-price-is-right/,"Simulation, Game show / trivia / quiz, Licensed, Mini-games"
43773,The Price is Right: 2010 Edition,2009,,https://www.mobygames.com/game/43773/the-price-is-right-2010-edition/,"Strategy / tactics, Game show / trivia / quiz, Licensed, 3rd-person (Other)"
73563,Prince of Persia: The Fallen King,2008,,https://www.mobygames.com/game/73563/prince-of-persia-the-fallen-king/,"Action, Side view, Platform, Fantasy, 2D scrolling, Middle East"
69043,Prince of Persia: The Forgotten Sands,2010,6.57,https://www.mobygames.com/game/69043/prince-of-persia-the-forgotten-sands/,"Action, Side view, Platform, Fantasy, Middle East"
81403,The Princess and the Frog,2009,,https://www.mobygames.com/game/81403/the-princess-and-the-frog/,"Action, Platform, Puzzle elements, Licensed, North America"
162940,The Princess and the Frog: Taste of New Orleans Edition,2009,,https://www.mobygames.com/game/162940/the-princess-and-the-frog-taste-of-new-orleans-edition/,"Extra content / game, Special edition"
65612,Princess Debut,2008,6.9,https://www.mobygames.com/game/65612/princess-debut/,"1st-person, Managerial / business simulation, Role-playing (RPG), Anime / Manga, Music / rhythm, Visual novel, 3rd-person (Other)"
40741,Princess in Love,2009,,https://www.mobygames.com/game/40741/princess-in-love/,"Adventure, Top-down, 3rd-person (Other)"
42327,Princess Isabella: A Witch's Curse,2010,,https://www.mobygames.com/game/42327/princess-isabella-a-witchs-curse/,"1st-person, Fantasy, Hidden object, Puzzle"
31622,Princess Natasha: Student • Secret Agent • Princess,2006,,https://www.mobygames.com/game/31622/princess-natasha-student-secret-agent-princess/,"Action, Side view, Platform, Licensed, 2D scrolling"
89797,Princess on Ice,2008,,https://www.mobygames.com/game/89797/princess-on-ice/,"Action, Simulation, Sports, Music / rhythm, Regional differences"
159803,Prinzessin Lillifee: Spielesammlung,2012,,https://www.mobygames.com/game/159803/prinzessin-lillifee-spielesammlung/,Compilation
26949,Prism: Light the Way,2007,7.07,https://www.mobygames.com/game/26949/prism-light-the-way/,"Action, Arcade, Top-down, Puzzle"
161485,Pro Yakyū Team o Tsukurō!,2008,,https://www.mobygames.com/game/161485/pro-yakyu-team-o-tsukuro/,"Simulation, Sports, Baseball, Managerial / business simulation, Anime / Manga, Licensed, Turn-based, Direct control, Japan (Modern/Futuristic)"
142655,Professional Fisherman's Tour: Northern Hemisphere,2007,,https://www.mobygames.com/game/142655/professional-fishermans-tour-northern-hemisphere/,"Sports, Fishing, 3rd-person (Other), Direct control"
157846,Professor Brainium's Games,2007,,https://www.mobygames.com/game/157846/professor-brainiums-games/,"Puzzle, Fixed / flip-screen, Point and select"
44905,Professor Heinz Wolff's Gravity,2008,5.81,https://www.mobygames.com/game/44905/professor-heinz-wolffs-gravity/,"Puzzle, 3rd-person (Other)"
32910,Professor Layton and the Curious Village,2007,8.44,https://www.mobygames.com/game/32910/professor-layton-and-the-curious-village/,"1st-person, Detective / mystery, Puzzle, 3rd-person (Other), 2D scrolling, Fixed / flip-screen, Point and select, Europe, Steampunk, Regional differences"
42715,Professor Layton and the Diabolical Box,2007,8.23,https://www.mobygames.com/game/42715/professor-layton-and-the-diabolical-box/,"1st-person, Real-time, Detective / mystery, Puzzle, 3rd-person (Other), 2D scrolling, Mini-games, Point and select, Europe"
53342,Professor Layton and the Last Specter,2009,8.11,https://www.mobygames.com/game/53342/professor-layton-and-the-last-specter/,"Detective / mystery, Puzzle, Regional differences"
47849,Professor Layton and the Unwound Future,2008,8.34,https://www.mobygames.com/game/47849/professor-layton-and-the-unwound-future/,"1st-person, Sci-fi / futuristic, Detective / mystery, Puzzle, Point and select, Europe, Regional differences"
143903,Pucca Power Up,2010,,https://www.mobygames.com/game/143903/pucca-power-up/,"Action, Side view, Platform, Puzzle elements, Anime / Manga, Licensed, 2D scrolling"
157923,Puchi Puchi Virus,2007,,https://www.mobygames.com/game/157923/puchi-puchi-virus/,"Anime / Manga, Puzzle, Fixed / flip-screen, Point and select"
68462,Puffins: Island Adventure,2009,,https://www.mobygames.com/game/68462/puffins-island-adventure/,"Action, Top-down, 3rd-person (Other)"
89800,Puppy Luv: Spa and Resort,2007,,https://www.mobygames.com/game/89800/puppy-luv-spa-and-resort/,"Simulation, Real-time, Side view, Fixed / flip-screen, Life / social simulation, Menu structures, Contemporary"
87380,Puppy Palace,2008,,https://www.mobygames.com/game/87380/puppy-palace/,"Action, Simulation, 1st-person, Managerial / business simulation, Mini-games"
152813,Purr Pals,2007,,https://www.mobygames.com/game/152813/purr-pals/,Simulation
18065,Puyo Pop Fever,2004,7.25,https://www.mobygames.com/game/18065/puyo-pop-fever/,"Real-time, Side view, Anime / Manga, Puzzle, Fixed / flip-screen, Falling block puzzle, Direct control"
54938,Puyo Puyo 7,2009,,https://www.mobygames.com/game/54938/puyo-puyo-7/,"Real-time, Side view, Puzzle, Fixed / flip-screen, Falling block puzzle, Direct control"
