ID,Title,Release Year,Moby Score,URL,Genres
208424,"""Sento Monogatari"" Sono I",1995,,https://www.mobygames.com/game/208424/sento-monogatari-sono-i/,"Simulation, Cards / tiles, Compilation, Party game"
213700,2Tax Gold,1997,,https://www.mobygames.com/game/213700/2tax-gold/,"Strategy / tactics, Game show / trivia / quiz, Comedy"
45153,3 Free Games,1996,,https://www.mobygames.com/game/45153/3-free-games/,Compilation
38220,3D Baseball,1996,,https://www.mobygames.com/game/38220/3d-baseball/,"Sports, Baseball, Licensed, Behind view"
13857,3x3 Eyes: Kyūsei Kōshu S,1996,,https://www.mobygames.com/game/13857/3x3-eyes-kyusei-koshu-s/,"Adventure, 1st-person, Anime / Manga, Licensed"
70946,6 Inch My Darling,1998,,https://www.mobygames.com/game/70946/6-inch-my-darling/,"Adventure, 1st-person, Anime / Manga, Fantasy, Visual novel, Romance"
20600,Actua Soccer: Club Edition,1997,,https://www.mobygames.com/game/20600/actua-soccer-club-edition/,"Sports, Football (European) / Soccer, Licensed, Diagonal-down"
48691,Advanced V.G.,1997,,https://www.mobygames.com/game/48691/advanced-vg/,"Action, Side view, Fighting, Anime / Manga"
51337,Advanced V.G. (Genteiban),1997,,https://www.mobygames.com/game/51337/advanced-vg-genteiban/,"Physical extras, Special edition"
217819,Advanced World War: Sennen Teikoku no Kōbō - Last of the Millennium,1997,,https://www.mobygames.com/game/217819/advanced-world-war-sennen-teikoku-no-kobo-last-of-the-millennium/,"Strategy / tactics, Top-down, Historical events, Turn-based, War, World War II"
223135,Adventure Pack: Nanatsu no Hikan & Myst,1997,,https://www.mobygames.com/game/223135/adventure-pack-nanatsu-no-hikan-myst/,Compilation
7009,After Burner II,1996,,https://www.mobygames.com/game/7009/after-burner-ii/,"Action, Arcade, Flight / aviation, Shooter, Behind view"
218448,AI Igo,1997,,https://www.mobygames.com/game/218448/ai-igo/,"Strategy / tactics, Top-down, Board game"
223289,Ai Iijima Interactive Video Clip: Good Island Cafe,1996,,https://www.mobygames.com/game/223289/ai-iijima-interactive-video-clip-good-island-cafe/,"Action, 1st-person, Real-time, Full Motion Video (FMV), Licensed, Live action"
180864,AI Shōgi,1995,,https://www.mobygames.com/game/180864/ai-shogi/,"Strategy / tactics, Chess, Top-down, Turn-based, Fixed / flip-screen, Direct control, Japan (Modern/Futuristic)"
218449,AI Shōgi 2,1998,,https://www.mobygames.com/game/218449/ai-shogi-2/,"Strategy / tactics, Top-down, Board game, Turn-based"
35114,Air Management '96,1996,,https://www.mobygames.com/game/35114/air-management-96/,"Simulation, Flight / aviation, Managerial / business simulation, Turn-based, 3rd-person (Other)"
11477,Airs Adventure,1996,,https://www.mobygames.com/game/11477/airs-adventure/,"Role-playing (RPG), Fantasy, Diagonal-down"
51389,Albert Odyssey Gaiden: Legend of Eldean (Shokai Press Gentei),1996,,https://www.mobygames.com/game/51389/albert-odyssey-gaiden-legend-of-eldean-shokai-press-gentei/,"Physical extras, Special edition"
10801,Albert Odyssey: Legend of Eldean,1996,7.58,https://www.mobygames.com/game/10801/albert-odyssey-legend-of-eldean/,"Top-down, Role-playing (RPG), Anime / Manga, Fantasy, Turn-based"
184407,Album Club: Mune Kyun Saint Paulia Jogakuin,1997,,https://www.mobygames.com/game/184407/album-club-mune-kyun-saint-paulia-jogakuin/,"Adventure, Sci-fi / futuristic, Anime / Manga, 3rd-person (Other), Fixed / flip-screen, Mini-games, Direct control, Japan (Modern/Futuristic)"
1267,Alien Trilogy,1996,7.77,https://www.mobygames.com/game/1267/alien-trilogy/,"Action, 1st-person, Sci-fi / futuristic, Shooter, Licensed, Regional differences"
47297,All-Star 1997 Featuring Frank Thomas,1997,,https://www.mobygames.com/game/47297/all-star-1997-featuring-frank-thomas/,"Sports, Baseball, Licensed, 3rd-person (Other)"
907,Alone in the Dark 2,1996,6.25,https://www.mobygames.com/game/907/alone-in-the-dark-2/,"Action, Puzzle elements, Detective / mystery, Horror, Survival horror, 3rd-person (Other), Cinematic camera, Direct control, Interwar"
217613,Amagi Shien,1997,,https://www.mobygames.com/game/217613/amagi-shien/,"Adventure, 1st-person, Detective / mystery, Fixed / flip-screen, Japanese-style adventure, Live action, Japan (Modern/Futuristic)"
58112,America Ōdan Ultra Quiz,1995,,https://www.mobygames.com/game/58112/america-odan-ultra-quiz/,"Simulation, Game show / trivia / quiz"
5379,Amok,1997,6.93,https://www.mobygames.com/game/5379/amok/,"Action, Sci-fi / futuristic, Shooter, Mecha / giant robot, Behind view"
2230,Andretti Racing,1996,7.75,https://www.mobygames.com/game/2230/andretti-racing/,"Simulation, Racing / Driving, 1st-person, Licensed, Behind view, Vehicle simulator, Automobile, Track racing"
42729,Anearth Fantasy Stories: The First Volume,1997,,https://www.mobygames.com/game/42729/anearth-fantasy-stories-the-first-volume/,"Top-down, Isometric, Role-playing (RPG), Anime / Manga, Fantasy, Turn-based"
3468,Angel Devoid: Face of the Enemy,1996,,https://www.mobygames.com/game/3468/angel-devoid-face-of-the-enemy/,"Adventure, 1st-person, Sci-fi / futuristic, Puzzle elements, Cyberpunk / dark sci-fi"
70553,Angel Graffiti: Anata e no Profile,1997,,https://www.mobygames.com/game/70553/angel-graffiti-anata-e-no-profile/,"Adventure, Simulation, 1st-person, Anime / Manga, Visual novel"
209415,Angel Paradise Vol.1: Sakaki Yūko - Koi no Yokan in Hollywood,1996,,https://www.mobygames.com/game/209415/angel-paradise-vol1-sakaki-yuko-koi-no-yokan-in-hollywood/,"Full Motion Video (FMV), Puzzle, Fixed / flip-screen, Point and select, Live action"
100962,Angel Paradise Vol.2: Yoshino Kimika - Isshoni Itai in Hawaii,1996,,https://www.mobygames.com/game/100962/angel-paradise-vol2-yoshino-kimika-isshoni-itai-in-hawaii/,"Full Motion Video (FMV), Video backdrop, Licensed, Puzzle, Romance, Fixed / flip-screen, Point and select, Live action"
42668,Angelique,1996,,https://www.mobygames.com/game/42668/angelique/,"Adventure, Strategy / tactics, Anime / Manga, Fantasy, Turn-based, Diagonal-down, 2D scrolling, Direct control"
180029,Angelique Duet,1998,,https://www.mobygames.com/game/180029/angelique-duet/,"Simulation, Anime / Manga, Romance, Life / social simulation"
226454,Angelique Duet (Premium Box),1998,,https://www.mobygames.com/game/226454/angelique-duet-premium-box/,"Physical extras, Special edition"
211735,Angelique Special (Premium Box),1996,,https://www.mobygames.com/game/211735/angelique-special-premium-box/,"Physical extras, Special edition"
211736,Angelique Special (Premium Pack),1997,,https://www.mobygames.com/game/211736/angelique-special-premium-pack/,"Physical extras, Special edition"
42674,Angelique Special 2,1997,,https://www.mobygames.com/game/42674/angelique-special-2/,"Adventure, Strategy / tactics, Top-down, Anime / Manga, Fantasy"
223129,Angelique Special 2 (Premium Box),1997,,https://www.mobygames.com/game/223129/angelique-special-2-premium-box/,"Physical extras, Special edition"
223606,Ankh 2: Tutankhamun no Nazo,1997,,https://www.mobygames.com/game/223606/ankh-2-tutankhamun-no-nazo/,"Adventure, 1st-person, Educational, Puzzle elements, Full Motion Video (FMV), History, Graphic adventure, Point and select, Egypt (Ancient), Live action"
214731,Another Memories,1998,,https://www.mobygames.com/game/214731/another-memories/,"Adventure, 1st-person, Anime / Manga, Fantasy, Life / social simulation, Japanese-style adventure"
190372,Aqua World: Umibi Monogatari,1996,,https://www.mobygames.com/game/190372/aqua-world-umibi-monogatari/,"Simulation, Educational, Real-time, Full Motion Video (FMV), Ecology / nature, Direct control"
209750,Aquazone Option Disc Series 1: Angel Fish,1996,,https://www.mobygames.com/game/209750/aquazone-option-disc-series-1-angel-fish/,"Add-on, NPC / enemy, Customization / outfit / skin"
209752,Aquazone Option Disc Series 2: Black Molly,1996,,https://www.mobygames.com/game/209752/aquazone-option-disc-series-2-black-molly/,"Add-on, NPC / enemy, Customization / outfit / skin"
209753,Aquazone Option Disc Series 3: Blue Emperor,1996,,https://www.mobygames.com/game/209753/aquazone-option-disc-series-3-blue-emperor/,"Add-on, NPC / enemy, Customization / outfit / skin"
209754,Aquazone Option Disc Series 4: Clown Loach,1996,,https://www.mobygames.com/game/209754/aquazone-option-disc-series-4-clown-loach/,"Add-on, NPC / enemy, Customization / outfit / skin"
209755,Aquazone Option Disc Series 5: False Rummy-Nose,1996,,https://www.mobygames.com/game/209755/aquazone-option-disc-series-5-false-rummy-nose/,"Add-on, NPC / enemy, Customization / outfit / skin"
209748,Aquazone: Desktop Life,1996,,https://www.mobygames.com/game/209748/aquazone-desktop-life/,"Simulation, Side view, Fixed / flip-screen, Life / social simulation, Point and select"
3654,Arcade's Greatest Hits: The Atari Collection 1,1997,,https://www.mobygames.com/game/3654/arcades-greatest-hits-the-atari-collection-1/,Compilation
220950,Arcana Strikes,1997,,https://www.mobygames.com/game/220950/arcana-strikes/,"Strategy / tactics, Cards / tiles, Role-playing (RPG), Anime / Manga, Full Motion Video (FMV), Fantasy, Turn-based, Behind view, Japanese-style RPG (JRPG)"
1542,Area 51,1996,6.72,https://www.mobygames.com/game/1542/area-51/,"Action, 1st-person, Sci-fi / futuristic, Arcade, Video backdrop, Rail shooter"
43749,Arthur to Astaroth no Nazo Makaimura: Incredible Toons,1996,,https://www.mobygames.com/game/43749/arthur-to-astaroth-no-nazo-makaimura-incredible-toons/,"Side view, Fantasy, Puzzle, 2D scrolling, Point and select"
20881,Assault Rigs,1997,,https://www.mobygames.com/game/20881/assault-rigs/,"Action, 1st-person, Sci-fi / futuristic, Shooter, Cyberpunk / dark sci-fi, Tank, 3rd-person (Other)"
45986,Assault Suit Leynos 2,1997,,https://www.mobygames.com/game/45986/assault-suit-leynos-2/,"Action, Sci-fi / futuristic, Side view, Shooter, Mecha / giant robot, 3rd-person (Other)"
11684,Astal,1995,7.17,https://www.mobygames.com/game/11684/astal/,"Action, Side view, Platform, 2D scrolling"
30527,Astra Superstars,1998,,https://www.mobygames.com/game/30527/astra-superstars/,"Action, Arcade, Side view, Fighting, Anime / Manga"
47459,Asuka 120% Limited: Burning Fest. Limited,1997,,https://www.mobygames.com/game/47459/asuka-120-limited-burning-fest-limited/,"Action, Martial arts, Fighting, 3rd-person (Other)"
41231,Atelier Marie Plus: Salburg no Renkinjutsushi,1997,,https://www.mobygames.com/game/41231/atelier-marie-plus-salburg-no-renkinjutsushi/,"Isometric, Role-playing (RPG), Anime / Manga, Fantasy, Turn-based, Diagonal-down, Direct control, Menu structures"
3186,Atlantis: The Lost Tales,1997,,https://www.mobygames.com/game/3186/atlantis-the-lost-tales/,"Adventure, 1st-person, Puzzle elements"
129039,Ayakashi Ninden Kunoichiban,1998,,https://www.mobygames.com/game/129039/ayakashi-ninden-kunoichiban/,"Adventure, 1st-person, Anime / Manga, Visual novel, Comedy, Romance, Dating simulation, Life / social simulation, Japanese-style adventure, Menu structures, Asia, Contemporary"
225820,"BackGuiner: Yomigaeru Yūsha-tachi - Hishō-hen ""Uragiri no Senjō""",1998,,https://www.mobygames.com/game/225820/backguiner-yomigaeru-yusha-tachi-hisho-hen-uragiri-no-senjo/,"Strategy / tactics, Sci-fi / futuristic, Isometric, Anime / Manga, Mecha / giant robot, Turn-based, Diagonal-down, 2D scrolling, Point and select, Multiple units/characters control, Japan (Modern/Futuristic), Turn-based tactics (TBT)"
225815,"BackGuiner: Yomigaeru Yūsha-tachi - Kakusei-hen ""Guiner Tensei""",1998,,https://www.mobygames.com/game/225815/backguiner-yomigaeru-yusha-tachi-kakusei-hen-guiner-tensei/,"Strategy / tactics, Sci-fi / futuristic, Isometric, Anime / Manga, Mecha / giant robot, Turn-based, Diagonal-down, 2D scrolling, Point and select, Multiple units/characters control, Japan (Modern/Futuristic), Turn-based tactics (TBT)"
2342,Baku Baku Animal,1995,7.56,https://www.mobygames.com/game/2342/baku-baku-animal/,"Real-time, Puzzle, Falling block puzzle"
210124,Bakuretsu Hunter,1996,,https://www.mobygames.com/game/210124/bakuretsu-hunter/,"Adventure, 1st-person, Anime / Manga, Fantasy, Licensed, Visual novel, Menu structures"
210129,Bakuretsu Hunter R,1997,,https://www.mobygames.com/game/210129/bakuretsu-hunter-r/,"Adventure, Anime / Manga, Licensed, Turn-based, Diagonal-down, 2D scrolling, Japanese-style adventure"
190487,Bakushō!! All Yoshimoto Quiz-Ou Ketteisen DX,1995,,https://www.mobygames.com/game/190487/bakusho-all-yoshimoto-quiz-ou-ketteisen-dx/,"1st-person, Game show / trivia / quiz, Fantasy, Licensed, Turn-based, Puzzle, Fixed / flip-screen, Menu structures, Live action, Japan (Modern/Futuristic)"
1510,Baldies,1998,,https://www.mobygames.com/game/1510/baldies/,"Strategy / tactics, Top-down, Real-time, Free camera, Point and select, Multiple units/characters control, Real-time strategy (RTS)"
2137,Bandit Kings of Ancient China,1996,,https://www.mobygames.com/game/2137/bandit-kings-of-ancient-china/,"Strategy / tactics, Top-down, Historical events, Managerial / business simulation, Turn-based, China (Ancient / Imperial)"
11064,Baroque,1998,,https://www.mobygames.com/game/11064/baroque/,"Action, 1st-person, Post-apocalyptic, Horror"
49785,Bases Loaded '96: Double Header,1995,,https://www.mobygames.com/game/49785/bases-loaded-96-double-header/,"Sports, Baseball, Licensed, Behind view, Diagonal-down, Direct control"
7974,Batman Forever,1996,5.23,https://www.mobygames.com/game/7974/batman-forever/,"Action, Side view, Martial arts, Licensed, Beat 'em up / brawler"
38276,Batsugun,1996,7.25,https://www.mobygames.com/game/38276/batsugun/,"Action, Arcade, Top-down, Flight / aviation, Shooter, 2D scrolling"
7654,Battle Arena Toshinden Remix,1995,6.78,https://www.mobygames.com/game/7654/battle-arena-toshinden-remix/,"Action, Side view, Martial arts, Fighting, Anime / Manga, 2D scrolling, Direct control"
7670,Battle Arena Toshinden Ultimate Revenge Attack,1996,5.92,https://www.mobygames.com/game/7670/battle-arena-toshinden-ultimate-revenge-attack/,"Action, Arcade, Martial arts, Fighting, 3rd-person (Other)"
77216,Battle Athletes: Daiundoukai,1996,,https://www.mobygames.com/game/77216/battle-athletes-daiundoukai/,"Adventure, Simulation, 1st-person, Sci-fi / futuristic, Anime / Manga, Visual novel"
63055,Battle Garegga,1998,,https://www.mobygames.com/game/63055/battle-garegga/,"Action, Sci-fi / futuristic, Arcade, Top-down, Shooter, 2D scrolling, Direct control"
28299,Battle Monsters,1995,4.48,https://www.mobygames.com/game/28299/battle-monsters/,"Action, Side view, Platform, Martial arts, Fighting"
47361,Battle Stations,1997,,https://www.mobygames.com/game/47361/battle-stations/,"Action, Strategy / tactics, Arcade, Top-down, Real-time, Isometric, Naval / watercraft, 3rd-person (Other), Real-time strategy (RTS)"
1125,BattleSport,1997,,https://www.mobygames.com/game/1125/battlesport/,"Action, Sports, 1st-person"
222949,Beach de Reach!,1998,,https://www.mobygames.com/game/222949/beach-de-reach/,"Adventure, Strategy / tactics, 1st-person, Cards / tiles, Anime / Manga, Turn-based, Romance, Fixed / flip-screen, Dating simulation, Japanese-style adventure, Point and select, Japan (Modern/Futuristic)"
209427,Big Ichigeki! Pachi-Slot Daikōryaku: Universal Museum,1996,,https://www.mobygames.com/game/209427/big-ichigeki-pachi-slot-daikoryaku-universal-museum/,"1st-person, Gambling, Licensed"
225676,Big Thanks Super Keirin: Dream With Keirin 50 Years,1998,,https://www.mobygames.com/game/225676/big-thanks-super-keirin-dream-with-keirin-50-years/,"Sports, Licensed, Bike / bicycling, Behind view, Direct control"
222490,Bishōjo Hanafuda Kikō: Michinoku Hitō Koi Monogatari,1997,,https://www.mobygames.com/game/222490/bishojo-hanafuda-kiko-michinoku-hito-koi-monogatari/,"Adventure, Strategy / tactics, 1st-person, Cards / tiles, Anime / Manga, Turn-based, Romance, Fixed / flip-screen, Japanese-style adventure, Japan (Modern/Futuristic)"
73279,Bishōjo Senshi Sailor Moon SuperS: Various Emotion,1996,,https://www.mobygames.com/game/73279/bishojo-senshi-sailor-moon-supers-various-emotion/,"Action, Arcade, Side view, Fighting, Anime / Manga, Fantasy, Licensed, 2D scrolling, Direct control"
209573,Bishōjo Variety Game: Rapyulus Panic,1996,,https://www.mobygames.com/game/209573/bishojo-variety-game-rapyulus-panic/,"Action, Anime / Manga, Puzzle"
4190,Black Dawn,1996,7.72,https://www.mobygames.com/game/4190/black-dawn/,"Action, 1st-person, Helicopter, Behind view"
36907,Black Fire,1995,6.6,https://www.mobygames.com/game/36907/black-fire/,"Action, 1st-person, Sci-fi / futuristic, Arcade, Helicopter"
15783,Black/Matrix,1998,,https://www.mobygames.com/game/15783/blackmatrix/,"Strategy / tactics, Isometric, Role-playing (RPG), Anime / Manga, Fantasy, Turn-based"
3320,Blast Chamber,1996,6.62,https://www.mobygames.com/game/3320/blast-chamber/,"Action, Sci-fi / futuristic, Puzzle elements, 3rd-person (Other)"
72646,Blast Wind,1997,,https://www.mobygames.com/game/72646/blast-wind/,"Action, Arcade, Top-down, Shooter, Post-apocalyptic, Direct control"
8513,Blazing Dragons,1996,6.91,https://www.mobygames.com/game/8513/blazing-dragons/,"Adventure, Arcade, Real-time, Puzzle elements, Fantasy, Licensed, 3rd-person (Other), 2D scrolling, Point and select"
15376,Blazing Heroes,1995,7.92,https://www.mobygames.com/game/15376/blazing-heroes/,"Strategy / tactics, Role-playing (RPG), Fantasy, Turn-based, Diagonal-down"
208319,Blazing Tornado,1995,,https://www.mobygames.com/game/208319/blazing-tornado/,"Sports, Isometric, Wrestling, 3rd-person (Other)"
15828,Blue Breaker: Ken yori mo Hohoemi o,1997,,https://www.mobygames.com/game/15828/blue-breaker-ken-yori-mo-hohoemi-o/,"Side view, Role-playing (RPG), Anime / Manga, Turn-based, 2D scrolling"
42738,Blue Seed: Kushinada Hirokuden,1995,,https://www.mobygames.com/game/42738/blue-seed-kushinada-hirokuden/,"Top-down, Cards / tiles, Role-playing (RPG), Anime / Manga, Turn-based"
17606,Board Game: Top Shop,1998,,https://www.mobygames.com/game/17606/board-game-top-shop/,"Simulation, Strategy / tactics, Board game, Anime / Manga"
75717,Body Special 264: Girls in Motion Puzzle - Vol.2,1996,,https://www.mobygames.com/game/75717/body-special-264-girls-in-motion-puzzle-vol2/,"Cards / tiles, Puzzle, Fixed / flip-screen"
82695,Bomberman Wars,1998,,https://www.mobygames.com/game/82695/bomberman-wars/,"Strategy / tactics, Isometric, Role-playing (RPG), Fantasy, Diagonal-down, Tactical RPG, Direct control"
76622,The Book of Lulu,1996,,https://www.mobygames.com/game/76622/the-book-of-lulu/,"Adventure, 1st-person, Interactive book"
37082,Bottom of the 9th,1996,,https://www.mobygames.com/game/37082/bottom-of-the-9th/,"Simulation, Sports, Baseball, Diagonal-down, 2D scrolling"
208925,Brain Battle Q,1996,,https://www.mobygames.com/game/208925/brain-battle-q/,"Strategy / tactics, Game show / trivia / quiz"
2083,Brain Dead 13,1996,6.15,https://www.mobygames.com/game/2083/brain-dead-13/,"Action, Full Motion Video (FMV), Quick Time Events (QTEs)"
17419,Break Point,1996,6.77,https://www.mobygames.com/game/17419/break-point/,"Sports, Tennis, 3rd-person (Other)"
2781,BreakThru!,1995,,https://www.mobygames.com/game/2781/breakthru/,"Real-time, Puzzle, Fixed / flip-screen, Tile matching puzzle, Point and select"
788,Bubble Bobble also featuring Rainbow Islands,1996,7.36,https://www.mobygames.com/game/788/bubble-bobble-also-featuring-rainbow-islands/,"Action, Arcade, Side view, Platform, Compilation"
19102,Bubble Symphony,1997,,https://www.mobygames.com/game/19102/bubble-symphony/,"Action, Arcade, Side view, Platform, Fixed / flip-screen"
1713,Bug Too!,1996,6.81,https://www.mobygames.com/game/1713/bug-too/,"Action, Side view, Platform, Fantasy, 2D scrolling, Direct control"
8437,Bug!,1995,8.17,https://www.mobygames.com/game/8437/bug/,"Action, Side view, Platform, Fantasy, Behind view, Direct control"
177511,Bulk Slash,1997,,https://www.mobygames.com/game/177511/bulk-slash/,"Action, Sci-fi / futuristic, Shooter, Anime / Manga, Mecha / giant robot, Behind view, Direct control"
7630,Burning Rangers,1998,7.69,https://www.mobygames.com/game/7630/burning-rangers/,"Action, Shooter, Behind view"
8452,Bust-A-Move 3,1997,7.66,https://www.mobygames.com/game/8452/bust-a-move-3/,"Arcade, Real-time, Side view, Fantasy, Puzzle, Fixed / flip-screen, Tile matching puzzle, Direct control"
5864,Bust-A-Move Again,1996,8.02,https://www.mobygames.com/game/5864/bust-a-move-again/,"Arcade, Real-time, Side view, Fantasy, Puzzle, Fixed / flip-screen, Tile matching puzzle, Direct control"
222493,Bōken Katsugeki Mono Mono,1997,,https://www.mobygames.com/game/222493/boken-katsugeki-mono-mono/,"Action, Real-time, Role-playing (RPG), Anime / Manga, Diagonal-down, 2D scrolling, Roguelike, Direct control, Japan (Ancient/Classical/Medieval)"
43154,Can Can Bunny Extra,1997,,https://www.mobygames.com/game/43154/can-can-bunny-extra/,"Adventure, 1st-person, Anime / Manga, Adult"
43153,Can Can Bunny Premiere,1996,,https://www.mobygames.com/game/43153/can-can-bunny-premiere/,"Adventure, 1st-person, Anime / Manga, Adult"
120902,Can Can Bunny Premiere 2,1996,,https://www.mobygames.com/game/120902/can-can-bunny-premiere-2/,"Adventure, Simulation, 1st-person, Anime / Manga, Comedy, Romance, Dating simulation, Life / social simulation, Japanese-style adventure, Contemporary"
14991,Capcom Generation: Dai 1 Shū - Gekitsuiō no Jidai,1998,,https://www.mobygames.com/game/14991/capcom-generation-dai-1-shu-gekitsuio-no-jidai/,"Action, Arcade, Top-down, Shooter, Compilation"
11038,Capcom Generation: Dai 2 Shū - Makai to Kishi,1998,,https://www.mobygames.com/game/11038/capcom-generation-dai-2-shu-makai-to-kishi/,Compilation
35593,Capcom Generation: Dai 3 Shū - Koko ni Rekishi Hajimaru,1998,,https://www.mobygames.com/game/35593/capcom-generation-dai-3-shu-koko-ni-rekishi-hajimaru/,Compilation
42130,Capcom Generation: Dai 4 Shū - Kokō no Eiyū,1998,,https://www.mobygames.com/game/42130/capcom-generation-dai-4-shu-koko-no-eiyu/,"Action, Arcade, Top-down, Shooter, Compilation"
25842,Casper,1996,6.9,https://www.mobygames.com/game/25842/casper/,"Adventure, Real-time, Puzzle elements, Licensed, Comedy, Diagonal-down, 2D scrolling, Direct control, North America"
3739,Castlevania: Symphony of the Night,1998,7.92,https://www.mobygames.com/game/3739/castlevania-symphony-of-the-night/,"Action, Side view, Platform, Metroidvania, Fantasy, Horror, 2D scrolling, RPG elements, Europe, Regional differences"
11421,Casual Romance Club,1998,,https://www.mobygames.com/game/11421/casual-romance-club/,"Adventure, 1st-person, Anime / Manga, Adult, Visual novel"
114332,Cat the Ripper: 13-ninme no Tanteishi,1997,,https://www.mobygames.com/game/114332/cat-the-ripper-13-ninme-no-tanteishi/,"Adventure, 1st-person, Detective / mystery, Meditative / Zen, Graphic adventure, Point and select, Europe"
39839,Center Ring Boxing,1995,7.49,https://www.mobygames.com/game/39839/center-ring-boxing/,"Sports, Top-down, Boxing, 3rd-person (Other)"
16340,Chaos Control,1995,,https://www.mobygames.com/game/16340/chaos-control/,"Action, 1st-person, Sci-fi / futuristic, Arcade, Flight / aviation, Anime / Manga, Rail shooter"
211730,Chaos Control Remix,1996,,https://www.mobygames.com/game/211730/chaos-control-remix/,"Action, 1st-person, Sci-fi / futuristic, Arcade, Flight / aviation, Anime / Manga, Rail shooter"
29098,Chaos Seed: Fūsui Kairōki,1998,,https://www.mobygames.com/game/29098/chaos-seed-fusui-kairoki/,"Strategy / tactics, Real-time, Role-playing (RPG), Fantasy, Diagonal-down, 2D scrolling, Action RPG, Direct control"
144440,Chase H.Q. Plus S.C.I.,1996,,https://www.mobygames.com/game/144440/chase-hq-plus-sci/,"Action, Racing / Driving, Shooter, Compilation, Crime, Behind view, Vehicle simulator, Direct control, Automobile"
208376,Chibi Maruko-chan no Taisen Puzzle Dama,1995,,https://www.mobygames.com/game/208376/chibi-maruko-chan-no-taisen-puzzle-dama/,"Arcade, Real-time, Licensed, Puzzle, Falling block puzzle, Japan (Modern/Futuristic)"
224882,Choro Q Park,1998,,https://www.mobygames.com/game/224882/choro-q-park/,"Racing / Driving, 1st-person, Licensed, Behind view, Direct control, Automobile"
12695,Christmas NiGHTS into Dreams...,1996,8.1,https://www.mobygames.com/game/12695/christmas-nights-into-dreams/,"Action, Side view, Fantasy, Direct control"
22560,Chō Aniki: Kyūkyoku Muteki Ginga Saikyō Otoko,1996,,https://www.mobygames.com/game/22560/cho-aniki-kyukyoku-muteki-ginga-saikyo-otoko/,"Action, Arcade, Side view, Shooter, 2D scrolling"
57839,Chō Jikū Yōsai Macross: Ai Oboete Imasu ka,1997,,https://www.mobygames.com/game/57839/cho-jiku-yosai-macross-ai-oboete-imasu-ka/,"Action, Sci-fi / futuristic, Side view, Flight / aviation, Shooter, Anime / Manga, Post-apocalyptic, Mecha / giant robot, Licensed, 2D scrolling"
38545,Cleopatra's Fortune,1997,,https://www.mobygames.com/game/38545/cleopatras-fortune/,"Real-time, Side view, Anime / Manga, Puzzle, Fixed / flip-screen, Falling block puzzle"
211266,ClockWerx,1996,,https://www.mobygames.com/game/211266/clockwerx/,"Top-down, Real-time, Puzzle, Fixed / flip-screen"
11195,Clockwork Knight,1994,6.84,https://www.mobygames.com/game/11195/clockwork-knight/,"Action, Side view, Platform, 3rd-person (Other)"
33634,Clockwork Knight 2,1995,7.67,https://www.mobygames.com/game/33634/clockwork-knight-2/,"Action, Side view, Platform, Fantasy, 2D scrolling, Direct control"
208209,Clockwork Knight: Pepperouchau no Fukubukuro,1995,,https://www.mobygames.com/game/208209/clockwork-knight-pepperouchau-no-fukubukuro/,"Action, Side view, Platform, Compilation, 3rd-person (Other)"
72654,Code R,1998,,https://www.mobygames.com/game/72654/code-r/,"Adventure, Racing / Driving, Behind view, Diagonal-down, Direct control"
21709,College Slam,1996,7.14,https://www.mobygames.com/game/21709/college-slam/,"Sports, Arcade, Basketball, Licensed, Diagonal-down, 2D scrolling"
