ID,Title,Release Year,Moby Score,URL,Genres
218211,Shin Theme Park,1997,,https://www.mobygames.com/game/218211/shin-theme-park/,"Strategy / tactics, Real-time, Managerial / business simulation, Diagonal-down, Free camera, City building / construction simulation, Point and select"
149199,Shingata Kururin Pa!,1996,,https://www.mobygames.com/game/149199/shingata-kururin-pa/,"Top-down, Real-time, Anime / Manga, Puzzle, Fixed / flip-screen, Falling block puzzle"
9744,Shining Force III,1997,8.15,https://www.mobygames.com/game/9744/shining-force-iii/,"Strategy / tactics, Isometric, Role-playing (RPG), Fantasy, Turn-based, 3rd-person (Other)"
11125,Shining Force III: Premium Disc,1998,,https://www.mobygames.com/game/11125/shining-force-iii-premium-disc/,"Isometric, Role-playing (RPG), Add-on, Fantasy"
11037,Shining Force III: Scenario 2,1998,7.81,https://www.mobygames.com/game/11037/shining-force-iii-scenario-2/,"Role-playing (RPG), Fantasy, Turn-based, 3rd-person (Other)"
11123,Shining Force III: Scenario 3,1998,,https://www.mobygames.com/game/11123/shining-force-iii-scenario-3/,"Isometric, Role-playing (RPG), Fantasy, Turn-based"
7652,Shining the Holy Ark,1996,7.86,https://www.mobygames.com/game/7652/shining-the-holy-ark/,"1st-person, Role-playing (RPG), Anime / Manga, Fantasy, Turn-based"
11135,Shining Wisdom,1995,7.19,https://www.mobygames.com/game/11135/shining-wisdom/,"Action, Top-down, Puzzle elements, Fantasy"
23073,Shinobi Legions,1995,7.58,https://www.mobygames.com/game/23073/shinobi-legions/,"Action, Arcade, Side view, 2D scrolling"
79066,Shinpi no Sekai: El-Hazard,1996,,https://www.mobygames.com/game/79066/shinpi-no-sekai-el-hazard/,"Adventure, 1st-person, Anime / Manga, Fantasy, Licensed, Visual novel, Fixed / flip-screen"
79031,Shinpi no Sekai: El-Hazard for Sega Saturn (Shokai),1996,,https://www.mobygames.com/game/79031/shinpi-no-sekai-el-hazard-for-sega-saturn-shokai/,"Physical extras, Special edition"
29656,Shinrei Jusatsushi Tarōmaru,1997,7.33,https://www.mobygames.com/game/29656/shinrei-jusatsushi-taromaru/,"Action, Arcade, Side view, Shooter, Fantasy"
222045,Shinseiki Evangelion: Eva to Yukai na Nakama-tachi,1998,,https://www.mobygames.com/game/222045/shinseiki-evangelion-eva-to-yukai-na-nakama-tachi/,"Strategy / tactics, Cards / tiles, Anime / Manga, Licensed, Turn-based, Fixed / flip-screen"
34197,Shinsetsu Samurai Spirits: Bushidōretsuden,1997,,https://www.mobygames.com/game/34197/shinsetsu-samurai-spirits-bushidoretsuden/,"Side view, Role-playing (RPG), Anime / Manga, Fantasy, Turn-based, Diagonal-down, Japanese-style RPG (JRPG)"
22617,Shockwave Assault,1996,6.94,https://www.mobygames.com/game/22617/shockwave-assault/,"Action, 1st-person, Sci-fi / futuristic, Shooter, Compilation"
209038,Shukudai ga Tant-R,1996,,https://www.mobygames.com/game/209038/shukudai-ga-tant-r/,Compilation
211264,Shunsai,1996,,https://www.mobygames.com/game/211264/shunsai/,"Simulation, Strategy / tactics, Sports, Game show / trivia / quiz, Horse / derby"
211296,Shusse Mahjong Daisettai,1996,,https://www.mobygames.com/game/211296/shusse-mahjong-daisettai/,"Strategy / tactics, 1st-person, Cards / tiles, Turn-based, Japan (Modern/Futuristic)"
222725,Shutsudō! Mini-skirt Police,1997,,https://www.mobygames.com/game/222725/shutsudo-mini-skirt-police/,"Action, Arcade, Game show / trivia / quiz, Licensed, Mini-games, Point and select, Direct control"
222726,Shutsudō! Mini-skirt Police (Shokai Gentei Double Tokuten),1997,,https://www.mobygames.com/game/222726/shutsudo-mini-skirt-police-shokai-gentei-double-tokuten/,"Licensed, Physical extras, Special edition"
208226,Shōgi Matsuri,1995,,https://www.mobygames.com/game/208226/shogi-matsuri/,"Strategy / tactics, Board game, Turn-based"
130641,Shōjo Kakumei Utena: Itsuka Kakumei Sareru Monogatari,1998,,https://www.mobygames.com/game/130641/shojo-kakumei-utena-itsuka-kakumei-sareru-monogatari/,"Adventure, 1st-person, Anime / Manga, Fantasy, Turn-based, Visual novel, Romance, Fixed / flip-screen, Menu structures, Contemporary"
212726,Shōryū Sangokushi,1996,,https://www.mobygames.com/game/212726/shoryu-sangokushi/,"Simulation, Strategy / tactics, Historical events, Real-time, Isometric, Diagonal-down, China (Ancient / Imperial)"
585,Sid Meier's Civilization,1997,,https://www.mobygames.com/game/585/sid-meiers-civilization/,"Strategy / tactics, Top-down, Isometric, Managerial / business simulation, Turn-based, 4X, Multiple units/characters control, Turn-based strategy (TBS)"
139658,Side Pocket 3: 3D Polygon Billiard Game,1997,,https://www.mobygames.com/game/139658/side-pocket-3-3d-polygon-billiard-game/,"Sports, 1st-person, Pool / snooker"
4046,Silhouette Mirage,1997,8.03,https://www.mobygames.com/game/4046/silhouette-mirage/,"Action, Sci-fi / futuristic, Side view, Shooter, Anime / Manga, 3rd-person (Other), Regional differences"
657,SimCity 2000,1995,7.71,https://www.mobygames.com/game/657/simcity-2000/,"Simulation, Strategy / tactics, Real-time, Isometric, Managerial / business simulation, Diagonal-down, Free camera, City building / construction simulation, Point and select, Contemporary"
312,SimTower: The Vertical Empire,1996,,https://www.mobygames.com/game/312/simtower-the-vertical-empire/,"Simulation, Side view, Managerial / business simulation"
56462,Simulation RPG Tkool,1998,,https://www.mobygames.com/game/56462/simulation-rpg-tkool/,"Strategy / tactics, Top-down, Role-playing (RPG), Anime / Manga, Turn-based"
214010,Simulation Zoo,1997,,https://www.mobygames.com/game/214010/simulation-zoo/,"Simulation, Real-time, Isometric, Managerial / business simulation, Diagonal-down, Point and select, Menu structures"
5019,Skeleton Warriors,1996,7.1,https://www.mobygames.com/game/5019/skeleton-warriors/,"Action, Side view, Platform, Fantasy, 3rd-person (Other)"
157897,Skull Fang,1997,,https://www.mobygames.com/game/157897/skull-fang/,"Action, Top-down, Flight / aviation, Shooter, 2D scrolling, Direct control"
22848,Sky Target,1997,6.25,https://www.mobygames.com/game/22848/sky-target/,"Action, Arcade, Flight / aviation, Shooter, Behind view, Vehicular combat"
6569,Slam 'N Jam '96 featuring Magic & Kareem,1996,6.91,https://www.mobygames.com/game/6569/slam-n-jam-96-featuring-magic-kareem/,"Sports, Basketball, Licensed, Behind view"
21343,Slam Dunk: I Love Basketball,1995,,https://www.mobygames.com/game/21343/slam-dunk-i-love-basketball/,"Sports, Basketball, Anime / Manga, Licensed, 3rd-person (Other)"
47280,Slayers Royal,1997,,https://www.mobygames.com/game/47280/slayers-royal/,"Strategy / tactics, Anime / Manga, Fantasy, Licensed, Turn-based, 3rd-person (Other)"
47281,Slayers Royal 2,1998,,https://www.mobygames.com/game/47281/slayers-royal-2/,"Strategy / tactics, Anime / Manga, Fantasy, Licensed, Turn-based, 3rd-person (Other)"
7524,Snatcher,1996,6.87,https://www.mobygames.com/game/7524/snatcher/,"Adventure, 1st-person, Shooter, Detective / mystery, Anime / Manga, Cyberpunk / dark sci-fi, Japanese-style adventure, Quick Time Events (QTEs)"
224864,Sokkō Seitokai: Sonic Council,1998,,https://www.mobygames.com/game/224864/sokko-seitokai-sonic-council/,"Action, Side view, Fighting, Anime / Manga, Licensed, 2D scrolling, Direct control"
30859,Sol Divide,1998,,https://www.mobygames.com/game/30859/sol-divide/,"Action, Arcade, Side view, Shooter, Fantasy, 2D scrolling"
8415,Solar Eclipse,1995,6.71,https://www.mobygames.com/game/8415/solar-eclipse/,"Action, 1st-person, Sci-fi / futuristic, Shooter, Behind view, Space flight, Direct control"
204573,Solo Crisis,1998,,https://www.mobygames.com/game/204573/solo-crisis/,"Simulation, Strategy / tactics, Top-down, Real-time, Isometric, Fantasy, Life / social simulation, Menu structures"
3494,Sonic 3D Blast,1996,6.77,https://www.mobygames.com/game/3494/sonic-3d-blast/,"Action, Arcade, Isometric, Diagonal-down"
7450,Sonic Jam,1997,8.16,https://www.mobygames.com/game/7450/sonic-jam/,"Action, Side view, Platform, Anime / Manga, Compilation, Behind view, 2D scrolling"
2899,Sonic R,1997,7.1,https://www.mobygames.com/game/2899/sonic-r/,"Racing / Driving, Arcade, Anime / Manga, Behind view"
57164,Sonic Wings Special,1996,6.24,https://www.mobygames.com/game/57164/sonic-wings-special/,"Action, Arcade, Top-down, Flight / aviation, Shooter"
225584,Sorvice,1998,,https://www.mobygames.com/game/225584/sorvice/,"Action, Role-playing (RPG), Anime / Manga, Fantasy, Diagonal-down, 2D scrolling, Roguelike, Direct control"
218134,Sotsugyō Crossworld,1997,,https://www.mobygames.com/game/218134/sotsugyo-crossworld/,"Adventure, 1st-person, Anime / Manga, Dating simulation, Japanese-style adventure, Japan (Modern/Futuristic)"
218139,Sotsugyō III: Wedding Bell,1998,,https://www.mobygames.com/game/218139/sotsugyo-iii-wedding-bell/,"Simulation, 1st-person, Anime / Manga, Romance, Fixed / flip-screen, Japan (Modern/Futuristic)"
218123,Sotsugyō S: Graduation,1997,,https://www.mobygames.com/game/218123/sotsugyo-s-graduation/,"Simulation, 1st-person, Anime / Manga, Fixed / flip-screen, Japan (Modern/Futuristic)"
224930,Sound Novel Tkool 2,1997,,https://www.mobygames.com/game/224930/sound-novel-tkool-2/,"Adventure, Visual novel"
221929,Sound Qube,1998,,https://www.mobygames.com/game/221929/sound-qube/,"Real-time, Puzzle, Fixed / flip-screen, Point and select"
5584,Soviet Strike,1997,7.99,https://www.mobygames.com/game/5584/soviet-strike/,"Action, Flight / aviation, Shooter, Helicopter, Diagonal-down"
1434,Space Harrier,1996,,https://www.mobygames.com/game/1434/space-harrier/,"Action, Sci-fi / futuristic, Arcade, Shooter, Behind view, Direct control"
51395,Space Harrier (Limited Special Pack),1996,,https://www.mobygames.com/game/51395/space-harrier-limited-special-pack/,"Physical extras, Special edition"
2246,Space Hulk: Vengeance of the Blood Angels,1996,7.12,https://www.mobygames.com/game/2246/space-hulk-vengeance-of-the-blood-angels/,"Action, Strategy / tactics, 1st-person, Sci-fi / futuristic, Top-down, Licensed"
6170,Space Invaders,1996,,https://www.mobygames.com/game/6170/space-invaders/,"Action, Sci-fi / futuristic, Arcade, Side view, Shooter, Fixed / flip-screen"
33110,Space Jam,1996,6.38,https://www.mobygames.com/game/33110/space-jam/,"Sports, Side view, Basketball, Licensed, 3rd-person (Other)"
209574,Special Gift Pack,1996,,https://www.mobygames.com/game/209574/special-gift-pack/,Compilation
8558,Spot Goes to Hollywood,1996,6.72,https://www.mobygames.com/game/8558/spot-goes-to-hollywood/,"Action, Isometric, Fantasy, Licensed, Diagonal-down, 2D scrolling"
57065,Stakes Winner,1996,,https://www.mobygames.com/game/57065/stakes-winner/,"Sports, Arcade, Horse / derby, Diagonal-down"
223287,Stakes Winner 2: Saikyōba Densetsu,1997,,https://www.mobygames.com/game/223287/stakes-winner-2-saikyoba-densetsu/,"Simulation, Sports, Arcade, Anime / Manga, Horse / derby, Diagonal-down"
214733,Standby Say You!,1997,,https://www.mobygames.com/game/214733/standby-say-you/,"Adventure, Simulation, 1st-person, Anime / Manga, Japanese-style adventure, Live action, Japan (Modern/Futuristic)"
222014,The Star Bowling Vol. 2,1998,,https://www.mobygames.com/game/222014/the-star-bowling-vol-2/,"Sports, Bowling, 3rd-person (Other)"
222013,The Star Bowling,1997,,https://www.mobygames.com/game/222013/the-star-bowling/,"Sports, Bowling, 3rd-person (Other)"
26049,Star Fighter,1996,,https://www.mobygames.com/game/26049/star-fighter/,"Action, 1st-person, Sci-fi / futuristic, Flight / aviation, Behind view, Space flight"
29763,Steam-Heart's,1998,,https://www.mobygames.com/game/29763/steam-hearts/,"Action, Sci-fi / futuristic, Arcade, Top-down, Shooter, Anime / Manga, Adult, 2D scrolling"
57707,SteamGear Mash,1995,6.74,https://www.mobygames.com/game/57707/steamgear-mash/,"Action, Platform, Isometric, Diagonal-down"
9742,Steep Slope Sliders,1997,7.6,https://www.mobygames.com/game/9742/steep-slope-sliders/,"Sports, Snowboarding / skiing, 3rd-person (Other)"
155668,Stellar Assault SS,1998,,https://www.mobygames.com/game/155668/stellar-assault-ss/,"Action, 1st-person, Sci-fi / futuristic, Arcade, Shooter, Behind view, Space flight, Direct control"
3706,Street Fighter Alpha 2,1996,8.23,https://www.mobygames.com/game/3706/street-fighter-alpha-2/,"Action, Side view, Fighting, Anime / Manga, 2D scrolling, Direct control"
3707,Street Fighter Alpha 3,1999,8.22,https://www.mobygames.com/game/3707/street-fighter-alpha-3/,"Action, Side view, Fighting, Anime / Manga, 2D scrolling"
3705,Street Fighter Alpha: Warriors' Dreams,1996,8.14,https://www.mobygames.com/game/3705/street-fighter-alpha-warriors-dreams/,"Action, Side view, Martial arts, Fighting, Anime / Manga, Fantasy, 2D scrolling, Direct control"
3708,Street Fighter Collection,1997,7.88,https://www.mobygames.com/game/3708/street-fighter-collection/,"Action, Side view, Fighting, Anime / Manga, Compilation, 2D scrolling, Direct control"
3709,Street Fighter Collection 2,1998,,https://www.mobygames.com/game/3709/street-fighter-collection-2/,"Action, Side view, Fighting, Anime / Manga, Compilation, Fantasy, 2D scrolling, Direct control"
204977,Street Fighter II: Movie,1996,,https://www.mobygames.com/game/204977/street-fighter-ii-movie/,"Action, Adventure, 1st-person, Side view, Fighting, 2D scrolling, Fixed / flip-screen, Direct control"
6031,Street Fighter: The Movie,1995,5.74,https://www.mobygames.com/game/6031/street-fighter-the-movie/,"Action, Arcade, Side view, Fighting, Licensed, 2D scrolling"
7163,Street Racer,1996,7.83,https://www.mobygames.com/game/7163/street-racer/,"Racing / Driving, Arcade, Behind view, Vehicle simulator, Automobile, Street racing"
4759,Striker '96,1996,6.74,https://www.mobygames.com/game/4759/striker-96/,"Simulation, Sports, Football (European) / Soccer, 3rd-person (Other)"
33453,Strikers 1945,1996,6.81,https://www.mobygames.com/game/33453/strikers-1945/,"Action, Arcade, Top-down, Flight / aviation, Shooter, World War II"
3793,Strikers 1945 II,1998,7.41,https://www.mobygames.com/game/3793/strikers-1945-ii/,"Action, Arcade, Top-down, Side view, Flight / aviation, Shooter, 2D scrolling, Direct control, World War II"
59765,Suchie-Pai Adventure: Doki Doki Nightmare,1998,,https://www.mobygames.com/game/59765/suchie-pai-adventure-doki-doki-nightmare/,"Adventure, 1st-person, Isometric, Anime / Manga, Fantasy"
116338,Sugoventure: Dragon Master Silk Gaiden,1998,,https://www.mobygames.com/game/116338/sugoventure-dragon-master-silk-gaiden/,"Adventure, Strategy / tactics, Board game, Anime / Manga, Fantasy, Turn-based, Comedy, Romance, Diagonal-down, Party game"
32033,Suiko Enbu Fuunsaiki,1996,,https://www.mobygames.com/game/32033/suiko-enbu-fuunsaiki/,"Action, Arcade, Side view, Fighting"
4843,Suikoden,1998,,https://www.mobygames.com/game/4843/suikoden/,"Top-down, Role-playing (RPG), Fantasy, Turn-based, Japanese-style RPG (JRPG), Regional differences"
225667,Suikoden: Tendō 108-sei,1997,,https://www.mobygames.com/game/225667/suikoden-tendo-108-sei/,"Strategy / tactics, Historical events, Real-time, Isometric, Managerial / business simulation, Turn-based, Diagonal-down, China (Ancient / Imperial)"
223780,Suikoden: Tenmei no Chikai (Premium Pack),1997,,https://www.mobygames.com/game/223780/suikoden-tenmei-no-chikai-premium-pack/,"Physical extras, Special edition"
33079,Super Adventure Rockman,1998,,https://www.mobygames.com/game/33079/super-adventure-rockman/,"Action, 1st-person, Sci-fi / futuristic, Anime / Manga, Full Motion Video (FMV), 3rd-person (Other)"
3102,Super Puzzle Fighter II Turbo,1996,7.97,https://www.mobygames.com/game/3102/super-puzzle-fighter-ii-turbo/,"Real-time, Puzzle, Falling block puzzle"
67008,Super Real Mahjong Graffiti,1995,,https://www.mobygames.com/game/67008/super-real-mahjong-graffiti/,"Strategy / tactics, 1st-person, Cards / tiles, Anime / Manga, Compilation, Adult"
66815,Super Real Mahjong P VI,1996,,https://www.mobygames.com/game/66815/super-real-mahjong-p-vi/,"Strategy / tactics, 1st-person, Cards / tiles, Anime / Manga, Adult"
66817,Super Real Mahjong P7,1998,,https://www.mobygames.com/game/66817/super-real-mahjong-p7/,"Strategy / tactics, 1st-person, Cards / tiles, Anime / Manga, Adult"
43274,Super Real Mahjong PV,1995,,https://www.mobygames.com/game/43274/super-real-mahjong-pv/,"Strategy / tactics, 1st-person, Cards / tiles, Anime / Manga, Adult"
44831,Super Robot Wars F,1997,,https://www.mobygames.com/game/44831/super-robot-wars-f/,"Strategy / tactics, Sci-fi / futuristic, Isometric, Role-playing (RPG), Anime / Manga, Mecha / giant robot, Turn-based"
44832,Super Robot Wars F Final,1998,,https://www.mobygames.com/game/44832/super-robot-wars-f-final/,"Strategy / tactics, Sci-fi / futuristic, Isometric, Role-playing (RPG), Anime / Manga, Mecha / giant robot, Turn-based"
93820,Super Tempo,1998,,https://www.mobygames.com/game/93820/super-tempo/,"Action, Side view, Platform, Fantasy, 2D scrolling, Direct control"
16533,Swagman,1997,7.27,https://www.mobygames.com/game/16533/swagman/,"Adventure, Isometric, Diagonal-down"
136590,Söldnerschild,1997,,https://www.mobygames.com/game/136590/soldnerschild/,"Strategy / tactics, Isometric, Role-playing (RPG), Anime / Manga, Fantasy, Turn-based, Diagonal-down, Medieval"
26560,Sōkyūgurentai,1997,8.23,https://www.mobygames.com/game/26560/sokyugurentai/,"Action, Sci-fi / futuristic, Arcade, Top-down, Shooter"
135893,Sōkū no Tsubasa: Gotha World,1997,,https://www.mobygames.com/game/135893/soku-no-tsubasa-gotha-world/,"Strategy / tactics, Sci-fi / futuristic, Anime / Manga"
223471,Tactical Fighter,1997,,https://www.mobygames.com/game/223471/tactical-fighter/,"Simulation, 1st-person, Managerial / business simulation, Anime / Manga, Menu structures, Japan (Modern/Futuristic)"
223342,Tactics Formula,1997,,https://www.mobygames.com/game/223342/tactics-formula/,"Strategy / tactics, Top-down, Board game, Turn-based, Fixed / flip-screen, Menu structures, Automobile"
8367,Tactics Ogre,1996,,https://www.mobygames.com/game/8367/tactics-ogre/,"Strategy / tactics, Isometric, Role-playing (RPG), Anime / Manga, Fantasy, Turn-based, Diagonal-down, Tactical RPG"
208400,Tadaima Wakusei Kaitakuchū!,1995,,https://www.mobygames.com/game/208400/tadaima-wakusei-kaitakuchu/,"Strategy / tactics, Top-down, Real-time, Multiple units/characters control, Real-time strategy (RTS)"
222946,Taiheiyō no Arashi 2,1997,,https://www.mobygames.com/game/222946/taiheiyo-no-arashi-2/,"Simulation, Top-down, Historical events, Turn-based, 2D scrolling, World War II"
222947,Taiheiyō no Arashi 2: Shippū no Mōdō (Shokai Gentei Premium Box),1997,,https://www.mobygames.com/game/222947/taiheiyo-no-arashi-2-shippu-no-modo-shokai-gentei-premium-box/,"Physical extras, Special edition"
211390,Taikyoku Shōgi: Kiwame II,1996,,https://www.mobygames.com/game/211390/taikyoku-shogi-kiwame-ii/,"Strategy / tactics, Top-down, Board game, Turn-based"
65653,Taikō Risshiden II,1996,,https://www.mobygames.com/game/65653/taiko-risshiden-ii/,"Strategy / tactics, Historical events, Real-time, Role-playing (RPG), Turn-based"
223779,Taikō Risshiden II (Premium Pack),1997,,https://www.mobygames.com/game/223779/taiko-risshiden-ii-premium-pack/,"Physical extras, Special edition"
66972,Taisen Idol-Mahjong Final Romance 2,1995,,https://www.mobygames.com/game/66972/taisen-idol-mahjong-final-romance-2/,"Strategy / tactics, 1st-person, Cards / tiles, Anime / Manga, Adult"
67279,Taisen Mahjong Final Romance 4,1998,,https://www.mobygames.com/game/67279/taisen-mahjong-final-romance-4/,"Strategy / tactics, 1st-person, Cards / tiles, Anime / Manga, Adult"
67089,Taisen Mahjong Final Romance R,1996,,https://www.mobygames.com/game/67089/taisen-mahjong-final-romance-r/,"Strategy / tactics, 1st-person, Cards / tiles, Anime / Manga, Adult"
51973,Tama: Adventurous Ball in Giddy Labyrinth,1994,,https://www.mobygames.com/game/51973/tama-adventurous-ball-in-giddy-labyrinth/,"Action, Top-down, Isometric, Puzzle, Direct control"
47306,Tanjō: Debut,1996,,https://www.mobygames.com/game/47306/tanjo-debut/,"Simulation, 1st-person, Managerial / business simulation, Anime / Manga"
111996,Tantei Jingūji Saburō: Mikan no Rupo,1996,,https://www.mobygames.com/game/111996/tantei-jinguji-saburo-mikan-no-rupo/,"Adventure, 1st-person, Detective / mystery, Anime / Manga, Thriller, Japanese-style adventure, Menu structures, Contemporary"
159113,Tantei Jingūji Saburō: Yume no Owari ni,1998,,https://www.mobygames.com/game/159113/tantei-jinguji-saburo-yume-no-owari-ni/,"Adventure, Detective / mystery, Anime / Manga, Crime, Cinematic camera, Japanese-style adventure, Direct control, Japan (Modern/Futuristic)"
38796,Tecmo Stackers,1996,,https://www.mobygames.com/game/38796/tecmo-stackers/,"Real-time, Puzzle, Falling block puzzle"
222730,Teitoku no Ketsudan III,1997,,https://www.mobygames.com/game/222730/teitoku-no-ketsudan-iii/,"Strategy / tactics, Top-down, Historical events, Naval / watercraft, Turn-based, Point and select, World War II"
222735,Teitoku no Ketsudan III (Premium Pack),1997,,https://www.mobygames.com/game/222735/teitoku-no-ketsudan-iii-premium-pack/,"Physical extras, Special edition"
222744,Teitoku no Ketsudan III with Power Up Kit,1998,,https://www.mobygames.com/game/222744/teitoku-no-ketsudan-iii-with-power-up-kit/,Compilation
927,Tempest 2000,1996,7.12,https://www.mobygames.com/game/927/tempest-2000/,"Action, Arcade, Top-down, Shooter"
1355,Ten Pin Alley,1997,,https://www.mobygames.com/game/1355/ten-pin-alley/,"Sports, Bowling, 3rd-person (Other)"
209987,Tenchi Muyō! Mimiri Onsen: Yukemuri no Tabi,1996,,https://www.mobygames.com/game/209987/tenchi-muyo-mimiri-onsen-yukemuri-no-tabi/,"Adventure, 1st-person, Anime / Manga, Licensed, Japanese-style adventure"
208785,Tenchi Muyō! Rensa Hitsuyō,1997,,https://www.mobygames.com/game/208785/tenchi-muyo-rensa-hitsuyo/,"Anime / Manga, Licensed, Puzzle, Fixed / flip-screen, Falling block puzzle, Direct control"
101008,Tenchi Muyō! Ryō-ōki: Gokuraku CD-ROM for Sega Saturn,1995,,https://www.mobygames.com/game/101008/tenchi-muyo-ryo-oki-gokuraku-cd-rom-for-sega-saturn/,"Adventure, Game show / trivia / quiz, Anime / Manga, Licensed, Fixed / flip-screen, Menu structures"
76029,Tenchi Muyō! Tōkō Muyō: Aniraji Collection,1997,,https://www.mobygames.com/game/76029/tenchi-muyo-toko-muyo-aniraji-collection/,"Adventure, 1st-person, Anime / Manga, Full Motion Video (FMV), Fantasy, Licensed, Visual novel"
105913,Tengai,1996,,https://www.mobygames.com/game/105913/tengai/,"Action, Arcade, Side view, Shooter, Fantasy, 2D scrolling, Direct control, Japan (Ancient/Classical/Medieval)"
11109,Tengai Makyō: Daiyon no Mokushiroku - The Apocalypse IV,1997,,https://www.mobygames.com/game/11109/tengai-makyo-daiyon-no-mokushiroku-the-apocalypse-iv/,"1st-person, Role-playing (RPG), Anime / Manga, Turn-based, Diagonal-down"
156108,Tennis Arena,1998,,https://www.mobygames.com/game/156108/tennis-arena/,"Sports, Tennis, 3rd-person (Other), Diagonal-down, Direct control"
161720,Terra Cresta 3D,1997,,https://www.mobygames.com/game/161720/terra-cresta-3d/,"Action, Sci-fi / futuristic, Arcade, Top-down, Shooter, Isometric, Behind view, Direct control"
212725,Terra Phantastica,1996,,https://www.mobygames.com/game/212725/terra-phantastica/,"Strategy / tactics, Isometric, Role-playing (RPG), Fantasy, Turn-based, Diagonal-down"
4071,Tetris Plus,1996,6.71,https://www.mobygames.com/game/4071/tetris-plus/,"Action, Side view, Puzzle, Fixed / flip-screen, Falling block puzzle, Direct control"
75021,Tetris S,1996,,https://www.mobygames.com/game/75021/tetris-s/,"Action, Side view, Puzzle, Fixed / flip-screen, Falling block puzzle, Direct control"
223835,Texthoth Ludo: Arcana Senki,1997,,https://www.mobygames.com/game/223835/texthoth-ludo-arcana-senki/,"Strategy / tactics, Isometric, Board game, Cards / tiles, Anime / Manga, Fantasy, Turn-based, Diagonal-down, Menu structures"
675,Theme Park,1995,7.64,https://www.mobygames.com/game/675/theme-park/,"Strategy / tactics, Real-time, Managerial / business simulation, Diagonal-down, Free camera, City building / construction simulation, Point and select"
5859,Three Dirty Dwarves,1996,6.64,https://www.mobygames.com/game/5859/three-dirty-dwarves/,"Action, Side view, Fantasy, Beat 'em up / brawler, 3rd-person (Other)"
35095,Three Wonders,1998,,https://www.mobygames.com/game/35095/three-wonders/,"Action, Arcade, Side view, Platform, Shooter, Puzzle elements, Compilation, Fantasy, Diagonal-down, 2D scrolling, Fixed / flip-screen, Free camera, Direct control"
51723,Thunder Force V (Special Pack),1997,,https://www.mobygames.com/game/51723/thunder-force-v-special-pack/,"Sci-fi / futuristic, Arcade, Side view, Shooter, Anime / Manga, 2D scrolling, Physical extras, Special edition"
3978,Thunder Force V: Perfect System,1997,,https://www.mobygames.com/game/3978/thunder-force-v-perfect-system/,"Action, Sci-fi / futuristic, Arcade, Side view, Shooter, Anime / Manga, 2D scrolling"
28506,Thunder Force: Gold Pack 1,1996,,https://www.mobygames.com/game/28506/thunder-force-gold-pack-1/,"Action, Sci-fi / futuristic, Side view, Shooter, Compilation"
28507,Thunder Force: Gold Pack 2,1996,,https://www.mobygames.com/game/28507/thunder-force-gold-pack-2/,"Action, Sci-fi / futuristic, Side view, Shooter, Compilation"
51362,Thunder Storm LX-3 & Road Blaster,1995,,https://www.mobygames.com/game/51362/thunder-storm-lx-3-road-blaster/,"Action, 1st-person, Helicopter, Anime / Manga, Full Motion Video (FMV), Compilation, Automobile"
8448,Thunderstrike 2,1995,8.2,https://www.mobygames.com/game/8448/thunderstrike-2/,"Action, Simulation, 1st-person, Helicopter, 3rd-person (Other), Vehicular combat"
224863,Tilk: Aoi Umi kara Kita Shōjo,1997,,https://www.mobygames.com/game/224863/tilk-aoi-umi-kara-kita-shojo/,"Adventure, Strategy / tactics, Top-down, Side view, Anime / Manga, Turn-based, 2D scrolling, Japanese-style adventure, Point and select, Turn-based tactics (TBT)"
