ID,Title,Release Year,Moby Score,URL,Genres
158128,#SinucaAttack,2021,,https://www.mobygames.com/game/158128/sinucaattack/,"Action, Side view, Platform, Puzzle elements, 2D scrolling, Direct control"
213659,.T.E.S.T,2023,,https://www.mobygames.com/game/213659/test/,"Action, Simulation, 1st-person, Platform, Puzzle elements, Direct control"
165074,0 Degrees,2021,,https://www.mobygames.com/game/165074/0-degrees/,"Action, Side view, Platform, Puzzle elements, 2D scrolling, Direct control"
157041,16-Bit Soccer,2020,,https://www.mobygames.com/game/157041/16-bit-soccer/,"Sports, Top-down, Football (European) / Soccer, 2D scrolling, Direct control"
176977,2 Synchro Hedgehogs,2021,,https://www.mobygames.com/game/176977/2-synchro-hedgehogs/,"Action, Side view, Platform, Fantasy, Puzzle, Fixed / flip-screen, Direct control"
188142,200 Ways,2021,,https://www.mobygames.com/game/188142/200-ways/,"Puzzle, Diagonal-down, Fixed / flip-screen"
161476,2D Neon Hardcore,2021,,https://www.mobygames.com/game/161476/2d-neon-hardcore/,"Action, Side view, Puzzle, Direct control"
160571,3 out of 10: Season One,2021,,https://www.mobygames.com/game/160571/3-out-of-10-season-one/,"Adventure, Comedy, 3rd-person (Other), Mini-games, Contemporary"
79482,35MM,2022,,https://www.mobygames.com/game/79482/35mm/,"Action, Adventure, 1st-person, Puzzle elements, Post-apocalyptic, Direct control, Quick Time Events (QTEs)"
161453,3D Gravity Rocket,2020,,https://www.mobygames.com/game/161453/3d-gravity-rocket/,"Action, Sci-fi / futuristic, Arcade, Side view, 2D scrolling, Direct control"
193752,41 Hours,2022,,https://www.mobygames.com/game/193752/41-hours/,"Action, 1st-person, Sci-fi / futuristic, Shooter, Post-apocalyptic, Fantasy, Direct control"
144238,50 Years,2020,,https://www.mobygames.com/game/144238/50-years/,"Strategy / tactics, Fantasy, Turn-based, Diagonal-down, Point and select, Turn-based strategy (TBS)"
218372,502's Arcade,2024,,https://www.mobygames.com/game/218372/502s-arcade/,"Action, Arcade, Side view, Fantasy, 3rd-person (Other), Diagonal-down, Mini-games, Direct control"
114032,60 Parsecs!,2020,,https://www.mobygames.com/game/114032/60-parsecs/,"Action, Adventure, Sci-fi / futuristic, Post-apocalyptic, Diagonal-down"
130840,60 Seconds! Reatomized,2020,,https://www.mobygames.com/game/130840/60-seconds-reatomized/,"Action, Post-apocalyptic, Diagonal-down"
176304,6Souls,2021,,https://www.mobygames.com/game/176304/6souls/,"Action, Side view, Platform, Puzzle elements, Fantasy, 2D scrolling, Direct control"
194822,7 Days of Rose,2022,,https://www.mobygames.com/game/194822/7-days-of-rose/,"Adventure, Anime / Manga, Visual novel, Fixed / flip-screen, Point and select, Contemporary"
137462,8 Ball Pocket,2022,,https://www.mobygames.com/game/137462/8-ball-pocket/,"Sports, 1st-person, Top-down, Pool / snooker"
99119,80's Overdrive,2022,,https://www.mobygames.com/game/99119/80s-overdrive/,"Racing / Driving, Behind view, Direct control, Automobile, Street racing"
175205,890B,2021,,https://www.mobygames.com/game/175205/890b/,"Adventure, Top-down, Puzzle elements, Post-apocalyptic, 2D scrolling, Direct control"
166690,8Doors: Arum's Afterlife Adventure,2023,,https://www.mobygames.com/game/166690/8doors-arums-afterlife-adventure/,"Action, Side view, Platform, Metroidvania, Fantasy, 2D scrolling, Direct control, Asia"
83608,9 Clues 2: The Ward,2022,,https://www.mobygames.com/game/83608/9-clues-2-the-ward/,"Adventure, 1st-person, Puzzle elements, Detective / mystery, Horror, Hidden object, Fixed / flip-screen, Point and select, North America"
83531,9 Clues: The Secret of Serpent Creek,2022,,https://www.mobygames.com/game/83531/9-clues-the-secret-of-serpent-creek/,"Adventure, 1st-person, Puzzle elements, Detective / mystery, Hidden object, Fixed / flip-screen, Point and select, North America"
176462,9-Ball Pocket,2023,,https://www.mobygames.com/game/176462/9-ball-pocket/,"Sports, Top-down, Pool / snooker, Diagonal-down"
194394,A Building Full of Cats,2023,,https://www.mobygames.com/game/194394/a-building-full-of-cats/,"Hidden object, Puzzle, Fixed / flip-screen, Point and select"
195048,A Castle Full of Cats,2023,,https://www.mobygames.com/game/195048/a-castle-full-of-cats/,"Metroidvania, Hidden object, Puzzle, Fixed / flip-screen, Point and select"
159963,A Day Without Me,2021,,https://www.mobygames.com/game/159963/a-day-without-me/,"Adventure, Puzzle elements, Fantasy, Horror, Diagonal-down, Direct control"
193063,A Frog's Job,2022,,https://www.mobygames.com/game/193063/a-frogs-job/,"Action, Side view, Platform, Fantasy, 2D scrolling, Direct control"
113822,A Gummy's Life,2021,,https://www.mobygames.com/game/113822/a-gummys-life/,"Action, Fighting, Fantasy, Comedy, Diagonal-down, 2D scrolling, Party game, Direct control"
172858,A Juggler's Tale,2021,,https://www.mobygames.com/game/172858/a-jugglers-tale/,"Action, Side view, Platform, Puzzle elements, Fantasy, 2D scrolling, Direct control"
82105,A Little Lily Princess,2021,,https://www.mobygames.com/game/82105/a-little-lily-princess/,"Adventure, Anime / Manga, Visual novel, Romance, Point and select, Europe, Industrial Age"
194818,A Little to the Left,2024,,https://www.mobygames.com/game/194818/a-little-to-the-left/,"Puzzle, Fixed / flip-screen, Point and select"
218494,A Little to the Left: Cupboards & Drawers,2024,,https://www.mobygames.com/game/218494/a-little-to-the-left-cupboards-drawers/,"Add-on, Extras, Map / level, Mechanics"
227222,A Little to the Left: Seeing Stars,2024,,https://www.mobygames.com/game/227222/a-little-to-the-left-seeing-stars/,"Add-on, Map / level, Other, Audio (Music / SFX / Voice), Mechanics"
182749,A Memoir Blue,2022,,https://www.mobygames.com/game/182749/a-memoir-blue/,"Adventure, 3rd-person (Other), Graphic adventure, Point and select, Contemporary"
180832,A Musical Story,2022,,https://www.mobygames.com/game/180832/a-musical-story/,"Action, Simulation, Top-down, Music / rhythm, Fixed / flip-screen"
187388,A Perfect Day,2023,,https://www.mobygames.com/game/187388/a-perfect-day/,"Adventure, Real-time, Fixed / flip-screen, Graphic adventure, Point and select, Asia, Contemporary"
126856,A Plague Tale: Innocence,2021,,https://www.mobygames.com/game/126856/a-plague-tale-innocence/,"Action, Fantasy, Stealth, Behind view, Direct control, Europe, Medieval"
126932,A Plague Tale: Innocence - Coats of Arms,2021,,https://www.mobygames.com/game/126932/a-plague-tale-innocence-coats-of-arms/,"Add-on, Customization / outfit / skin"
193614,A Plague Tale: Requiem,2022,7.89,https://www.mobygames.com/game/193614/a-plague-tale-requiem/,"Action, Fantasy, Stealth, Behind view, Direct control, Europe, Medieval"
194129,A Plague Tale: Requiem,2022,,https://www.mobygames.com/game/194129/a-plague-tale-requiem/,"Compilation, Extra content / game, Special edition"
193823,A Plague Tale: Requiem - The Protector Pack,2022,,https://www.mobygames.com/game/193823/a-plague-tale-requiem-the-protector-pack/,"Add-on, Item, Customization / outfit / skin"
175380,A Pretty Odd Bunny,2021,,https://www.mobygames.com/game/175380/a-pretty-odd-bunny/,"Action, Side view, Platform, Fantasy, Stealth, Comedy, 2D scrolling, Direct control"
125707,A Short Hike,2021,,https://www.mobygames.com/game/125707/a-short-hike/,"Action, Flight / aviation, Platform, Puzzle elements, Fantasy, Diagonal-down, 2D scrolling, Direct control"
166681,A Sketchbook About Her Sun,2022,,https://www.mobygames.com/game/166681/a-sketchbook-about-her-sun/,"Adventure, Visual novel, 3rd-person (Other), Menu structures"
143045,A Space for the Unbound,2023,,https://www.mobygames.com/game/143045/a-space-for-the-unbound/,"Adventure, Side view, Puzzle elements, Fantasy, Visual novel, Fixed / flip-screen, Point and select, Direct control, Asia"
189856,A Tale of Paper: Refolded,2022,,https://www.mobygames.com/game/189856/a-tale-of-paper-refolded/,"Action, Side view, Platform, Puzzle elements, Fantasy, 2D scrolling, Direct control"
118503,A Winter's Daydream,2022,,https://www.mobygames.com/game/118503/a-winters-daydream/,"Adventure, 1st-person, Anime / Manga, Visual novel, Romance"
49683,A World of Keflings,2020,,https://www.mobygames.com/game/49683/a-world-of-keflings/,"Simulation, Strategy / tactics, Top-down, Real-time"
106240,A World of Keflings: The Curse of the Zombiesaurus,2020,,https://www.mobygames.com/game/106240/a-world-of-keflings-the-curse-of-the-zombiesaurus/,"Add-on, Player unit, Story / mission"
172933,A Year of Springs,2021,,https://www.mobygames.com/game/172933/a-year-of-springs/,Compilation
100965,Aabs Animals,2023,,https://www.mobygames.com/game/100965/aabs-animals/,"Simulation, Meditative / Zen"
201460,Abomi Nation,2023,,https://www.mobygames.com/game/201460/abomi-nation/,"Adventure, Side view, Isometric, Role-playing (RPG), Hunting, Diagonal-down, Fixed / flip-screen, Japanese-style RPG (JRPG), Roguelike, Direct control, Menu structures"
161611,Acalesia,2021,,https://www.mobygames.com/game/161611/acalesia/,"Action, Side view, Platform, Fantasy, 2D scrolling, Direct control"
207348,Acceptance,2023,,https://www.mobygames.com/game/207348/acceptance/,"Action, Side view, Horror, 2D scrolling, Direct control"
191710,Accident,2022,,https://www.mobygames.com/game/191710/accident/,"Action, Simulation, 1st-person, Life / social simulation, Healthcare, Time management, Direct control, Contemporary"
160081,Ace Strike,2021,,https://www.mobygames.com/game/160081/ace-strike/,"Action, Arcade, Shooter, Helicopter, 3rd-person (Other), Vehicular combat, Direct control"
35409,Aces of the Galaxy,2020,,https://www.mobygames.com/game/35409/aces-of-the-galaxy/,"Action, Sci-fi / futuristic, Behind view, Rail shooter, Space flight"
144763,Active Neurons,2022,,https://www.mobygames.com/game/144763/active-neurons/,"Educational, Math / logic, Puzzle, Fixed / flip-screen, Point and select"
158899,Active Neurons 3: Wonders of the World,2021,,https://www.mobygames.com/game/158899/active-neurons-3-wonders-of-the-world/,"Educational, Math / logic, Puzzle, Fixed / flip-screen, Point and select"
208571,Ad Infinitum,2023,,https://www.mobygames.com/game/208571/ad-infinitum/,"Action, 1st-person, Puzzle elements, Fantasy, Horror, Survival horror, Direct control, Europe, World War I"
172717,The Addams Family: Mansion Mayhem,2021,,https://www.mobygames.com/game/172717/the-addams-family-mansion-mayhem/,"Action, Platform, Fantasy, Licensed, Diagonal-down, 2D scrolling, Direct control"
160751,Adios,2021,,https://www.mobygames.com/game/160751/adios/,"Adventure, 1st-person, Crime, Graphic adventure, Direct control, Contemporary"
206837,Adore,2023,,https://www.mobygames.com/game/206837/adore/,"Role-playing (RPG), Fantasy, Diagonal-down, 2D scrolling, Action RPG, Direct control"
18822,Advent Rising,2021,,https://www.mobygames.com/game/18822/advent-rising/,"Action, Sci-fi / futuristic, Shooter, Behind view"
215166,Adventure Tanks,2023,,https://www.mobygames.com/game/215166/adventure-tanks/,"Action, Shooter, Tank, Behind view, Direct control"
78215,Adventure Time: The Secret of the Nameless Kingdom,2021,,https://www.mobygames.com/game/78215/adventure-time-the-secret-of-the-nameless-kingdom/,"Action, Puzzle elements, Post-apocalyptic, Fantasy, Licensed, Diagonal-down, 2D scrolling"
151314,Adventures of Chris,2022,,https://www.mobygames.com/game/151314/adventures-of-chris/,"Action, Side view, Platform, Fantasy, Comedy, 2D scrolling, RPG elements, Direct control"
157084,Adverse,2021,,https://www.mobygames.com/game/157084/adverse/,"Action, Sports, 1st-person, Arcade, Shooter, Meditative / Zen, Darts / target shooting, Direct control"
173010,Aeon Drive,2021,,https://www.mobygames.com/game/173010/aeon-drive/,"Action, Side view, Platform, Puzzle elements, Cyberpunk / dark sci-fi, 2D scrolling, Direct control, Europe"
173690,Aeon Must Die!,2021,,https://www.mobygames.com/game/173690/aeon-must-die/,"Action, Sci-fi / futuristic, Arcade, Side view, Fighting, Fantasy, Beat 'em up / brawler, 2D scrolling, Direct control"
164661,Aerial_Knight's Never Yield,2021,,https://www.mobygames.com/game/164661/aerial_knights-never-yield/,"Action, Arcade, Platform, Music / rhythm, 3rd-person (Other), Point and select, North America"
159460,Aery: A Journey Beyond Time,2021,,https://www.mobygames.com/game/159460/aery-a-journey-beyond-time/,"Adventure, Simulation, Arcade, Meditative / Zen, Diagonal-down, Cinematic camera, Direct control"
184214,Aery: A New Frontier,2022,,https://www.mobygames.com/game/184214/aery-a-new-frontier/,"Adventure, Simulation, Flight / aviation, Meditative / Zen, Fantasy, Behind view, Graphic adventure, Direct control"
168099,Aery: Calm Mind,2021,,https://www.mobygames.com/game/168099/aery-calm-mind/,"Adventure, Simulation, Arcade, Flight / aviation, Meditative / Zen, Diagonal-down, Cinematic camera, Direct control"
181844,Aery: Calm Mind 2,2022,,https://www.mobygames.com/game/181844/aery-calm-mind-2/,"Adventure, Simulation, Arcade, Flight / aviation, Meditative / Zen, 3rd-person (Other), Diagonal-down, Cinematic camera, Direct control"
200012,Aery: Calm Mind 3,2023,,https://www.mobygames.com/game/200012/aery-calm-mind-3/,"Simulation, Meditative / Zen, Behind view, Direct control"
214323,Aery: Calm Mind 4,2023,,https://www.mobygames.com/game/214323/aery-calm-mind-4/,"Simulation, Flight / aviation, Meditative / Zen, Fantasy, Behind view, Direct control"
226009,Aery: Cyber City,2024,,https://www.mobygames.com/game/226009/aery-cyber-city/,"Simulation, Flight / aviation, Meditative / Zen, Fantasy, Behind view, Direct control"
178177,Aery: Dreamscape,2022,,https://www.mobygames.com/game/178177/aery-dreamscape/,"Adventure, Simulation, Flight / aviation, Meditative / Zen, Fantasy, Behind view, Diagonal-down, Graphic adventure, Direct control"
207502,Aery: Flow of Time,2023,,https://www.mobygames.com/game/207502/aery-flow-of-time/,"Simulation, Fantasy, Behind view, Direct control"
207509,Aery: Heaven & Hell,2023,,https://www.mobygames.com/game/207509/aery-heaven-hell/,"Simulation, Fantasy, Behind view, Direct control"
192946,Aery: Last Day of Earth,2022,,https://www.mobygames.com/game/192946/aery-last-day-of-earth/,"Adventure, 1st-person, Flight / aviation, Post-apocalyptic, Meditative / Zen, Fantasy, Behind view, Cinematic camera, Direct control"
194748,Aery: Path of Corruption,2022,,https://www.mobygames.com/game/194748/aery-path-of-corruption/,"Adventure, Simulation, Arcade, Flight / aviation, Meditative / Zen, Fantasy, 3rd-person (Other), Diagonal-down, Cinematic camera, Direct control"
226012,Aery: Stone Age,2024,,https://www.mobygames.com/game/226012/aery-stone-age/,"Simulation, Flight / aviation, Meditative / Zen, Fantasy, Behind view, Direct control"
207501,Aery: The Lost Hero,2023,,https://www.mobygames.com/game/207501/aery-the-lost-hero/,"Simulation, Fantasy, Behind view, Direct control"
188438,Aery: Vikings,2022,,https://www.mobygames.com/game/188438/aery-vikings/,"Adventure, Simulation, Flight / aviation, Meditative / Zen, Fantasy, Behind view, Graphic adventure, Direct control"
176651,Aeterna Noctis,2021,,https://www.mobygames.com/game/176651/aeterna-noctis/,"Action, Side view, Platform, Metroidvania, Fantasy, 2D scrolling, Direct control"
205072,AEW: Fight Forever,2023,6.73,https://www.mobygames.com/game/205072/aew-fight-forever/,"Sports, Wrestling, Licensed, 3rd-person (Other), Direct control"
213759,AEW: Fight Forever (Bring the Boom Edition),2023,,https://www.mobygames.com/game/213759/aew-fight-forever-bring-the-boom-edition/,"Compilation, Extra content / game, Special edition"
213353,AEW: Fight Forever (Elite Edition),2023,,https://www.mobygames.com/game/213353/aew-fight-forever-elite-edition/,"Extra content / game, Special edition"
213871,AEW: Fight Forever - Beat the Elite,2023,,https://www.mobygames.com/game/213871/aew-fight-forever-beat-the-elite/,"Add-on, Game mode"
213360,AEW: Fight Forever - Dynamite featuring The Acclaimed,2023,,https://www.mobygames.com/game/213360/aew-fight-forever-dynamite-featuring-the-acclaimed/,"Add-on, Player unit"
223625,AEW: Fight Forever - Elite Beats and Stadium Stampede Expansion,2024,,https://www.mobygames.com/game/223625/aew-fight-forever-elite-beats-and-stadium-stampede-expansion/,"Add-on, Customization / outfit / skin, Audio (Music / SFX / Voice)"
217629,AEW: Fight Forever - Freebie 4 da Fans,2024,,https://www.mobygames.com/game/217629/aew-fight-forever-freebie-4-da-fans/,"Add-on, Customization / outfit / skin, Audio (Music / SFX / Voice)"
213357,AEW: Fight Forever - FTR: Revival Pack,2023,,https://www.mobygames.com/game/213357/aew-fight-forever-ftr-revival-pack/,"Add-on, Player unit"
221644,AEW: Fight Forever - Hayter's Gunna Game,2024,,https://www.mobygames.com/game/221644/aew-fight-forever-hayters-gunna-game/,"Add-on, Player unit, Audio (Music / SFX / Voice)"
213359,"AEW: Fight Forever - Hookhausen: Very Handsome, Very Evil Pack",2023,,https://www.mobygames.com/game/213359/aew-fight-forever-hookhausen-very-handsome-very-evil-pack/,"Add-on, Player unit"
213358,AEW: Fight Forever - Limitless Bunny Bundle,2023,,https://www.mobygames.com/game/213358/aew-fight-forever-limitless-bunny-bundle/,"Add-on, Player unit"
213356,AEW: Fight Forever - Matt Hardy,2023,,https://www.mobygames.com/game/213356/aew-fight-forever-matt-hardy/,"Add-on, Player unit"
225771,AEW: Fight Forever - Rated Gold Superstar Pack,2024,,https://www.mobygames.com/game/225771/aew-fight-forever-rated-gold-superstar-pack/,"Add-on, Map / level, Customization / outfit / skin, Player unit"
213355,AEW: Fight Forever - Season Pass,2023,,https://www.mobygames.com/game/213355/aew-fight-forever-season-pass/,"Add-on, Compilation, Player unit"
213362,AEW: Fight Forever - Season Pass 2,2023,,https://www.mobygames.com/game/213362/aew-fight-forever-season-pass-2/,"Add-on, Compilation, Game mode, Player unit"
217631,AEW: Fight Forever - Season Pass 3,2024,,https://www.mobygames.com/game/217631/aew-fight-forever-season-pass-3/,"Add-on, Compilation, Map / level, Customization / outfit / skin, Player unit, Audio (Music / SFX / Voice)"
223624,AEW: Fight Forever - Season Pass 4,2024,,https://www.mobygames.com/game/223624/aew-fight-forever-season-pass-4/,"Add-on, Compilation, Game mode, Map / level, Customization / outfit / skin, Player unit, Audio (Music / SFX / Voice)"
217627,AEW: Fight Forever - Swerve to the Beach,2024,,https://www.mobygames.com/game/217627/aew-fight-forever-swerve-to-the-beach/,"Add-on, Map / level, Player unit"
215405,AEW: Fight Forever - The Storm is Coming!,2024,,https://www.mobygames.com/game/215405/aew-fight-forever-the-storm-is-coming/,"Add-on, Player unit, Audio (Music / SFX / Voice)"
223626,AEW: Fight Forever - World War Joe,2024,,https://www.mobygames.com/game/223626/aew-fight-forever-world-war-joe/,"Add-on, Map / level, Customization / outfit / skin, Player unit"
203994,After Us,2023,,https://www.mobygames.com/game/203994/after-us/,"Adventure, Platform, Fantasy, Puzzle, 3rd-person (Other), Cinematic camera, Direct control"
189240,After Wave: Downfall,2022,,https://www.mobygames.com/game/189240/after-wave-downfall/,"Action, Arcade, Shooter, Fantasy, Diagonal-down, Direct control"
209580,Afterdream,2023,,https://www.mobygames.com/game/209580/afterdream/,"Action, Side view, Puzzle elements, Fantasy, 2D scrolling, Graphic adventure, Direct control"
196265,Afterglitch,2022,,https://www.mobygames.com/game/196265/afterglitch/,"Adventure, Sci-fi / futuristic, Puzzle elements, Fantasy, Behind view, Direct control"
202203,Afterimage,2023,,https://www.mobygames.com/game/202203/afterimage/,"Action, Side view, Hack and slash, Fantasy, 2D scrolling, RPG elements, Direct control"
172874,Agatha Christie: Hercule Poirot - The First Cases,2021,,https://www.mobygames.com/game/172874/agatha-christie-hercule-poirot-the-first-cases/,"Adventure, Platform, Detective / mystery, Licensed, Crime, Diagonal-down, 2D scrolling, Graphic adventure, Point and select"
209579,Agatha Christie: Hercule Poirot - The London Case,2023,,https://www.mobygames.com/game/209579/agatha-christie-hercule-poirot-the-london-case/,"Adventure, Puzzle elements, Detective / mystery, Licensed, Crime, Diagonal-down, 2D scrolling, Graphic adventure, Direct control, Europe"
210502,Agatha Christie: Murder on the Orient Express,2023,,https://www.mobygames.com/game/210502/agatha-christie-murder-on-the-orient-express/,"Adventure, Puzzle elements, Detective / mystery, Licensed, 3rd-person (Other), Graphic adventure, Point and select, Contemporary"
221810,Agatha Christie: Murder on the Orient Express (Deluxe Edition),2023,,https://www.mobygames.com/game/221810/agatha-christie-murder-on-the-orient-express-deluxe-edition/,"Digital extras, Special edition"
137199,Age of Empires II: Definitive Edition,2023,,https://www.mobygames.com/game/137199/age-of-empires-ii-definitive-edition/,"Strategy / tactics, Historical events, Real-time, Isometric, Diagonal-down, Free camera, Point and select, Multiple units/characters control, Africa, Asia, Europe, Medieval, Middle East, Pre-Columbian Americas, Real-time strategy (RTS)"
169129,Age of Empires II: Definitive Edition - Dawn of the Dukes,2023,,https://www.mobygames.com/game/169129/age-of-empires-ii-definitive-edition-dawn-of-the-dukes/,"Add-on, Player unit, Story / mission"
183608,Age of Empires II: Definitive Edition - Dynasties of India,2023,,https://www.mobygames.com/game/183608/age-of-empires-ii-definitive-edition-dynasties-of-india/,"Add-on, Player unit, Story / mission"
157933,Age of Empires II: Definitive Edition - Lords of the West,2023,,https://www.mobygames.com/game/157933/age-of-empires-ii-definitive-edition-lords-of-the-west/,"Add-on, NPC / enemy, Player unit, Story / mission"
203175,Age of Empires II: Definitive Edition - Return of Rome,2023,,https://www.mobygames.com/game/203175/age-of-empires-ii-definitive-edition-return-of-rome/,"Add-on, Game mode, Map / level, Player unit, Story / mission, Classical antiquity, Audio (Music / SFX / Voice)"
211159,Age of Empires II: Definitive Edition - The Mountain Royals,2023,,https://www.mobygames.com/game/211159/age-of-empires-ii-definitive-edition-the-mountain-royals/,"Add-on, Player unit, Story / mission"
219506,Age of Empires II: Definitive Edition - Victors and Vanquished,2024,,https://www.mobygames.com/game/219506/age-of-empires-ii-definitive-edition-victors-and-vanquished/,"Add-on, Story / mission"
198808,Age of Empires II: Deluxe Definitive Edition Bundle,2023,,https://www.mobygames.com/game/198808/age-of-empires-ii-deluxe-definitive-edition-bundle/,Compilation
174359,Age of Empires IV,2023,,https://www.mobygames.com/game/174359/age-of-empires-iv/,"Strategy / tactics, Historical events, Diagonal-down, Free camera, Point and select, Multiple units/characters control, Asia, China (Ancient / Imperial), Europe, Real-time strategy (RTS)"
211824,Age of Empires IV: The Sultans Ascend,2023,,https://www.mobygames.com/game/211824/age-of-empires-iv-the-sultans-ascend/,"Add-on, Map / level, Player unit, Story / mission"
202495,Age of Wonders 4,2023,7.52,https://www.mobygames.com/game/202495/age-of-wonders-4/,"Strategy / tactics, Fantasy, Turn-based, Diagonal-down, Free camera, 4X, Point and select, Multiple units/characters control, Turn-based strategy (TBS)"
204678,Age of Wonders 4: Dragon Dawn,2023,,https://www.mobygames.com/game/204678/age-of-wonders-4-dragon-dawn/,"Add-on, Item, Map / level, Other, Customization / outfit / skin, Player unit"
226247,Age of Wonders 4: Eldritch Realms,2024,,https://www.mobygames.com/game/226247/age-of-wonders-4-eldritch-realms/,"Add-on, Map / level, Other, Customization / outfit / skin, Player unit, Story / mission, Audio (Music / SFX / Voice), Mechanics"
211500,Age of Wonders 4: Empires & Ashes,2023,,https://www.mobygames.com/game/211500/age-of-wonders-4-empires-ashes/,"Add-on, Map / level, Other, Customization / outfit / skin, Player unit, Story / mission, Mechanics"
202526,Age of Wonders 4: Expansion Pass,2023,,https://www.mobygames.com/game/202526/age-of-wonders-4-expansion-pass/,Compilation
202527,Age of Wonders 4: Pre-Order Content Pack,2023,,https://www.mobygames.com/game/202527/age-of-wonders-4-pre-order-content-pack/,"Add-on, Customization / outfit / skin, Player unit"
202497,Age of Wonders 4: Premium Edition,2023,,https://www.mobygames.com/game/202497/age-of-wonders-4-premium-edition/,Compilation
218422,Age of Wonders 4: Primal Fury,2024,,https://www.mobygames.com/game/218422/age-of-wonders-4-primal-fury/,"Add-on, Map / level, Other, Customization / outfit / skin, Player unit"
202554,Age of Wonders 4: Sign-Up Content,2023,,https://www.mobygames.com/game/202554/age-of-wonders-4-sign-up-content/,"Add-on, Customization / outfit / skin"
135498,Agent Intercept,2022,,https://www.mobygames.com/game/135498/agent-intercept/,"Action, Racing / Driving, Naval / watercraft, Diagonal-down, 2D scrolling, Direct control, Automobile"
114433,Aground,2021,,https://www.mobygames.com/game/114433/aground/,"Action, Strategy / tactics, Side view, Role-playing (RPG), 2D scrolling, City building / construction simulation"
130036,AI: The Somnium Files,2021,,https://www.mobygames.com/game/130036/ai-the-somnium-files/,"Adventure, 1st-person, Sci-fi / futuristic, Puzzle elements, Detective / mystery, Anime / Manga, Thriller, 2D scrolling, Japanese-style adventure, Point and select, Quick Time Events (QTEs), Japan (Modern/Futuristic)"
187183,AI: The Somnium Files - nirvanA Initiative,2022,,https://www.mobygames.com/game/187183/ai-the-somnium-files-nirvana-initiative/,"Adventure, Sci-fi / futuristic, Puzzle elements, Detective / mystery, Anime / Manga, Thriller, 3rd-person (Other), Menu structures, Japan (Modern/Futuristic)"
157665,Air Bounce: The Jump 'n' Run Challenge,2021,,https://www.mobygames.com/game/157665/air-bounce-the-jump-n-run-challenge/,"Action, Platform, Fantasy, 3rd-person (Other), Direct control"
174594,Air Stunt Racing,2021,,https://www.mobygames.com/game/174594/air-stunt-racing/,"Action, Racing / Driving, Arcade, Flight / aviation, Tricks / stunts, Behind view, Direct control"
