ID,Title,Release Year,Moby Score,URL,Genres
179448,RPG Ambition Record,2022,,https://www.mobygames.com/game/179448/rpg-ambition-record/,"Role-playing (RPG), Anime / Manga, Fantasy, Diagonal-down, 2D scrolling, Japanese-style RPG (JRPG), Point and select, Direct control"
169008,RPG Armed Emeth,2021,,https://www.mobygames.com/game/169008/rpg-armed-emeth/,"Sci-fi / futuristic, Role-playing (RPG), Anime / Manga, Fantasy, Turn-based, Diagonal-down, 2D scrolling, Japanese-style RPG (JRPG), Direct control"
194844,RPG Silver Nornir,2022,,https://www.mobygames.com/game/194844/rpg-silver-nornir/,"Role-playing (RPG), Anime / Manga, Fantasy, Turn-based, Diagonal-down, 2D scrolling, Japanese-style RPG (JRPG), Direct control"
177903,RPG Sword of Elpisia,2022,,https://www.mobygames.com/game/177903/rpg-sword-of-elpisia/,"Top-down, Side view, Role-playing (RPG), Anime / Manga, Fantasy, Turn-based, 2D scrolling, Japanese-style RPG (JRPG), Direct control"
189884,RPG Time: The Legend of Wright,2022,,https://www.mobygames.com/game/189884/rpg-time-the-legend-of-wright/,"Role-playing (RPG), Diagonal-down, Japanese-style RPG (JRPG), Point and select"
178543,RPGolf Legends,2022,,https://www.mobygames.com/game/178543/rpgolf-legends/,"Sports, Puzzle elements, Golf, Role-playing (RPG), Fantasy, Diagonal-down, Action RPG, Direct control"
176295,Rubber Bandits,2021,,https://www.mobygames.com/game/176295/rubber-bandits/,"Action, Fantasy, Diagonal-down, 2D scrolling, Party game, Direct control"
198143,Rubber Bandits: Fur Party Pack,2022,,https://www.mobygames.com/game/198143/rubber-bandits-fur-party-pack/,"Add-on, Customization / outfit / skin"
198142,Rubber Bandits: Go Wild Pack,2022,,https://www.mobygames.com/game/198142/rubber-bandits-go-wild-pack/,"Add-on, Customization / outfit / skin"
198141,Rubber Bandits: Supporter Pack,2021,,https://www.mobygames.com/game/198141/rubber-bandits-supporter-pack/,"Add-on, Customization / outfit / skin, Player unit"
221557,Rubber Hose Rampage,2024,,https://www.mobygames.com/game/221557/rubber-hose-rampage/,"Action, Arcade, Side view, Shooter, Fantasy, Fixed / flip-screen, Direct control"
208934,Rubberduck Wave Racer,2023,,https://www.mobygames.com/game/208934/rubberduck-wave-racer/,"Racing / Driving, Naval / watercraft, Fantasy, Licensed, Behind view, Direct control, Track racing"
218340,Ruff Ghanor,2024,,https://www.mobygames.com/game/218340/ruff-ghanor/,"Strategy / tactics, Side view, Cards / tiles, Fantasy, Turn-based, Fixed / flip-screen"
179052,Rugby 22,2022,,https://www.mobygames.com/game/179052/rugby-22/,"Sports, Rugby, Licensed, Diagonal-down, 2D scrolling, Direct control"
149767,Ruinarch,2023,,https://www.mobygames.com/game/149767/ruinarch/,"Simulation, Strategy / tactics, Top-down, Fantasy, 2D scrolling, City building / construction simulation, Point and select"
175569,Ruined King: A League of Legends Story,2021,,https://www.mobygames.com/game/175569/ruined-king-a-league-of-legends-story/,"Side view, Role-playing (RPG), Fantasy, Turn-based, Diagonal-down, 2D scrolling, Fixed / flip-screen, Point and select"
200057,Ruined King: A League of Legends Story - Lost & Found Weapon Pack,2021,,https://www.mobygames.com/game/200057/ruined-king-a-league-of-legends-story-lost-found-weapon-pack/,"Add-on, Upgrade (Skill / Boost)"
200054,Ruined King: A League of Legends Story - Manamune Sword for Yasuo,2021,,https://www.mobygames.com/game/200054/ruined-king-a-league-of-legends-story-manamune-sword-for-yasuo/,"Add-on, Item"
200056,Ruined King: A League of Legends Story - Ruination Starter Pack,2021,,https://www.mobygames.com/game/200056/ruined-king-a-league-of-legends-story-ruination-starter-pack/,"Add-on, Item, Upgrade (Skill / Boost)"
200055,Ruined King: A League of Legends Story - Ruined Skin Variants,2021,,https://www.mobygames.com/game/200055/ruined-king-a-league-of-legends-story-ruined-skin-variants/,"Add-on, Customization / outfit / skin"
155088,Ruinverse,2020,,https://www.mobygames.com/game/155088/ruinverse/,"Real-time, Side view, Role-playing (RPG), Anime / Manga, Fantasy, Turn-based, Diagonal-down, 2D scrolling, Japanese-style RPG (JRPG), Direct control"
155941,Ruinverse: Damage x2,2020,,https://www.mobygames.com/game/155941/ruinverse-damage-x2/,"Add-on, Upgrade (Skill / Boost)"
155940,Ruinverse: Experience x3,2020,,https://www.mobygames.com/game/155940/ruinverse-experience-x3/,"Add-on, Upgrade (Skill / Boost)"
155939,Ruinverse: No Skill Cost,2020,,https://www.mobygames.com/game/155939/ruinverse-no-skill-cost/,"Add-on, Upgrade (Skill / Boost)"
133570,The Rumble Fish 2,2022,,https://www.mobygames.com/game/133570/the-rumble-fish-2/,"Action, Sci-fi / futuristic, Side view, Fighting, Anime / Manga, 2D scrolling, Direct control"
216278,The Rumble Fish 2: Beatrice,2022,,https://www.mobygames.com/game/216278/the-rumble-fish-2-beatrice/,"Add-on, Player unit"
216206,The Rumble Fish 2: Greed,2022,,https://www.mobygames.com/game/216206/the-rumble-fish-2-greed/,"Add-on, Player unit"
216228,The Rumble Fish 2: Hazama,2022,,https://www.mobygames.com/game/216228/the-rumble-fish-2-hazama/,"Add-on, Player unit"
216677,The Rumble Fish+,2023,,https://www.mobygames.com/game/216677/the-rumble-fish/,"Action, Side view, Fighting, Anime / Manga, Fantasy, 2D scrolling, Direct control"
189609,Rumbleverse,2022,,https://www.mobygames.com/game/189609/rumbleverse/,"Action, Fantasy, Behind view, Direct control"
145699,Run Sausage Run!,2022,,https://www.mobygames.com/game/145699/run-sausage-run/,"Action, Side view, Fantasy, 2D scrolling, Direct control"
191498,RunBean Galactic,2023,,https://www.mobygames.com/game/191498/runbean-galactic/,"Action, Sci-fi / futuristic, Side view, Platform, Fixed / flip-screen, Direct control"
187680,Running on Magic,2022,,https://www.mobygames.com/game/187680/running-on-magic/,"Action, Side view, Platform, Fantasy, 2D scrolling, Direct control"
190778,Runnyk,2023,,https://www.mobygames.com/game/190778/runnyk/,"Side view, Platform, Metroidvania, Role-playing (RPG), Fantasy, 2D scrolling, Action RPG, Direct control"
193719,Runout,2022,,https://www.mobygames.com/game/193719/runout/,"Action, Sci-fi / futuristic, Side view, Platform, Puzzle elements, 2D scrolling, Direct control"
169603,Rush Rally Origins,2022,,https://www.mobygames.com/game/169603/rush-rally-origins/,"Racing / Driving, Off-roading, Diagonal-down, Direct control, Automobile, Track racing"
165021,Rust: Console Edition,2021,,https://www.mobygames.com/game/165021/rust-console-edition/,"Action, Shooter, Behind view, Cinematic camera, Direct control"
165023,Rust: Console Edition - Deluxe,2021,,https://www.mobygames.com/game/165023/rust-console-edition-deluxe/,"Extra content / game, Special edition"
166398,Rust: Console Edition - New Cobalt Employee Welcome Pack,2021,,https://www.mobygames.com/game/166398/rust-console-edition-new-cobalt-employee-welcome-pack/,"Add-on, Currency, Customization / outfit / skin"
165024,Rust: Console Edition - Ultimate,2021,,https://www.mobygames.com/game/165024/rust-console-edition-ultimate/,"Extra content / game, Special edition"
159363,Rustler,2021,,https://www.mobygames.com/game/159363/rustler/,"Action, Racing / Driving, Shooter, Fantasy, Diagonal-down, 2D scrolling, Sandbox / open world, Direct control, Medieval"
154052,Ruvato: Original Complex,2021,,https://www.mobygames.com/game/154052/ruvato-original-complex/,"Action, Anime / Manga, Hack and slash, Fantasy, Diagonal-down, Direct control"
97911,Ruya,2022,,https://www.mobygames.com/game/97911/ruya/,"Puzzle, Fixed / flip-screen, Tile matching puzzle, Point and select"
195295,RWBY: Arrowfell,2022,,https://www.mobygames.com/game/195295/rwby-arrowfell/,"Action, Side view, Platform, Puzzle elements, Hack and slash, Fantasy, Licensed, 2D scrolling, Direct control"
180458,Ryan's Rescue Squad,2022,,https://www.mobygames.com/game/180458/ryans-rescue-squad/,"Action, Side view, Platform, Fantasy, Licensed, 2D scrolling, Mini-games, Direct control"
148458,Rki,2021,,https://www.mobygames.com/game/148458/roki/,"Adventure, Puzzle elements, Fantasy, 3rd-person (Other), Cinematic camera, Graphic adventure, Direct control, Europe"
43313,S.T.A.L.K.E.R.: Call of Pripyat,2024,,https://www.mobygames.com/game/43313/stalker-call-of-pripyat/,"Action, 1st-person, Shooter, Post-apocalyptic, RPG elements, Direct control, Europe"
35954,S.T.A.L.K.E.R.: Clear Sky - Prologue,2024,,https://www.mobygames.com/game/35954/stalker-clear-sky-prologue/,"Action, 1st-person, Shooter, Post-apocalyptic, RPG elements, Direct control, Europe"
43940,S.T.A.L.K.E.R.: Complete Edition,2024,,https://www.mobygames.com/game/43940/stalker-complete-edition/,Compilation
27172,S.T.A.L.K.E.R.: Shadow of Chernobyl,2024,,https://www.mobygames.com/game/27172/stalker-shadow-of-chernobyl/,"Action, 1st-person, Shooter, Post-apocalyptic, RPG elements, Direct control, Europe"
172660,S.W.A.N.: Chernobyl Unexplored,2022,,https://www.mobygames.com/game/172660/swan-chernobyl-unexplored/,"Adventure, 1st-person, Puzzle elements, Detective / mystery, Horror, Survival horror, Direct control, Europe"
172584,Sable,2021,,https://www.mobygames.com/game/172584/sable/,"Adventure, Racing / Driving, Sci-fi / futuristic, Puzzle elements, Behind view, Sandbox / open world, Direct control"
166211,Sable's Grimoire,2021,,https://www.mobygames.com/game/166211/sables-grimoire/,"Adventure, Side view, Anime / Manga, Fantasy, Visual novel, Fixed / flip-screen, Point and select"
36551,Sacred 2: Fallen Angel,2021,,https://www.mobygames.com/game/36551/sacred-2-fallen-angel/,"Sci-fi / futuristic, Real-time, Role-playing (RPG), Hack and slash, Fantasy, Diagonal-down, Action RPG, Point and select, Direct control"
172566,Safari Cannon,2021,,https://www.mobygames.com/game/172566/safari-cannon/,"Action, Side view, 2D scrolling, Direct control, Africa"
136012,Safari Pinball,2023,,https://www.mobygames.com/game/136012/safari-pinball/,"Action, 1st-person, Pinball, 2D scrolling, Direct control, Africa"
201113,Saga of Sins,2023,6.29,https://www.mobygames.com/game/201113/saga-of-sins/,"Action, Side view, Fantasy, 2D scrolling, RPG elements, Direct control, Medieval"
216465,Saga of the Moon Priestess,2024,,https://www.mobygames.com/game/216465/saga-of-the-moon-priestess/,"Action, Puzzle elements, Fantasy, Diagonal-down, Fixed / flip-screen, Direct control"
196672,Sail Forth,2022,,https://www.mobygames.com/game/196672/sail-forth/,"Action, Simulation, Managerial / business simulation, Naval / watercraft, Fantasy, 3rd-person (Other), Direct control, Sea pirates / Caribbean"
174414,Saint Kotar,2022,,https://www.mobygames.com/game/174414/saint-kotar/,"Adventure, Detective / mystery, Horror, 3rd-person (Other), Point and select, Europe"
190216,Saints Row,2022,6.38,https://www.mobygames.com/game/190216/saints-row/,"Action, Racing / Driving, Shooter, Fantasy, Crime, Behind view, Sandbox / open world, Direct control, North America"
212292,Saints Row: A Song of Ice and Dust,2023,,https://www.mobygames.com/game/212292/saints-row-a-song-of-ice-and-dust/,"Add-on, NPC / enemy, Customization / outfit / skin, Player unit, Story / mission"
205334,Saints Row: Doc Ketchum's Murder Circus,2023,,https://www.mobygames.com/game/205334/saints-row-doc-ketchums-murder-circus/,"Add-on, Game mode, Item, Other, Customization / outfit / skin"
203016,Saints Row: The Heist and The Hazardous,2023,,https://www.mobygames.com/game/203016/saints-row-the-heist-and-the-hazardous/,"Add-on, Item, Map / level, Customization / outfit / skin, Story / mission"
197847,Salamander County Public Television,2023,,https://www.mobygames.com/game/197847/salamander-county-public-television/,"Action, Full Motion Video (FMV), Fantasy, Comedy, 3rd-person (Other), Fixed / flip-screen, Mini-games, Point and select, Direct control"
187290,Sally Face,2022,,https://www.mobygames.com/game/187290/sally-face/,"Adventure, Side view, Puzzle elements, Compilation, Fantasy, 2D scrolling"
154883,Sam & Max: Save the World,2021,,https://www.mobygames.com/game/154883/sam-max-save-the-world/,"Adventure, Puzzle elements, Detective / mystery, Compilation, Licensed, Comedy, 3rd-person (Other), Graphic adventure, Point and select"
168229,Samurai Warriors 5,2021,7.64,https://www.mobygames.com/game/168229/samurai-warriors-5/,"Action, Historical events, Anime / Manga, Hack and slash, War, Behind view, Direct control, Japan (Ancient/Classical/Medieval)"
222800,Sand Land,2024,7.31,https://www.mobygames.com/game/222800/sand-land/,"Role-playing (RPG), Anime / Manga, Fantasy, Licensed, Behind view, Action RPG, Direct control"
223706,Sand Land: My Furniture Set - Army Base,2024,,https://www.mobygames.com/game/223706/sand-land-my-furniture-set-army-base/,"Add-on, Licensed, Customization / outfit / skin"
223825,Sand Land: My Room Furniture Set - Hideout,2024,,https://www.mobygames.com/game/223825/sand-land-my-room-furniture-set-hideout/,"Add-on, Licensed, Customization / outfit / skin"
223679,Sand Land: Speed Demon Pack,2024,,https://www.mobygames.com/game/223679/sand-land-speed-demon-pack/,"Add-on, Licensed, Item"
161079,Sanity of Morris,2021,,https://www.mobygames.com/game/161079/sanity-of-morris/,"Action, 1st-person, Detective / mystery, Survival horror"
194343,Saturnalia,2022,,https://www.mobygames.com/game/194343/saturnalia/,"Action, Puzzle elements, Fantasy, Horror, Stealth, Survival horror, Behind view, Roguelike, Direct control, Europe"
162612,Savage Halloween,2021,7.03,https://www.mobygames.com/game/162612/savage-halloween/,"Action, Arcade, Side view, Platform, Shooter, Fantasy, 2D scrolling, Direct control"
125544,Save Koch,2023,,https://www.mobygames.com/game/125544/save-koch/,"Adventure, Simulation, Strategy / tactics, Sci-fi / futuristic, Managerial / business simulation, Detective / mystery, Fantasy, Crime, Fixed / flip-screen, Menu structures"
194665,Save Room,2022,,https://www.mobygames.com/game/194665/save-room/,"Simulation, Managerial / business simulation, Puzzle, Fixed / flip-screen, Point and select"
177314,Scarf,2023,,https://www.mobygames.com/game/177314/scarf/,"Action, Platform, Puzzle elements, Fantasy, Behind view, Direct control"
166686,Scarlet Nexus,2021,7.85,https://www.mobygames.com/game/166686/scarlet-nexus/,"Sci-fi / futuristic, Role-playing (RPG), Anime / Manga, Behind view, Action RPG, Direct control"
176809,Scarlet Nexus: Bond Enhancement Pack 1,2021,,https://www.mobygames.com/game/176809/scarlet-nexus-bond-enhancement-pack-1/,"Add-on, Item, Other, Customization / outfit / skin"
176796,Scarlet Nexus: Bond Enhancement Pack 2,2021,,https://www.mobygames.com/game/176796/scarlet-nexus-bond-enhancement-pack-2/,"Add-on, Item, Other, Customization / outfit / skin"
176808,Scarlet Nexus: Brain Punk Bundle,2021,,https://www.mobygames.com/game/176808/scarlet-nexus-brain-punk-bundle/,"Add-on, Other, Customization / outfit / skin"
176807,Scarlet Nexus: Preorder Bundle,2021,,https://www.mobygames.com/game/176807/scarlet-nexus-preorder-bundle/,"Add-on, Customization / outfit / skin"
176806,Scarlet Nexus: Season Pass,2021,,https://www.mobygames.com/game/176806/scarlet-nexus-season-pass/,"Add-on, Item, Other, Customization / outfit / skin"
176810,Scarlet Nexus: Ultimate Upgrade Pack,2021,,https://www.mobygames.com/game/176810/scarlet-nexus-ultimate-upgrade-pack/,"Add-on, Other, Customization / outfit / skin"
199914,Scars Above,2023,6.78,https://www.mobygames.com/game/199914/scars-above/,"Action, Sci-fi / futuristic, Shooter, Puzzle elements, Fantasy, 3rd-person (Other), Direct control"
176842,sCATch: The Painter Cat,2023,,https://www.mobygames.com/game/176842/scatch-the-painter-cat/,"Puzzle, Fixed / flip-screen"
222723,Scheming Through the Zombie Apocalypse Episode 2: Caged,2024,,https://www.mobygames.com/game/222723/scheming-through-the-zombie-apocalypse-episode-2-caged/,"Adventure, 1st-person, Side view, Puzzle elements, Post-apocalyptic, Fantasy, Hidden object, 2D scrolling, Fixed / flip-screen, Graphic adventure, Point and select"
206906,Sclash,2024,,https://www.mobygames.com/game/206906/sclash/,"Action, Side view, Fighting, 2D scrolling, Direct control"
193526,Scorn,2022,6.22,https://www.mobygames.com/game/193526/scorn/,"Action, Shooter, Fantasy, Horror, Puzzle, Direct control"
157630,Scott Pilgrim vs. The World: The Game - Complete Edition,2021,,https://www.mobygames.com/game/157630/scott-pilgrim-vs-the-world-the-game-complete-edition/,"Action, Side view, Compilation, Licensed, Beat 'em up / brawler, 2D scrolling, Direct control"
220040,Scott Whiskers: The Search for Mr. Fumbleclaw,2024,,https://www.mobygames.com/game/220040/scott-whiskers-the-search-for-mr-fumbleclaw/,"Adventure, Puzzle elements, Comedy, 3rd-person (Other), Graphic adventure, Point and select"
99917,Scrap Garden,2021,,https://www.mobygames.com/game/99917/scrap-garden/,"Action, Side view, Platform, Post-apocalyptic, Puzzle, 3rd-person (Other), Mini-games"
190117,SD Gundam: Battle Alliance,2022,,https://www.mobygames.com/game/190117/sd-gundam-battle-alliance/,"Action, Sci-fi / futuristic, Anime / Manga, Licensed, 3rd-person (Other), Action RPG, Direct control"
193538,Sea Horizon,2023,,https://www.mobygames.com/game/193538/sea-horizon/,"Side view, Role-playing (RPG), Fantasy, Turn-based, Diagonal-down, Roguelike, Point and select"
207900,Sea of Stars,2023,7.73,https://www.mobygames.com/game/207900/sea-of-stars/,"Top-down, Role-playing (RPG), Fantasy, Turn-based, 2D scrolling, Japanese-style RPG (JRPG), Direct control"
106024,Sea of Thieves,2020,,https://www.mobygames.com/game/106024/sea-of-thieves/,"Action, 1st-person, Naval / watercraft, Fantasy, Comedy, Sandbox / open world, Massively Multiplayer, RPG elements, Direct control, Sea pirates / Caribbean"
160035,The Sealed Ampoule,2022,,https://www.mobygames.com/game/160035/the-sealed-ampoule/,"Top-down, Role-playing (RPG), Anime / Manga, Fantasy, Turn-based, 2D scrolling, Roguelike, Direct control, Contemporary"
150934,Second Extinction,2021,,https://www.mobygames.com/game/150934/second-extinction/,"Action, 1st-person, Shooter, Fantasy, Direct control"
188464,Seduction: A Monk's Fate,2022,,https://www.mobygames.com/game/188464/seduction-a-monks-fate/,"Action, Side view, Puzzle elements, Horror, 2D scrolling, Direct control"
140795,Seeds of Resilience,2020,,https://www.mobygames.com/game/140795/seeds-of-resilience/,"Simulation, Strategy / tactics, Managerial / business simulation, Turn-based, Diagonal-down, Free camera, City building / construction simulation, Point and select"
140637,Self,2021,,https://www.mobygames.com/game/140637/self/,"Adventure, Simulation, Puzzle elements, Fantasy, 2D scrolling, Mini-games, Graphic adventure, Point and select"
149713,Sense,2022,,https://www.mobygames.com/game/149713/sense/,"Adventure, Puzzle elements, Cyberpunk / dark sci-fi, 3rd-person (Other), Graphic adventure, Point and select"
191956,SENSEs: Midnight,2023,,https://www.mobygames.com/game/191956/senses-midnight/,"Adventure, Puzzle elements, Cyberpunk / dark sci-fi, 3rd-person (Other), Graphic adventure, Point and select"
200253,Sentry Paragon,2023,,https://www.mobygames.com/game/200253/sentry-paragon/,"Action, Arcade, Top-down, Shooter, Isometric, Fantasy, 2D scrolling, Direct control"
224313,Senua's Saga: Hellblade II,2024,7.83,https://www.mobygames.com/game/224313/senuas-saga-hellblade-ii/,"Action, Puzzle elements, Hack and slash, Behind view, Direct control, Europe"
191540,Serial Cleaners,2022,,https://www.mobygames.com/game/191540/serial-cleaners/,"Action, Puzzle elements, Stealth, Crime, Diagonal-down, 2D scrolling, Direct control, North America"
202936,Serial Cleaners: Dino Park,2023,,https://www.mobygames.com/game/202936/serial-cleaners-dino-park/,Add-on
149246,Serious Sam 4,2021,,https://www.mobygames.com/game/149246/serious-sam-4/,"Action, 1st-person, Sci-fi / futuristic, Shooter, Direct control"
143192,Serious Sam Collection,2020,,https://www.mobygames.com/game/143192/serious-sam-collection/,"Action, 1st-person, Shooter, Compilation, Direct control"
178639,Serious Sam: Siberian Mayhem,2022,,https://www.mobygames.com/game/178639/serious-sam-siberian-mayhem/,"Action, 1st-person, Sci-fi / futuristic, Shooter, Direct control, Asia"
199621,The Settlers: New Allies,2023,,https://www.mobygames.com/game/199621/the-settlers-new-allies/,"Simulation, Strategy / tactics, Real-time, Managerial / business simulation, Diagonal-down, Free camera, City building / construction simulation, Point and select, Multiple units/characters control, Medieval, Real-time strategy (RTS)"
212775,Settris,2023,,https://www.mobygames.com/game/212775/settris/,"Side view, Puzzle, Fixed / flip-screen, Direct control"
169160,Seven Doors,2023,,https://www.mobygames.com/game/169160/seven-doors/,"Adventure, 1st-person, Puzzle elements, Direct control"
172403,Severed Steel,2022,,https://www.mobygames.com/game/172403/severed-steel/,"Action, 1st-person, Shooter, Cyberpunk / dark sci-fi, Direct control"
207379,Shadow Gambit: The Cursed Crew,2023,,https://www.mobygames.com/game/207379/shadow-gambit-the-cursed-crew/,"Strategy / tactics, Real-time, Stealth, Diagonal-down, Free camera, Point and select, Multiple units/characters control, Sea pirates / Caribbean, Real-time tactics (RTT)"
213454,Shadow Gambit: The Cursed Crew - Complete Edition,2023,,https://www.mobygames.com/game/213454/shadow-gambit-the-cursed-crew-complete-edition/,Compilation
213447,Shadow Gambit: Yuki's Wish,2023,,https://www.mobygames.com/game/213447/shadow-gambit-yukis-wish/,"Add-on, Map / level, Player unit, Story / mission, Japan (Ancient/Classical/Medieval)"
213451,Shadow Gambit: Zagan's Ritual,2023,,https://www.mobygames.com/game/213451/shadow-gambit-zagans-ritual/,"Add-on, Map / level, Player unit, Story / mission"
162559,Shadow Man: Remastered,2022,,https://www.mobygames.com/game/162559/shadow-man-remastered/,"Action, Fantasy, Licensed, Behind view, Direct control"
179172,Shadow Warrior 3,2022,,https://www.mobygames.com/game/179172/shadow-warrior-3/,"Action, 1st-person, Shooter, Fantasy, Comedy, RPG elements, Direct control, Asia"
61418,Shadowrun Returns,2022,,https://www.mobygames.com/game/61418/shadowrun-returns/,"Sci-fi / futuristic, Isometric, Role-playing (RPG), Cyberpunk / dark sci-fi, Fantasy, Licensed, Turn-based, Diagonal-down"
149834,Shadowrun: Complete Collection,2022,,https://www.mobygames.com/game/149834/shadowrun-complete-collection/,Compilation
69986,Shadowrun: Dragonfall - Director's Cut,2022,,https://www.mobygames.com/game/69986/shadowrun-dragonfall-directors-cut/,"Sci-fi / futuristic, Isometric, Role-playing (RPG), Cyberpunk / dark sci-fi, Fantasy, Licensed, Turn-based"
108183,Shadowrun: Hong Kong - Extended Edition,2022,,https://www.mobygames.com/game/108183/shadowrun-hong-kong-extended-edition/,"Strategy / tactics, Isometric, Role-playing (RPG), Cyberpunk / dark sci-fi, Fantasy, Licensed, Turn-based, Diagonal-down"
172664,Shadows of Kurgansk,2021,,https://www.mobygames.com/game/172664/shadows-of-kurgansk/,"Action, 1st-person, Post-apocalyptic, Fantasy, Survival horror, RPG elements, Direct control"
155521,Shady Part of Me,2020,,https://www.mobygames.com/game/155521/shady-part-of-me/,"Platform, Fantasy, Puzzle, 3rd-person (Other), Direct control"
155079,Shakes on a Plane,2021,,https://www.mobygames.com/game/155079/shakes-on-a-plane/,"Action, Arcade, Diagonal-down, Fixed / flip-screen, Party game, Direct control"
216056,Shalnor Legends II: Trials of Thunder,2024,,https://www.mobygames.com/game/216056/shalnor-legends-ii-trials-of-thunder/,"Role-playing (RPG), Fantasy, Diagonal-down, 2D scrolling, Japanese-style RPG (JRPG), Direct control"
175701,Shapeshooter,2022,,https://www.mobygames.com/game/175701/shapeshooter/,"Action, Sci-fi / futuristic, Arcade, Fantasy, Tank, Diagonal-down, 2D scrolling, Rail shooter, Direct control"
169647,Shark Pinball,2023,,https://www.mobygames.com/game/169647/shark-pinball/,"Action, 1st-person, Pinball, 2D scrolling, Fixed / flip-screen, Direct control"
212769,Shark! Shark!,2023,,https://www.mobygames.com/game/212769/shark-shark/,"Action, Arcade, Side view, Fixed / flip-screen, Direct control"
190606,Shatter: Remastered,2022,,https://www.mobygames.com/game/190606/shatter-remastered/,"Action, Sci-fi / futuristic, Side view, Paddle / Pong, Fixed / flip-screen, Direct control"
87001,She Wants Me Dead,2022,,https://www.mobygames.com/game/87001/she-wants-me-dead/,"Action, Side view, Platform, 2D scrolling"
149981,Sheepo,2021,,https://www.mobygames.com/game/149981/sheepo/,"Action, Sci-fi / futuristic, Side view, Platform, Metroidvania, Puzzle elements, 2D scrolling, Direct control"
175574,Sherlock Holmes: Chapter One,2021,7.48,https://www.mobygames.com/game/175574/sherlock-holmes-chapter-one/,"Adventure, 1st-person, Puzzle elements, Detective / mystery, Licensed, 3rd-person (Other), Graphic adventure, Point and select, Direct control, Quick Time Events (QTEs)"
188802,Sherlock Holmes: Chapter One - Clergyman Cassock,2022,,https://www.mobygames.com/game/188802/sherlock-holmes-chapter-one-clergyman-cassock/,"Add-on, Customization / outfit / skin"
188801,Sherlock Holmes: Chapter One - Victorian Starter Pack,2022,,https://www.mobygames.com/game/188801/sherlock-holmes-chapter-one-victorian-starter-pack/,"Add-on, Currency, Customization / outfit / skin, Story / mission"
201712,Sherlock Holmes: The Awakened,2023,7.16,https://www.mobygames.com/game/201712/sherlock-holmes-the-awakened/,"Adventure, Puzzle elements, Detective / mystery, Behind view, Graphic adventure, Direct control"
147039,Shieldmaiden,2023,,https://www.mobygames.com/game/147039/shieldmaiden/,"Action, Side view, Platform, Post-apocalyptic, 2D scrolling, Direct control"
225958,Shin Megami Tensei V: Vengeance,2024,,https://www.mobygames.com/game/225958/shin-megami-tensei-v-vengeance/,"Role-playing (RPG), Anime / Manga, Post-apocalyptic, Fantasy, Turn-based, 3rd-person (Other), Behind view, Direct control, Japan (Modern/Futuristic)"
