ID,Title,Release Year,Moby Score,URL,Genres
225526,Lesson Learned: Cult of the Elizabeth,2024,,https://www.mobygames.com/game/225526/lesson-learned-cult-of-the-elizabeth/,"Action, Fantasy, Comedy, Diagonal-down, Tower defense, Point and select, Direct control"
174959,Let's Build a Zoo,2022,,https://www.mobygames.com/game/174959/lets-build-a-zoo/,"Simulation, Managerial / business simulation, Diagonal-down, Free camera, City building / construction simulation, Point and select, Menu structures, Contemporary"
185004,Let's Build a Zoo: Dinosaur Island,2022,,https://www.mobygames.com/game/185004/lets-build-a-zoo-dinosaur-island/,"Add-on, NPC / enemy, Item, Story / mission"
154606,Let's Cook Together,2021,,https://www.mobygames.com/game/154606/lets-cook-together/,"Action, Diagonal-down, Party game, Point and select, Direct control"
153501,Let's Sing 2021,2020,,https://www.mobygames.com/game/153501/lets-sing-2021/,"Simulation, Real-time, Music / rhythm, Audio game, Voice control"
176357,Let's Sing 2022,2021,,https://www.mobygames.com/game/176357/lets-sing-2022/,"Simulation, Real-time, Music / rhythm, Audio game, Voice control"
203865,Let's Sing 2023,2022,,https://www.mobygames.com/game/203865/lets-sing-2023/,"Simulation, Real-time, Music / rhythm, Audio game, Voice control"
192853,Let's Sing ABBA,2022,,https://www.mobygames.com/game/192853/lets-sing-abba/,"Simulation, Real-time, Music / rhythm, Audio game, Voice control"
206039,Let's! Revolution!,2024,,https://www.mobygames.com/game/206039/lets-revolution/,"Fantasy, Puzzle, Fixed / flip-screen, Roguelike, Point and select"
100522,Lethis: Path of Progress,2022,,https://www.mobygames.com/game/100522/lethis-path-of-progress/,"Simulation, Strategy / tactics, Isometric, Fantasy, Diagonal-down, City building / construction simulation, Steampunk"
93311,The Letter,2021,,https://www.mobygames.com/game/93311/the-letter/,"Adventure, Horror, Visual novel, 3rd-person (Other), Point and select"
193471,Letterbox by POWGI,2022,,https://www.mobygames.com/game/193471/letterbox-by-powgi/,"Puzzle, Fixed / flip-screen, Word construction, Point and select"
201530,The Library of Babel,2023,,https://www.mobygames.com/game/201530/the-library-of-babel/,"Adventure, Side view, Platform, Puzzle elements, Detective / mystery, Post-apocalyptic, Fantasy, 2D scrolling, Point and select, Direct control"
169221,Library of Ruina,2021,,https://www.mobygames.com/game/169221/library-of-ruina/,"Adventure, Strategy / tactics, Side view, Cards / tiles, Anime / Manga, Fantasy, Turn-based, Visual novel, 2D scrolling"
208808,Lies of P,2023,,https://www.mobygames.com/game/208808/lies-of-p/,"Role-playing (RPG), Hack and slash, Fantasy, Behind view, Sandbox / open world, Action RPG, Direct control"
160017,The Life and Suffering of Sir Brante,2022,,https://www.mobygames.com/game/160017/the-life-and-suffering-of-sir-brante/,"Adventure, Simulation, Interactive fiction / text adventure, Role-playing (RPG), Fantasy, Visual novel, Fixed / flip-screen, Menu structures, Medieval"
179190,Life Is Strange: Remastered Collection,2022,,https://www.mobygames.com/game/179190/life-is-strange-remastered-collection/,Compilation
171905,Life Is Strange: True Colors,2021,8.03,https://www.mobygames.com/game/171905/life-is-strange-true-colors/,"Adventure, Puzzle elements, Fantasy, 3rd-person (Other), Cinematic camera, Graphic adventure, Point and select, Direct control, Contemporary, North America"
171910,Life Is Strange: True Colors (Deluxe Edition),2021,,https://www.mobygames.com/game/171910/life-is-strange-true-colors-deluxe-edition/,"Compilation, Special edition"
171911,Life Is Strange: True Colors (Ultimate Edition),2021,,https://www.mobygames.com/game/171911/life-is-strange-true-colors-ultimate-edition/,"Compilation, Extra content / game, Special edition"
171908,Life Is Strange: True Colors - Alex Outfit Pack,2021,,https://www.mobygames.com/game/171908/life-is-strange-true-colors-alex-outfit-pack/,"Add-on, Customization / outfit / skin"
171909,Life Is Strange: True Colors - Deluxe Upgrade,2021,,https://www.mobygames.com/game/171909/life-is-strange-true-colors-deluxe-upgrade/,"Add-on, Customization / outfit / skin, Story / mission"
157017,Life of Fly,2021,,https://www.mobygames.com/game/157017/life-of-fly/,"Adventure, Simulation, Puzzle elements, Diagonal-down, Cinematic camera, Direct control"
166227,Life of Fly 2,2021,,https://www.mobygames.com/game/166227/life-of-fly-2/,"Adventure, Simulation, Puzzle elements, Cinematic camera, Direct control"
99651,Liftoff,2020,,https://www.mobygames.com/game/99651/liftoff/,"Simulation, Sports, Racing / Driving, 1st-person, Flight / aviation, Behind view, Direct control"
180058,Light Up the Room,2022,,https://www.mobygames.com/game/180058/light-up-the-room/,"Action, Side view, Platform, Puzzle elements, Fantasy, Fixed / flip-screen, Direct control"
160706,The Light: Remake,2021,,https://www.mobygames.com/game/160706/the-light-remake/,"Adventure, 1st-person, Puzzle elements, Post-apocalyptic, Horror, Direct control"
219917,Lightyear Frontier,2024,,https://www.mobygames.com/game/219917/lightyear-frontier/,"Simulation, 1st-person, Sci-fi / futuristic, Mecha / giant robot, City building / construction simulation, Sandbox / open world, Direct control"
211533,Like a Dragon Gaiden: The Man Who Erased His Name,2023,7.46,https://www.mobygames.com/game/211533/like-a-dragon-gaiden-the-man-who-erased-his-name/,"Action, Martial arts, Beat 'em up / brawler, Behind view, Mini-games, Direct control, Japan (Modern/Futuristic)"
214315,Like a Dragon Gaiden: The Man Who Erased His Name - Legendary Fighter Pack,2023,,https://www.mobygames.com/game/214315/like-a-dragon-gaiden-the-man-who-erased-his-name-legendary-fight/,"Add-on, NPC / enemy, Player unit"
216560,Like a Dragon: Infinite Wealth,2024,8.68,https://www.mobygames.com/game/216560/like-a-dragon-infinite-wealth/,"Action, Behind view, Mini-games, Direct control, North America, Japan (Modern/Futuristic)"
217189,Like a Dragon: Infinite Wealth - Assorted Outfit Bundle,2024,,https://www.mobygames.com/game/217189/like-a-dragon-infinite-wealth-assorted-outfit-bundle/,"Add-on, Customization / outfit / skin"
216722,Like a Dragon: Infinite Wealth - Gearworks Crafting Set (Large),2024,,https://www.mobygames.com/game/216722/like-a-dragon-infinite-wealth-gearworks-crafting-set-large/,"Add-on, Item"
216721,Like a Dragon: Infinite Wealth - Gearworks Crafting Set (Medium),2024,,https://www.mobygames.com/game/216721/like-a-dragon-infinite-wealth-gearworks-crafting-set-medium/,"Add-on, Item"
216850,Like a Dragon: Infinite Wealth - Job Leveling Set (Medium),2024,,https://www.mobygames.com/game/216850/like-a-dragon-infinite-wealth-job-leveling-set-medium/,"Add-on, Item"
216849,Like a Dragon: Infinite Wealth - Job Leveling Set (Small),2024,,https://www.mobygames.com/game/216849/like-a-dragon-infinite-wealth-job-leveling-set-small/,"Add-on, Item"
216690,Like a Dragon: Infinite Wealth - Leveling Set (Extra Large),2024,,https://www.mobygames.com/game/216690/like-a-dragon-infinite-wealth-leveling-set-extra-large/,"Add-on, Upgrade (Skill / Boost)"
216687,Like a Dragon: Infinite Wealth - Leveling Set (Large),2024,,https://www.mobygames.com/game/216687/like-a-dragon-infinite-wealth-leveling-set-large/,"Add-on, Upgrade (Skill / Boost)"
216686,Like a Dragon: Infinite Wealth - Leveling Set (Medium),2024,,https://www.mobygames.com/game/216686/like-a-dragon-infinite-wealth-leveling-set-medium/,"Add-on, Upgrade (Skill / Boost)"
216684,Like a Dragon: Infinite Wealth - Leveling Set (Small),2024,,https://www.mobygames.com/game/216684/like-a-dragon-infinite-wealth-leveling-set-small/,"Add-on, Upgrade (Skill / Boost)"
216724,Like a Dragon: Infinite Wealth - Self-Improvement Booster Set (Medium),2024,,https://www.mobygames.com/game/216724/like-a-dragon-infinite-wealth-self-improvement-booster-set-mediu/,"Add-on, Upgrade (Skill / Boost)"
216723,Like a Dragon: Infinite Wealth - Self-Improvement Booster Set (Small),2024,,https://www.mobygames.com/game/216723/like-a-dragon-infinite-wealth-self-improvement-booster-set-small/,"Add-on, Upgrade (Skill / Boost)"
217190,Like a Dragon: Infinite Wealth - Special Job Set,2024,,https://www.mobygames.com/game/217190/like-a-dragon-infinite-wealth-special-job-set/,"Add-on, Upgrade (Skill / Boost)"
217191,Like a Dragon: Infinite Wealth - Yakuza CD Collection Set,2024,,https://www.mobygames.com/game/217191/like-a-dragon-infinite-wealth-yakuza-cd-collection-set/,"Add-on, Audio (Music / SFX / Voice)"
199655,Like a Dragon: Ishin!,2023,7.47,https://www.mobygames.com/game/199655/like-a-dragon-ishin/,"Action, Martial arts, Beat 'em up / brawler, Behind view, Mini-games, Direct control, Japan (Modern/Futuristic)"
199806,Like a Dragon: Ishin! - Elite Generals Trooper Card Bundle,2023,,https://www.mobygames.com/game/199806/like-a-dragon-ishin-elite-generals-trooper-card-bundle/,"Add-on, NPC / enemy"
199804,Like a Dragon: Ishin! - Gun Upgrade Materials Kit,2023,,https://www.mobygames.com/game/199804/like-a-dragon-ishin-gun-upgrade-materials-kit/,"Add-on, Item"
200376,Like a Dragon: Ishin! - Poet Immortal Katana,2023,,https://www.mobygames.com/game/200376/like-a-dragon-ishin-poet-immortal-katana/,"Add-on, Item"
199802,Like a Dragon: Ishin! - Ryoma Growth Support Kit,2023,,https://www.mobygames.com/game/199802/like-a-dragon-ishin-ryoma-growth-support-kit/,"Add-on, Item"
199801,Like a Dragon: Ishin! - Shinsengumi Captain's Set,2023,,https://www.mobygames.com/game/199801/like-a-dragon-ishin-shinsengumi-captains-set/,"Add-on, Game mode, Customization / outfit / skin"
199803,Like a Dragon: Ishin! - Sword Upgrade Materials Kit,2023,,https://www.mobygames.com/game/199803/like-a-dragon-ishin-sword-upgrade-materials-kit/,"Add-on, Item"
199805,Like a Dragon: Ishin! - Third Division Armament Expansion Kit,2023,,https://www.mobygames.com/game/199805/like-a-dragon-ishin-third-division-armament-expansion-kit/,"Add-on, NPC / enemy, Item"
190322,Like No Other: The Legend of the Twin Books,2022,,https://www.mobygames.com/game/190322/like-no-other-the-legend-of-the-twin-books/,"Adventure, Puzzle elements, 3rd-person (Other), 2D scrolling, Graphic adventure, Point and select"
196450,Lil Gator Game,2023,,https://www.mobygames.com/game/196450/lil-gator-game/,"Simulation, Fantasy, Behind view, Direct control"
216472,Lil' Guardsman,2024,,https://www.mobygames.com/game/216472/lil-guardsman/,"Adventure, Side view, Puzzle elements, Fantasy, Comedy, 2D scrolling, RPG elements, Point and select"
200905,Lila's Tale and the Hidden Forest,2023,,https://www.mobygames.com/game/200905/lilas-tale-and-the-hidden-forest/,"Action, Side view, Platform, Puzzle elements, Fantasy, 2D scrolling, Direct control"
185623,Limb Hunter,2022,,https://www.mobygames.com/game/185623/limb-hunter/,"Action, Side view, Platform, Metroidvania, Cyberpunk / dark sci-fi, 2D scrolling, Direct control"
208416,Lisa: Definitive Edition,2023,,https://www.mobygames.com/game/208416/lisa-definitive-edition/,"Side view, Platform, Puzzle elements, Role-playing (RPG), Compilation, Turn-based, Diagonal-down"
181714,LIT: Bend the Light,2022,,https://www.mobygames.com/game/181714/lit-bend-the-light/,"Side view, Platform, Fantasy, Puzzle, Fixed / flip-screen, Point and select, Steampunk"
114802,Little Bug,2021,,https://www.mobygames.com/game/114802/little-bug/,"Action, Side view, Platform, 2D scrolling, Direct control"
211209,Little Goody Two Shoes,2023,,https://www.mobygames.com/game/211209/little-goody-two-shoes/,"Role-playing (RPG), Fantasy, Diagonal-down, 2D scrolling, Direct control"
111941,Little Kite,2021,,https://www.mobygames.com/game/111941/little-kite/,"Adventure, Puzzle elements, 3rd-person (Other), Fixed / flip-screen, Graphic adventure, Point and select"
223648,"Little Kitty, Big City",2024,7.66,https://www.mobygames.com/game/223648/little-kitty-big-city/,"Simulation, Real-time, Behind view, Sandbox / open world, Direct control, Contemporary"
189315,Little League World Series Baseball 2022,2022,,https://www.mobygames.com/game/189315/little-league-world-series-baseball-2022/,"Sports, Arcade, Baseball, Licensed, Behind view, Direct control"
140200,Little Mouse's Encyclopedia,2021,,https://www.mobygames.com/game/140200/little-mouses-encyclopedia/,"Educational, Side view, Pre-school / toddler, Meditative / Zen, Fantasy, Ecology / nature, 2D scrolling, Point and select"
211155,Little Nightmares II: The Nome's Attic,2021,,https://www.mobygames.com/game/211155/little-nightmares-ii-the-nomes-attic/,"Add-on, Item, Story / mission"
193581,Live by the Sword: Tactics,2022,,https://www.mobygames.com/game/193581/live-by-the-sword-tactics/,"Strategy / tactics, Role-playing (RPG), Fantasy, Turn-based, Diagonal-down, Fixed / flip-screen, Tactical RPG, Point and select, Turn-based strategy (TBS)"
135008,The Living Dungeon,2020,,https://www.mobygames.com/game/135008/the-living-dungeon/,"Strategy / tactics, Board game, Fantasy, Turn-based, Diagonal-down, Free camera, Point and select, Turn-based strategy (TBS)"
219344,Llamasoft: The Jeff Minter Story,2024,7.6,https://www.mobygames.com/game/219344/llamasoft-the-jeff-minter-story/,"Action, Sci-fi / futuristic, Educational, Shooter, History, Compilation, 3rd-person (Other), 2D scrolling, Direct control"
172843,LoBlocks,2023,,https://www.mobygames.com/game/172843/loblocks/,"Action, Side view, Puzzle, Fixed / flip-screen, Falling block puzzle, Direct control"
185954,Lonely Mountains: Downhill - Misty Peak,2022,,https://www.mobygames.com/game/185954/lonely-mountains-downhill-misty-peak/,"Add-on, Map / level, Customization / outfit / skin"
193541,Lonesome Village,2022,,https://www.mobygames.com/game/193541/lonesome-village/,"Action, Simulation, Puzzle elements, Fantasy, Diagonal-down, 2D scrolling, Life / social simulation, Direct control"
165589,Long Ago: A Puzzle Tale,2021,,https://www.mobygames.com/game/165589/long-ago-a-puzzle-tale/,"Fantasy, Puzzle, Diagonal-down, RPG elements, Direct control"
112272,Long Gone Days,2023,,https://www.mobygames.com/game/112272/long-gone-days/,"1st-person, Sci-fi / futuristic, Role-playing (RPG), Anime / Manga, Turn-based, War, Diagonal-down, Japanese-style RPG (JRPG)"
62280,Long Live the Queen,2022,,https://www.mobygames.com/game/62280/long-live-the-queen/,"Adventure, 1st-person, Role-playing (RPG), Anime / Manga, Fantasy"
165423,The Longest Road on Earth,2022,,https://www.mobygames.com/game/165423/the-longest-road-on-earth/,"Adventure, Side view, Fantasy, 2D scrolling"
176705,Looking for Aliens!,2023,,https://www.mobygames.com/game/176705/looking-for-aliens/,"Sci-fi / futuristic, Hidden object, Puzzle, Diagonal-down, Point and select"
160063,Loop Hero,2023,,https://www.mobygames.com/game/160063/loop-hero/,"Role-playing (RPG), Fantasy, Diagonal-down, Fixed / flip-screen, Roguelike, Point and select"
204107,Loop8: Summer of Gods,2023,,https://www.mobygames.com/game/204107/loop8-summer-of-gods/,"Role-playing (RPG), Anime / Manga, Turn-based, 3rd-person (Other), Japanese-style RPG (JRPG), Menu structures, Japan (Modern/Futuristic)"
205202,Loop8: Summer of Gods (Celestial Edition),2023,,https://www.mobygames.com/game/205202/loop8-summer-of-gods-celestial-edition/,"Physical extras, Special edition"
166793,Loopindex,2021,,https://www.mobygames.com/game/166793/loopindex/,"Action, Sci-fi / futuristic, Platform, Puzzle elements, Fantasy, Diagonal-down, 2D scrolling, Direct control"
93947,Loot Hero DX,2021,,https://www.mobygames.com/game/93947/loot-hero-dx/,"Action, Side view, Fantasy, 2D scrolling, RPG elements, Direct control"
183931,Loot River,2022,,https://www.mobygames.com/game/183931/loot-river/,"Action, Top-down, Platform, Puzzle elements, Fantasy, 2D scrolling, Roguelike, Direct control"
199808,Lootbox Lyfe+,2023,,https://www.mobygames.com/game/199808/lootbox-lyfe/,"Action, Side view, Platform, Metroidvania, Fantasy, 2D scrolling, Direct control"
189510,LootLite,2022,,https://www.mobygames.com/game/189510/lootlite/,"Action, Puzzle elements, Fantasy, Diagonal-down, 2D scrolling, Roguelike, RPG elements, Direct control, Medieval"
173330,Lord of the Click II,2021,,https://www.mobygames.com/game/173330/lord-of-the-click-ii/,"Action, Strategy / tactics, Fantasy, Diagonal-down, 2D scrolling, Fixed / flip-screen, Point and select, Medieval"
194975,Lord of the Click III,2022,,https://www.mobygames.com/game/194975/lord-of-the-click-iii/,"Strategy / tactics, Real-time, Side view, Fantasy, Free camera, Point and select, Medieval, Real-time strategy (RTS)"
203643,The Lord of the Rings: Gollum - Emotes Pack,2023,,https://www.mobygames.com/game/203643/the-lord-of-the-rings-gollum-emotes-pack/,"Add-on, Other"
203644,The Lord of the Rings: Gollum - Precious Edition,2023,,https://www.mobygames.com/game/203644/the-lord-of-the-rings-gollum-precious-edition/,"Compilation, Digital extras, Special edition"
203642,The Lord of the Rings: Gollum - Sindarin VO,2023,,https://www.mobygames.com/game/203642/the-lord-of-the-rings-gollum-sindarin-vo/,"Add-on, Audio (Music / SFX / Voice)"
203614,The Lord of the Rings: Gollum,2023,4.42,https://www.mobygames.com/game/203614/the-lord-of-the-rings-gollum/,"Action, Platform, Fantasy, Licensed, Stealth, Behind view, Direct control"
188935,Lord Winklebottom Investigates,2022,,https://www.mobygames.com/game/188935/lord-winklebottom-investigates/,"Adventure, Puzzle elements, Detective / mystery, Fantasy, Comedy, 3rd-person (Other), Graphic adventure, Point and select"
210185,Lords of the Fallen,2023,,https://www.mobygames.com/game/210185/lords-of-the-fallen/,"Role-playing (RPG), Fantasy, Behind view, Action RPG, Direct control"
200164,Loretta,2024,,https://www.mobygames.com/game/200164/loretta/,"Adventure, Side view, Puzzle elements, Thriller, Point and select, Cold War, North America"
168610,Lost At Sea,2021,,https://www.mobygames.com/game/168610/lost-at-sea/,"Adventure, 1st-person, Puzzle elements, Direct control"
159462,The Lost Cube,2021,,https://www.mobygames.com/game/159462/the-lost-cube/,"Action, Adventure, Arcade, Side view, Platform, Fantasy, Horror, 2D scrolling, Direct control"
99496,Lost Grimoires 3: The Forgotten Well,2021,,https://www.mobygames.com/game/99496/lost-grimoires-3-the-forgotten-well/,"1st-person, Hidden object, Puzzle"
166503,Lost in Random,2021,,https://www.mobygames.com/game/166503/lost-in-random/,"Role-playing (RPG), Fantasy, Behind view, Action RPG, Direct control"
172770,Lost Judgment,2021,8.01,https://www.mobygames.com/game/172770/lost-judgment/,"Action, Fighting, Detective / mystery, Crime, 3rd-person (Other), Mini-games, RPG elements, Direct control, Japan (Modern/Futuristic)"
183668,Lost Judgment: The Kaito Files Story Expansion,2022,,https://www.mobygames.com/game/183668/lost-judgment-the-kaito-files-story-expansion/,"Add-on, Story / mission"
164403,Lost Ruins,2022,,https://www.mobygames.com/game/164403/lost-ruins/,"Action, Side view, Platform, Metroidvania, Anime / Manga, Fantasy, 2D scrolling, Direct control"
79625,Lost Sea,2021,,https://www.mobygames.com/game/79625/lost-sea/,"Action, Diagonal-down, 2D scrolling, Roguelike, Direct control"
197504,Lost Snowmen,2022,,https://www.mobygames.com/game/197504/lost-snowmen/,"Action, Side view, Platform, Puzzle elements, Fantasy, 2D scrolling, Direct control"
144061,Lost Words: Beyond the Page,2021,,https://www.mobygames.com/game/144061/lost-words-beyond-the-page/,"Action, Adventure, Side view, Platform, Puzzle elements, Fantasy, Text-based / Spreadsheet, 2D scrolling, Fixed / flip-screen, Graphic adventure, Point and select, Direct control, Contemporary"
167713,Lotus Reverie: First Nexus,2021,,https://www.mobygames.com/game/167713/lotus-reverie-first-nexus/,"Adventure, 1st-person, Anime / Manga, Fantasy, Visual novel, Fixed / flip-screen, Survival, Point and select, Direct control"
188194,Loud,2023,,https://www.mobygames.com/game/188194/loud/,"Action, Arcade, Side view, Fantasy, Music / rhythm, Fixed / flip-screen, Direct control"
171858,Love Choice,2021,,https://www.mobygames.com/game/171858/love-choice/,"Simulation, Visual novel, Romance, 3rd-person (Other), Fixed / flip-screen, Dating simulation, Point and select"
205124,Love Shore,2023,,https://www.mobygames.com/game/205124/love-shore/,"Adventure, 1st-person, Cyberpunk / dark sci-fi, Visual novel, Romance, Fixed / flip-screen, Menu structures"
212046,Low Story,2023,,https://www.mobygames.com/game/212046/low-story/,"Action, Arcade, Side view, Platform, Shooter, Fantasy, 3rd-person (Other), Direct control"
174353,Lucid Cycle,2021,,https://www.mobygames.com/game/174353/lucid-cycle/,"Adventure, Simulation, 1st-person, Puzzle elements, Detective / mystery, Fantasy, Direct control"
117182,Luckslinger: A Fistful of Fortune,2021,,https://www.mobygames.com/game/117182/luckslinger-a-fistful-of-fortune/,"Action, Side view, Shooter, 2D scrolling"
186183,LumbearJack,2022,,https://www.mobygames.com/game/186183/lumbearjack/,"Simulation, Puzzle elements, Fantasy, 3rd-person (Other), City building / construction simulation, RPG elements, Direct control"
145644,Lumberjack's Dynasty,2022,,https://www.mobygames.com/game/145644/lumberjacks-dynasty/,"Simulation, 1st-person, Life / social simulation, Direct control, Contemporary"
222596,Lunar Lander Beyond,2024,,https://www.mobygames.com/game/222596/lunar-lander-beyond/,"Action, Simulation, Sci-fi / futuristic, Arcade, Side view, 2D scrolling, Space flight, Direct control"
201197,Lunark,2023,,https://www.mobygames.com/game/201197/lunark/,"Action, Side view, Platform, Shooter, Puzzle elements, Cyberpunk / dark sci-fi, Fixed / flip-screen, Direct control"
215184,M.A.D. Cows,2023,,https://www.mobygames.com/game/215184/mad-cows/,"Action, Sci-fi / futuristic, Side view, Platform, Shooter, Puzzle elements, Fantasy, Comedy, 2D scrolling, Direct control"
172807,Mad Streets,2021,,https://www.mobygames.com/game/172807/mad-streets/,"Action, Beat 'em up / brawler, Comedy, 3rd-person (Other), Party game, Direct control, Contemporary"
140577,Mad Tower Tycoon,2020,,https://www.mobygames.com/game/140577/mad-tower-tycoon/,"Simulation, Real-time, Side view, Managerial / business simulation, Free camera, City building / construction simulation, Point and select"
149842,Madden NFL 21,2020,,https://www.mobygames.com/game/149842/madden-nfl-21/,"Sports, Real-time, Football (American), Licensed, Diagonal-down, 2D scrolling, Direct control"
169566,Madden NFL 22,2021,,https://www.mobygames.com/game/169566/madden-nfl-22/,"Simulation, Sports, Football (American), Managerial / business simulation, Licensed, Diagonal-down, 2D scrolling, Direct control, Menu structures"
189785,Madden NFL 23,2022,,https://www.mobygames.com/game/189785/madden-nfl-23/,"Simulation, Sports, Football (American), Managerial / business simulation, Licensed, Diagonal-down, 2D scrolling, Direct control, Menu structures"
207336,Madden NFL 24,2023,6.52,https://www.mobygames.com/game/207336/madden-nfl-24/,"Simulation, Sports, Real-time, Football (American), Managerial / business simulation, Licensed, Diagonal-down, 2D scrolling, Direct control, Menu structures"
187450,Madison,2022,,https://www.mobygames.com/game/187450/madison/,"Action, 1st-person, Puzzle elements, Fantasy, Horror, Survival horror, Direct control"
168437,Madness Beverage,2021,,https://www.mobygames.com/game/168437/madness-beverage/,"Action, 1st-person, Sci-fi / futuristic, Shooter, Direct control"
150805,Mafia: Definitive Edition,2020,,https://www.mobygames.com/game/150805/mafia-definitive-edition/,"Action, Racing / Driving, Shooter, Crime, Behind view, Direct control, Automobile, North America, Interwar"
193338,Mage & Monsters,2024,,https://www.mobygames.com/game/193338/mage-monsters/,"Strategy / tactics, Fantasy, Diagonal-down, Fixed / flip-screen, RPG elements, Point and select"
152112,Mages and Treasures,2022,,https://www.mobygames.com/game/152112/mages-and-treasures/,"Role-playing (RPG), Fantasy, Diagonal-down, 2D scrolling, Action RPG, Direct control"
202218,The Mageseeker: A League of Legends Story - Deluxe Edition,2023,,https://www.mobygames.com/game/202218/the-mageseeker-a-league-of-legends-story-deluxe-edition/,Compilation
202215,The Mageseeker: A League of Legends Story - Hijacked Spells Pack,2023,,https://www.mobygames.com/game/202215/the-mageseeker-a-league-of-legends-story-hijacked-spells-pack/,"Add-on, Other"
202212,The Mageseeker: A League of Legends Story - Home Sweet Cave Pack,2023,,https://www.mobygames.com/game/202212/the-mageseeker-a-league-of-legends-story-home-sweet-cave-pack/,"Add-on, Customization / outfit / skin"
202211,The Mageseeker: A League of Legends Story - Silverwing Supply Station Pack,2023,,https://www.mobygames.com/game/202211/the-mageseeker-a-league-of-legends-story-silverwing-supply-stati/,"Add-on, NPC / enemy, Other"
202216,The Mageseeker: A League of Legends Story - Unchained Skins Pack,2023,,https://www.mobygames.com/game/202216/the-mageseeker-a-league-of-legends-story-unchained-skins-pack/,"Add-on, Customization / outfit / skin"
201945,The Mageseeker: A League of Legends Story,2023,7.63,https://www.mobygames.com/game/201945/the-mageseeker-a-league-of-legends-story/,"Role-playing (RPG), Hack and slash, Fantasy, Licensed, Diagonal-down, 2D scrolling, Action RPG, Direct control"
191497,Maggie the Magnet,2022,,https://www.mobygames.com/game/191497/maggie-the-magnet/,"Side view, Platform, Puzzle, Fixed / flip-screen, Direct control"
114146,Magic Nations,2021,,https://www.mobygames.com/game/114146/magic-nations/,"Strategy / tactics, Fantasy, Turn-based, Diagonal-down, Fixed / flip-screen, Trading / collectible card, Point and select"
202372,Magical Drop VI,2024,,https://www.mobygames.com/game/202372/magical-drop-vi/,"Arcade, Real-time, Anime / Manga, Puzzle, Fixed / flip-screen"
171169,The Magister,2021,,https://www.mobygames.com/game/171169/the-magister/,"Strategy / tactics, Cards / tiles, Role-playing (RPG), Detective / mystery, Fantasy, Diagonal-down, Turn-based strategy (TBS)"
