ID,Title,Release Year,Moby Score,URL,Genres
138043,Drawngeon: Dungeons of Ink and Paper,2020,,https://www.mobygames.com/game/138043/drawngeon-dungeons-of-ink-and-paper/,"1st-person, Puzzle elements, Role-playing (RPG), Fantasy, 2D scrolling, Action RPG, Point and select, Direct control"
142794,DreadOut 2,2022,5.85,https://www.mobygames.com/game/142794/dreadout-2/,"Action, Puzzle elements, Fantasy, Horror, Survival horror, Behind view, Direct control"
72161,Dreaming Sarah,2021,,https://www.mobygames.com/game/72161/dreaming-sarah/,"Action, Side view, Platform, Puzzle elements, Fantasy, Direct control"
149340,Dreamscaper,2022,,https://www.mobygames.com/game/149340/dreamscaper/,"Role-playing (RPG), Hack and slash, Fantasy, Diagonal-down, 2D scrolling, Action RPG, Direct control"
211399,DreamWorks All-Star Kart Racing,2023,,https://www.mobygames.com/game/211399/dreamworks-all-star-kart-racing/,"Action, Racing / Driving, Fantasy, Behind view, Direct control, Automobile, Track racing"
191342,DreamWorks Dragons: Legends of The Nine Realms,2022,,https://www.mobygames.com/game/191342/dreamworks-dragons-legends-of-the-nine-realms/,"Action, Fantasy, Licensed, Diagonal-down, 2D scrolling, Direct control"
165753,DreamWorks Spirit: Lucky's Big Adventure,2021,,https://www.mobygames.com/game/165753/dreamworks-spirit-luckys-big-adventure/,"Adventure, Fantasy, Licensed, 3rd-person (Other), Sandbox / open world, RPG elements, Direct control"
217527,DreamWorks Trolls Remix Rescue,2023,,https://www.mobygames.com/game/217527/dreamworks-trolls-remix-rescue/,"Action, Platform, Fantasy, Licensed, Behind view, Direct control"
201121,Dredge,2023,7.96,https://www.mobygames.com/game/201121/dredge/,"Simulation, Top-down, Puzzle elements, Naval / watercraft, Fantasy, 2D scrolling, Sandbox / open world, RPG elements, Direct control"
201122,Dredge: Blackstone Key,2023,,https://www.mobygames.com/game/201122/dredge-blackstone-key/,"Add-on, Item"
201124,Dredge: Digital Deluxe Edition,2023,,https://www.mobygames.com/game/201124/dredge-digital-deluxe-edition/,Compilation
211997,Dredge: The Pale Reach,2023,,https://www.mobygames.com/game/211997/dredge-the-pale-reach/,"Add-on, NPC / enemy, Item, Map / level, Story / mission"
116386,Drizzlepath: Deja Vu,2021,,https://www.mobygames.com/game/116386/drizzlepath-deja-vu/,"Adventure, 1st-person, Direct control"
179364,Drone Gladiator,2022,,https://www.mobygames.com/game/179364/drone-gladiator/,"Action, Sci-fi / futuristic, Fighting, Mecha / giant robot, Fantasy, Behind view"
138047,Drop It: Block Paradise,2022,,https://www.mobygames.com/game/138047/drop-it-block-paradise/,"Arcade, Side view, Puzzle, Fixed / flip-screen, Point and select"
206525,Drunken Fist 2: Zombie Hangover,2022,,https://www.mobygames.com/game/206525/drunken-fist-2-zombie-hangover/,"Action, Fantasy, Comedy, 3rd-person (Other), Direct control"
156097,Drunken Fist: Totally Accurate Beat 'em Up,2020,,https://www.mobygames.com/game/156097/drunken-fist-totally-accurate-beat-em-up/,"Action, Fantasy, Beat 'em up / brawler, 3rd-person (Other), Diagonal-down, Direct control"
224497,Duck Detective: The Secret Salami,2024,,https://www.mobygames.com/game/224497/duck-detective-the-secret-salami/,"Adventure, Isometric, Detective / mystery, Fantasy, Comedy, Diagonal-down, Direct control"
153042,Duck Life: Adventure,2020,,https://www.mobygames.com/game/153042/duck-life-adventure/,"Action, Racing / Driving, Side view, Platform, Fantasy, Diagonal-down, 2D scrolling, Mini-games, Direct control"
163589,Dull Grey,2021,,https://www.mobygames.com/game/163589/dull-grey/,"Adventure, Side view, Visual novel, 2D scrolling, Direct control"
219426,Dune: Imperium,2024,,https://www.mobygames.com/game/219426/dune-imperium/,"Strategy / tactics, Sci-fi / futuristic, Top-down, Board game, Licensed, Turn-based, Fixed / flip-screen, Point and select"
183482,Dune: Spice Wars,2023,,https://www.mobygames.com/game/183482/dune-spice-wars/,"Strategy / tactics, Sci-fi / futuristic, Real-time, Licensed, Diagonal-down, Free camera, 4X, Point and select, Multiple units/characters control, Real-time strategy (RTS)"
219218,Dune: Spice Wars - House Vernius of Ix,2024,,https://www.mobygames.com/game/219218/dune-spice-wars-house-vernius-of-ix/,"Add-on, Player unit"
163075,Dungeon & Gravestone,2021,,https://www.mobygames.com/game/163075/dungeon-gravestone/,"Role-playing (RPG), Fantasy, Diagonal-down, 2D scrolling, Roguelike, Action RPG, Direct control"
181819,Dungeon Color,2022,,https://www.mobygames.com/game/181819/dungeon-color/,"Action, Top-down, Puzzle elements, Fantasy, Diagonal-down, 2D scrolling, Direct control"
142824,Dungeon Defenders: Awakened,2021,,https://www.mobygames.com/game/142824/dungeon-defenders-awakened/,"Action, Strategy / tactics, Role-playing (RPG), Fantasy, Behind view, Diagonal-down, Tower defense, Action RPG, Point and select, Direct control"
184834,Dungeon Defenders: Awakened - Chromatic Costumes,2021,,https://www.mobygames.com/game/184834/dungeon-defenders-awakened-chromatic-costumes/,"Add-on, Item, Customization / outfit / skin"
184830,Dungeon Defenders: Awakened - Gator Gear Weapons and Accessories,2021,,https://www.mobygames.com/game/184830/dungeon-defenders-awakened-gator-gear-weapons-and-accessories/,"Add-on, Item, Customization / outfit / skin"
184832,Dungeon Defenders: Awakened - Original Hero Paper Masks,2021,,https://www.mobygames.com/game/184832/dungeon-defenders-awakened-original-hero-paper-masks/,"Add-on, Item, Customization / outfit / skin"
184836,Dungeon Defenders: Awakened - Winter Defenderland,2021,,https://www.mobygames.com/game/184836/dungeon-defenders-awakened-winter-defenderland/,"Add-on, Item, Customization / outfit / skin"
102518,Dungeon Escape,2021,,https://www.mobygames.com/game/102518/dungeon-escape/,"Action, Side view, Platform, Fantasy, Fixed / flip-screen, Direct control"
166750,The Dungeon of Naheulbeuk: The Amulet of Chaos - Chicken Edition,2021,,https://www.mobygames.com/game/166750/the-dungeon-of-naheulbeuk-the-amulet-of-chaos-chicken-edition/,"Action, Strategy / tactics, Role-playing (RPG), Compilation, Fantasy, Turn-based, 3rd-person (Other), Diagonal-down, Tactical RPG"
188693,Dungeon Slime Collection,2022,,https://www.mobygames.com/game/188693/dungeon-slime-collection/,"Top-down, Platform, Compilation, Puzzle, Fixed / flip-screen, Direct control"
217186,Dungeonoid 2: Awakening,2024,,https://www.mobygames.com/game/217186/dungeonoid-2-awakening/,"Action, Side view, Paddle / Pong, Fantasy, 2D scrolling, Direct control"
159679,Dungeons & Bombs,2021,,https://www.mobygames.com/game/159679/dungeons-bombs/,"Action, Puzzle elements, Fantasy, Diagonal-down, Fixed / flip-screen, Direct control"
166582,Dungeons & Dragons: Dark Alliance,2021,,https://www.mobygames.com/game/166582/dungeons-dragons-dark-alliance/,"Role-playing (RPG), Fantasy, Licensed, Behind view, Action RPG, Direct control"
197038,Dungeons & Dragons: Dark Alliance - Echoes of the Blood War,2022,,https://www.mobygames.com/game/197038/dungeons-dragons-dark-alliance-echoes-of-the-blood-war/,"Add-on, Map / level, Player unit"
211584,Dungeons 4,2023,,https://www.mobygames.com/game/211584/dungeons-4/,"Strategy / tactics, Real-time, Managerial / business simulation, Fantasy, Diagonal-down, RPG elements, Point and select"
211592,Dungeons 4: Deluxe Edition,2023,,https://www.mobygames.com/game/211592/dungeons-4-deluxe-edition/,"Digital extras, Extra content / game, Special edition"
211589,Dungeons 4: Deluxe Edition Content,2023,,https://www.mobygames.com/game/211589/dungeons-4-deluxe-edition-content/,"Add-on, Map / level, Other, Customization / outfit / skin"
202279,Dungeons III: Complete Edition,2020,,https://www.mobygames.com/game/202279/dungeons-iii-complete-edition/,Compilation
201840,Dust & Neon,2023,7.03,https://www.mobygames.com/game/201840/dust-neon/,"Action, Real-time, Shooter, Isometric, Diagonal-down, Roguelike, Direct control, Western"
98795,Dustwind,2021,,https://www.mobygames.com/game/98795/dustwind/,"Action, Strategy / tactics, Real-time, Role-playing (RPG), Post-apocalyptic, Diagonal-down"
143029,Dwarrows,2021,,https://www.mobygames.com/game/143029/dwarrows/,"Action, Puzzle elements, Fantasy, Behind view, City building / construction simulation, Direct control"
179131,Dying Light 2: Stay Human,2022,7.42,https://www.mobygames.com/game/179131/dying-light-2-stay-human/,"Action, 1st-person, Post-apocalyptic, Horror, Sandbox / open world, Direct control"
221257,Dying Light: Definitive Edition,2021,,https://www.mobygames.com/game/221257/dying-light-definitive-edition/,Compilation
102858,Dyna Bomb,2022,,https://www.mobygames.com/game/102858/dyna-bomb/,"Action, Side view, Platform, Anime / Manga, Fantasy, 2D scrolling"
190002,Dyna Bomb 2,2022,,https://www.mobygames.com/game/190002/dyna-bomb-2/,"Action, Side view, Platform, Anime / Manga, Fantasy, 2D scrolling, Direct control"
212768,Dynablaster,2023,,https://www.mobygames.com/game/212768/dynablaster/,"Action, Arcade, Top-down, Fantasy, Fixed / flip-screen, Direct control"
218929,Dynacat,2024,,https://www.mobygames.com/game/218929/dynacat/,"Action, Platform, Fantasy, Diagonal-down, 2D scrolling, Direct control"
152898,Dysmantle,2022,,https://www.mobygames.com/game/152898/dysmantle/,"Simulation, Role-playing (RPG), Post-apocalyptic, Diagonal-down, 2D scrolling, Sandbox / open world, Direct control"
208673,Dj Vu,2020,,https://www.mobygames.com/game/208673/deja-vu/,"Top-down, Puzzle"
167378,Eagle Island Twist,2021,,https://www.mobygames.com/game/167378/eagle-island-twist/,"Action, Side view, Platform, Metroidvania, Fantasy, 2D scrolling, Roguelike, Direct control"
168190,Earth Marines,2021,,https://www.mobygames.com/game/168190/earth-marines/,"Action, Sci-fi / futuristic, Shooter, Diagonal-down, Direct control"
154461,Eastern Exorcist,2023,,https://www.mobygames.com/game/154461/eastern-exorcist/,"Action, Side view, Hack and slash, Fantasy, 2D scrolling, Direct control, China (Ancient / Imperial)"
172326,Eastward,2022,,https://www.mobygames.com/game/172326/eastward/,"Action, Sci-fi / futuristic, Puzzle elements, Diagonal-down, 2D scrolling, RPG elements, Direct control"
211398,Ebenezer and the Invisible World,2023,,https://www.mobygames.com/game/211398/ebenezer-and-the-invisible-world/,"Action, Side view, Platform, Metroidvania, Fantasy, 2D scrolling, Direct control"
178236,Echo Generation,2021,7.14,https://www.mobygames.com/game/178236/echo-generation/,"Role-playing (RPG), Fantasy, Turn-based, 3rd-person (Other), 2D scrolling, Direct control"
195321,Edengate: The Edge of Life,2022,,https://www.mobygames.com/game/195321/edengate-the-edge-of-life/,"Adventure, Puzzle elements, Behind view, Direct control, Contemporary"
118456,Edge of Eternity,2022,,https://www.mobygames.com/game/118456/edge-of-eternity/,"Sci-fi / futuristic, Role-playing (RPG), Fantasy, Turn-based, Behind view, Japanese-style RPG (JRPG)"
128407,Effie,2021,,https://www.mobygames.com/game/128407/effie/,"Action, Platform, Fantasy, Behind view, Direct control"
172860,eFootball 2022,2021,,https://www.mobygames.com/game/172860/efootball-2022/,"Sports, Real-time, Managerial / business simulation, Football (European) / Soccer, Turn-based, Diagonal-down, 2D scrolling, Direct control, Menu structures"
201468,Egglien,2023,,https://www.mobygames.com/game/201468/egglien/,"Action, Sci-fi / futuristic, Side view, Platform, Fantasy, 2D scrolling, Direct control"
155796,Eight Dragons,2021,,https://www.mobygames.com/game/155796/eight-dragons/,"Action, Side view, Beat 'em up / brawler, 2D scrolling, Direct control"
222608,Eiyuden Chronicle: Hundred Heroes,2024,,https://www.mobygames.com/game/222608/eiyuden-chronicle-hundred-heroes/,"Role-playing (RPG), Anime / Manga, Fantasy, Turn-based, 3rd-person (Other), Japanese-style RPG (JRPG), Menu structures"
184060,Eiyuden Chronicle: Rising,2022,7.04,https://www.mobygames.com/game/184060/eiyuden-chronicle-rising/,"Side view, Puzzle elements, Role-playing (RPG), Fantasy, 2D scrolling, Action RPG, Direct control"
179608,El Gancho,2022,,https://www.mobygames.com/game/179608/el-gancho/,"Action, Side view, Platform, Puzzle elements, Fantasy, 2D scrolling, Roguelike, Direct control"
155060,El Hijo: A Wild West Tale,2021,,https://www.mobygames.com/game/155060/el-hijo-a-wild-west-tale/,"Strategy / tactics, Puzzle elements, Stealth, Diagonal-down, 2D scrolling, Western"
209406,"El Paso, Elsewhere",2023,7.26,https://www.mobygames.com/game/209406/el-paso-elsewhere/,"Action, Shooter, Behind view, Direct control, North America"
145992,Elasto Mania,2022,,https://www.mobygames.com/game/145992/elasto-mania/,"Action, Racing / Driving, Side view, Motorcycle, Platform, 2D scrolling, Direct control"
174989,Elden Ring,2022,8.94,https://www.mobygames.com/game/174989/elden-ring/,"Role-playing (RPG), Hack and slash, Fantasy, Behind view, Sandbox / open world, Action RPG, Direct control"
226510,Elden Ring: Shadow of the Erdtree,2024,,https://www.mobygames.com/game/226510/elden-ring-shadow-of-the-erdtree/,"Add-on, NPC / enemy, Item, Map / level, Story / mission"
225365,The Elder Scrolls Online: Gold Road,2024,,https://www.mobygames.com/game/225365/the-elder-scrolls-online-gold-road/,"Add-on, Item, Other, Story / mission"
196088,The Elder Scrolls Online: High Isle,2022,,https://www.mobygames.com/game/196088/the-elder-scrolls-online-high-isle/,"Add-on, Story / mission"
204066,The Elder Scrolls Online: Necrom,2023,,https://www.mobygames.com/game/204066/the-elder-scrolls-online-necrom/,"Add-on, Item, Other, Story / mission"
176458,The Elder Scrolls V: Skyrim - Anniversary Edition,2021,,https://www.mobygames.com/game/176458/the-elder-scrolls-v-skyrim-anniversary-edition/,Compilation
175245,The Elder Scrolls V: Skyrim - Anniversary Upgrade,2021,,https://www.mobygames.com/game/175245/the-elder-scrolls-v-skyrim-anniversary-upgrade/,"Add-on, NPC / enemy, Item, Other, Edition upgrade"
168294,Eldest Souls,2021,,https://www.mobygames.com/game/168294/eldest-souls/,"Role-playing (RPG), Hack and slash, Fantasy, Diagonal-down, Action RPG, Direct control"
210722,ElecHead,2023,,https://www.mobygames.com/game/210722/elechead/,"Action, Sci-fi / futuristic, Side view, Platform, Puzzle elements, Fixed / flip-screen, Direct control"
130291,Elemental War,2020,,https://www.mobygames.com/game/130291/elemental-war/,"Strategy / tactics, Real-time, Fantasy, 3rd-person (Other), Tower defense, Point and select"
184074,Elemental War II,2022,,https://www.mobygames.com/game/184074/elemental-war-ii/,"Strategy / tactics, Real-time, Fantasy, 3rd-person (Other), Tower defense, Point and select"
17195,Elevator Action II,2022,,https://www.mobygames.com/game/17195/elevator-action-ii/,"Action, Arcade, Side view, Platform, 2D scrolling"
180611,Elex II,2022,,https://www.mobygames.com/game/180611/elex-ii/,"Sci-fi / futuristic, Role-playing (RPG), Post-apocalyptic, Fantasy, Behind view, Action RPG, Direct control"
180800,Elex II (Collector's Edition),2022,,https://www.mobygames.com/game/180800/elex-ii-collectors-edition/,"Physical extras, Special edition"
155840,Elliot,2020,,https://www.mobygames.com/game/155840/elliot/,"Action, Arcade, Side view, Platform, 2D scrolling, Direct control"
172366,Elva the Eco Dragon,2021,,https://www.mobygames.com/game/172366/elva-the-eco-dragon/,"Adventure, Educational, Flight / aviation, Game show / trivia / quiz, Fantasy, Ecology / nature, 3rd-person (Other), RPG elements, Direct control"
153718,Embr,2021,,https://www.mobygames.com/game/153718/embr/,"Action, Simulation, 1st-person, Shooter, Fantasy, Comedy, RPG elements, Direct control"
214991,Emergency Call: The Attack Squad,2023,,https://www.mobygames.com/game/214991/emergency-call-the-attack-squad/,"Simulation, 1st-person, 3rd-person (Other), Direct control, Truck, Contemporary"
216295,Emoji Kart Racer,2023,,https://www.mobygames.com/game/216295/emoji-kart-racer/,"Action, Racing / Driving, Fantasy, Behind view, Direct control, Automobile, Track racing"
113774,Empire of Angels IV,2021,,https://www.mobygames.com/game/113774/empire-of-angels-iv/,"Strategy / tactics, Role-playing (RPG), Fantasy, Japanese-style RPG (JRPG)"
154060,Empire of Sin,2020,,https://www.mobygames.com/game/154060/empire-of-sin/,"Strategy / tactics, Managerial / business simulation, Turn-based, Crime, Diagonal-down, Free camera, RPG elements, Point and select, North America, Interwar, Turn-based strategy (TBS)"
161247,Empire of Sin: Deluxe Pack,2020,,https://www.mobygames.com/game/161247/empire-of-sin-deluxe-pack/,"Add-on, Item, Customization / outfit / skin, Player unit"
211749,Empire of Sin: Make It Count,2021,,https://www.mobygames.com/game/211749/empire-of-sin-make-it-count/,"Add-on, Item, Player unit, Story / mission"
211087,Enchanted Portals,2023,,https://www.mobygames.com/game/211087/enchanted-portals/,"Action, Side view, Platform, Shooter, Fantasy, 2D scrolling, Direct control"
159202,ENCODYA,2021,,https://www.mobygames.com/game/159202/encodya/,"Adventure, Puzzle elements, Cyberpunk / dark sci-fi, 3rd-person (Other), Graphic adventure, Point and select, Europe"
157880,Ender Lilies: Quietus of the Knights,2021,,https://www.mobygames.com/game/157880/ender-lilies-quietus-of-the-knights/,"Action, Side view, Metroidvania, Anime / Manga, Fantasy, 2D scrolling, Direct control"
210387,Endless Dungeon,2023,,https://www.mobygames.com/game/210387/endless-dungeon/,"Action, Strategy / tactics, Sci-fi / futuristic, Real-time, Shooter, Diagonal-down, 2D scrolling, Roguelike, Tower defense, Direct control"
135573,Endless Fables 4: Shadow Within (Collector's Edition),2021,,https://www.mobygames.com/game/135573/endless-fables-4-shadow-within-collectors-edition/,"Adventure, 1st-person, Puzzle elements, Fantasy, Hidden object, Point and select, Digital extras, Extra content / game, Special edition"
188241,Endling: Extinction Is Forever,2022,,https://www.mobygames.com/game/188241/endling-extinction-is-forever/,"Simulation, Post-apocalyptic, 2D scrolling, Survival, Direct control"
150523,Endurance,2021,,https://www.mobygames.com/game/150523/endurance/,"Action, Sci-fi / futuristic, Top-down, Role-playing (RPG), Fantasy, 2D scrolling, Action RPG, Direct control"
204155,Endzone: A World Apart - Survivor Edition,2022,,https://www.mobygames.com/game/204155/endzone-a-world-apart-survivor-edition/,"Simulation, Sci-fi / futuristic, Post-apocalyptic, Diagonal-down, Free camera, City building / construction simulation, Point and select"
90275,Energy Cycle,2021,,https://www.mobygames.com/game/90275/energy-cycle/,"Puzzle, Fixed / flip-screen, Point and select"
117394,Energy Cycle: Edge,2021,,https://www.mobygames.com/game/117394/energy-cycle-edge/,"Sci-fi / futuristic, Puzzle, Fixed / flip-screen, Point and select"
176891,The Enigma Machine,2022,,https://www.mobygames.com/game/176891/the-enigma-machine/,"Adventure, 1st-person, Puzzle elements, Cyberpunk / dark sci-fi, Horror, Graphic adventure, Direct control"
163022,Enlisted,2021,,https://www.mobygames.com/game/163022/enlisted/,"Action, 1st-person, Shooter, Tank, War, Direct control, World War II"
153415,Enlisted (USSR Founder's Bundle),2020,,https://www.mobygames.com/game/153415/enlisted-ussr-founders-bundle/,"Action, 1st-person, Shooter, Tank, Direct control, World War II"
177380,"Enlisted: ""Invasion of Normandy"" - Browning M1918 Squad",2021,,https://www.mobygames.com/game/177380/enlisted-invasion-of-normandy-browning-m1918-squad/,"Add-on, Player unit"
177386,Enlisted: 1000 Gold,2021,,https://www.mobygames.com/game/177386/enlisted-1000-gold/,"Add-on, Currency"
177389,Enlisted: 10000 Gold + 3500 Bonus,2021,,https://www.mobygames.com/game/177389/enlisted-10000-gold-3500-bonus/,"Add-on, Currency"
177387,Enlisted: 2500 Gold + 300 Bonus,2021,,https://www.mobygames.com/game/177387/enlisted-2500-gold-300-bonus/,"Add-on, Currency"
177385,Enlisted: 500 Gold,2021,,https://www.mobygames.com/game/177385/enlisted-500-gold/,"Add-on, Currency"
177388,Enlisted: 5000 Gold + 1250 Bonus,2021,,https://www.mobygames.com/game/177388/enlisted-5000-gold-1250-bonus/,"Add-on, Currency"
176456,Enlisted: Starter Bundle,2021,,https://www.mobygames.com/game/176456/enlisted-starter-bundle/,"Add-on, Currency, Item, Player unit, Upgrade (Skill / Boost)"
168822,Enter Digiton: Heart of Corruption,2021,,https://www.mobygames.com/game/168822/enter-digiton-heart-of-corruption/,"Action, Side view, Platform, Metroidvania, Puzzle elements, Fantasy, 2D scrolling, Sandbox / open world, Direct control"
194574,The Entropy Centre,2022,,https://www.mobygames.com/game/194574/the-entropy-centre/,"Action, 1st-person, Sci-fi / futuristic, Platform, Shooter, Puzzle, Direct control"
207784,Envasion,2023,,https://www.mobygames.com/game/207784/envasion/,"Action, Sci-fi / futuristic, Arcade, Side view, Shooter, Fantasy, Fixed / flip-screen, Direct control"
175256,Epic Chef,2021,,https://www.mobygames.com/game/175256/epic-chef/,"Simulation, 1st-person, Managerial / business simulation, Comedy, 3rd-person (Other), Diagonal-down, Direct control"
126228,Epitasis,2022,,https://www.mobygames.com/game/126228/epitasis/,"1st-person, Sci-fi / futuristic, Real-time, Puzzle, Direct control"
158053,Escape 2088,2023,,https://www.mobygames.com/game/158053/escape-2088/,"Adventure, 1st-person, Cyberpunk / dark sci-fi, Puzzle, Point and select"
188126,Escape Academy,2022,7.6,https://www.mobygames.com/game/188126/escape-academy/,"1st-person, Puzzle, Point and select"
108620,Escape F1rst,2022,,https://www.mobygames.com/game/108620/escape-f1rst/,"1st-person, Real-time, Puzzle, Direct control, Motion control"
128846,Escape F1rst 2,2022,,https://www.mobygames.com/game/128846/escape-f1rst-2/,"1st-person, Real-time, Puzzle, Direct control, Motion control"
146347,Escape F1rst 3,2022,,https://www.mobygames.com/game/146347/escape-f1rst-3/,"1st-person, Real-time, Puzzle, Direct control, Motion control"
161575,Escape from Life Inc,2021,,https://www.mobygames.com/game/161575/escape-from-life-inc/,"Adventure, Side view, Platform, Puzzle elements, Fantasy, Comedy, 2D scrolling, Direct control"
167170,Escape Sequence,2021,,https://www.mobygames.com/game/167170/escape-sequence/,"Puzzle, Diagonal-down, Fixed / flip-screen, Direct control"
194266,Escape String,2022,,https://www.mobygames.com/game/194266/escape-string/,"Action, Sci-fi / futuristic, Side view, Platform, Puzzle elements, Fantasy, 2D scrolling, Direct control"
152222,Esports Life Tycoon,2020,,https://www.mobygames.com/game/152222/esports-life-tycoon/,"Simulation, Isometric, Managerial / business simulation, Diagonal-down, Life / social simulation, Point and select, Direct control, Contemporary"
173069,The Eternal Cylinder,2021,,https://www.mobygames.com/game/173069/the-eternal-cylinder/,"Action, Sci-fi / futuristic, Behind view, Direct control"
154521,Eternal Hope,2022,,https://www.mobygames.com/game/154521/eternal-hope/,"Action, Side view, Platform, Puzzle elements, 2D scrolling, Direct control"
183929,Evasion from Hell,2022,,https://www.mobygames.com/game/183929/evasion-from-hell/,"Action, 1st-person, Platform, Puzzle elements, Direct control"
146148,Ever Forward,2021,,https://www.mobygames.com/game/146148/ever-forward/,"Adventure, Puzzle elements, Fantasy, 3rd-person (Other), Direct control"
149504,Evergate,2020,,https://www.mobygames.com/game/149504/evergate/,"Action, Side view, Platform, Puzzle elements, Fantasy, 2D scrolling, Direct control"
213437,Everhood: Eternity Edition,2023,7.93,https://www.mobygames.com/game/213437/everhood-eternity-edition/,"Adventure, Sci-fi / futuristic, Fantasy, Music / rhythm, 3rd-person (Other), 2D scrolling, RPG elements, Direct control"
157560,Everspace 2,2023,,https://www.mobygames.com/game/157560/everspace-2/,"Action, 1st-person, Sci-fi / futuristic, Shooter, Behind view, Space flight, Direct control"
174095,Evertried,2021,,https://www.mobygames.com/game/174095/evertried/,"Strategy / tactics, Isometric, Fantasy, Turn-based, Diagonal-down, Roguelike, RPG elements, Point and select, Direct control"
184222,Evil Dead: The Game,2022,7.29,https://www.mobygames.com/game/184222/evil-dead-the-game/,"Action, Fantasy, Licensed, Horror, Survival horror, Behind view, Direct control, Contemporary"
161492,Evil Genius 2: World Domination,2021,,https://www.mobygames.com/game/161492/evil-genius-2-world-domination/,"Strategy / tactics, Real-time, Managerial / business simulation, Spy / espionage, Comedy, Crime, Diagonal-down, Free camera, City building / construction simulation, Point and select, Real-time strategy (RTS)"
161227,Evil Inside,2021,,https://www.mobygames.com/game/161227/evil-inside/,"Adventure, 1st-person, Puzzle elements, Fantasy, Horror, Survival horror, Survival, Direct control"
194269,Evil Nun: The Broken Mask,2023,,https://www.mobygames.com/game/194269/evil-nun-the-broken-mask/,"Action, 1st-person, Puzzle elements, Horror, Stealth, Survival horror, Direct control"
195289,Evil West,2022,7.64,https://www.mobygames.com/game/195289/evil-west/,"Action, Shooter, Hack and slash, Fantasy, Behind view, Direct control, North America, Western"
197983,Evil West: Wild Wild East Skin Pack,2022,,https://www.mobygames.com/game/197983/evil-west-wild-wild-east-skin-pack/,"Add-on, Customization / outfit / skin"
205293,Evil Wizard,2023,,https://www.mobygames.com/game/205293/evil-wizard/,"Role-playing (RPG), Fantasy, Diagonal-down, 2D scrolling, Action RPG, Direct control"
193037,Eville,2022,,https://www.mobygames.com/game/193037/eville/,"Simulation, Fantasy, Behind view, Party game, Direct control"
199156,Eville: Eville Pass Season 2 - Journey to Frostpit,2023,,https://www.mobygames.com/game/199156/eville-eville-pass-season-2-journey-to-frostpit/,Compilation
199154,Eville: Frost Golem Pack,2022,,https://www.mobygames.com/game/199154/eville-frost-golem-pack/,"Add-on, Item, Other, Player unit"
199155,Eville: Frozen Tundra Pack,2023,,https://www.mobygames.com/game/199155/eville-frozen-tundra-pack/,Compilation
199151,Eville: Kaif Pack,2022,,https://www.mobygames.com/game/199151/eville-kaif-pack/,"Add-on, Item, Other"
