ID,Title,Release Year,Moby Score,URL,Genres
82432,LEGO Dimensions: The Simpsons Level Pack,2015,,https://www.mobygames.com/game/82432/lego-dimensions-the-simpsons-level-pack/,"Add-on, Licensed, Map / level, Story / mission"
73422,LEGO Jurassic World,2015,,https://www.mobygames.com/game/73422/lego-jurassic-world/,"Action, Puzzle elements, Licensed, 3rd-person (Other)"
78851,LEGO Marvel Avengers,2016,,https://www.mobygames.com/game/78851/lego-marvel-avengers/,"Action, Platform, Puzzle elements, Licensed, 3rd-person (Other), Sandbox / open world"
62416,LEGO Marvel Super Heroes,2013,7.75,https://www.mobygames.com/game/62416/lego-marvel-super-heroes/,"Action, Platform, Puzzle elements, Licensed, 3rd-person (Other)"
64588,The LEGO Movie Videogame,2014,7.07,https://www.mobygames.com/game/64588/the-lego-movie-videogame/,"Action, Platform, Licensed, 3rd-person (Other)"
82088,LEGO Star Wars: The Force Awakens,2016,7.14,https://www.mobygames.com/game/82088/lego-star-wars-the-force-awakens/,"Action, Sci-fi / futuristic, Platform, Licensed, 3rd-person (Other)"
65494,LEGO The Hobbit,2014,,https://www.mobygames.com/game/65494/lego-the-hobbit/,"Action, Platform, Puzzle elements, Fantasy, Licensed, 3rd-person (Other)"
85853,Letter Quest: Remastered,2016,,https://www.mobygames.com/game/85853/letter-quest-remastered/,"Side view, Role-playing (RPG), Fantasy, Turn-based, Puzzle, Word construction"
92256,The Letter,2014,,https://www.mobygames.com/game/92256/the-letter/,"Adventure, 1st-person, Horror"
86934,Level 22: Gary's Misadventure,2016,,https://www.mobygames.com/game/86934/level-22-garys-misadventure/,"Action, Stealth, Comedy, Diagonal-down, 2D scrolling, Contemporary"
7297,Life Force,2014,,https://www.mobygames.com/game/7297/life-force/,"Action, Sci-fi / futuristic, Arcade, Side view, Shooter, 2D scrolling"
90100,Life of Pixel,2015,,https://www.mobygames.com/game/90100/life-of-pixel/,"Action, Side view, Platform, 2D scrolling, Direct control"
58896,Little Inferno,2012,7.16,https://www.mobygames.com/game/58896/little-inferno/,"Simulation, 1st-person, Puzzle elements"
29615,Little Ninja Brothers,2015,,https://www.mobygames.com/game/29615/little-ninja-brothers/,"Action, Top-down, Side view, Martial arts, Fighting, Role-playing (RPG), Fantasy, 2D scrolling, Fixed / flip-screen"
9313,Live a Live,2015,,https://www.mobygames.com/game/9313/live-a-live/,"Sci-fi / futuristic, Top-down, Role-playing (RPG), Fantasy, Turn-based"
243,Lode Runner,2014,,https://www.mobygames.com/game/243/lode-runner/,"Action, Side view, Platform, Puzzle, Fixed / flip-screen, Direct control"
69001,Lone Survivor: The Director's Cut,2014,7.36,https://www.mobygames.com/game/69001/lone-survivor-the-directors-cut/,"Action, Adventure, Side view, Puzzle elements, Survival horror"
12627,Lords of Thunder,2015,,https://www.mobygames.com/game/12627/lords-of-thunder/,"Action, Side view, Shooter, Anime / Manga, Fantasy"
48791,Lost in Shadow,2016,,https://www.mobygames.com/game/48791/lost-in-shadow/,"Action, Side view, Platform, Puzzle elements, 2D scrolling"
87218,Lost Reavers,2015,,https://www.mobygames.com/game/87218/lost-reavers/,"1st-person, Role-playing (RPG), Fantasy, Action RPG"
72637,Lovely Planet,2016,,https://www.mobygames.com/game/72637/lovely-planet/,"Action, 1st-person, Platform, Shooter, Fantasy, Direct control"
83082,Lucadian Chronicles,2014,,https://www.mobygames.com/game/83082/lucadian-chronicles/,"Strategy / tactics, Role-playing (RPG), Fantasy, Turn-based, Trading / collectible card"
101105,Lucentek: Activate,2015,,https://www.mobygames.com/game/101105/lucentek-activate/,"Action, Racing / Driving, 1st-person, Sci-fi / futuristic, Shooter, Behind view"
101507,Lucentek: Beyond,2017,,https://www.mobygames.com/game/101507/lucentek-beyond/,"1st-person, Sci-fi / futuristic, Role-playing (RPG), Timed input"
17432,Lufia: The Ruins of Lore,2016,,https://www.mobygames.com/game/17432/lufia-the-ruins-of-lore/,"Top-down, Role-playing (RPG), Anime / Manga, Fantasy, Turn-based, Japanese-style RPG (JRPG)"
91715,Luv Me Buddies Wonderland,2014,,https://www.mobygames.com/game/91715/luv-me-buddies-wonderland/,"Action, Educational, Mini-games, Party game"
18651,Mach Rider,2014,,https://www.mobygames.com/game/18651/mach-rider/,"Action, Racing / Driving, Shooter, Post-apocalyptic, Cyberpunk / dark sci-fi, Behind view, Direct control"
19522,Magical Tree,2015,,https://www.mobygames.com/game/19522/magical-tree/,"Action, Arcade, Side view, Platform, Fixed / flip-screen"
74365,Magical Vacation,2015,,https://www.mobygames.com/game/74365/magical-vacation/,"Adventure, Isometric, Role-playing (RPG), Anime / Manga, 3rd-person (Other)"
15094,MagMax,2016,,https://www.mobygames.com/game/15094/magmax/,"Action, Sci-fi / futuristic, Side view, Shooter, Mecha / giant robot, Diagonal-down, 2D scrolling"
87301,Mahjong,2016,,https://www.mobygames.com/game/87301/mahjong/,"1st-person, Cards / tiles, Puzzle, Tile matching puzzle"
85473,Mahjong Deluxe 3,2017,,https://www.mobygames.com/game/85473/mahjong-deluxe-3/,"Top-down, Cards / tiles, Puzzle, 3rd-person (Other), Tile matching puzzle, Point and select"
11601,Majin Tensei,2015,,https://www.mobygames.com/game/11601/majin-tensei/,"Strategy / tactics, Sci-fi / futuristic, Top-down, Role-playing (RPG), Fantasy, Turn-based"
11602,Majin Tensei II: Spiral Nemesis,2016,,https://www.mobygames.com/game/11602/majin-tensei-ii-spiral-nemesis/,"Strategy / tactics, Sci-fi / futuristic, Isometric, Role-playing (RPG), Turn-based"
19631,Mappy,2013,,https://www.mobygames.com/game/19631/mappy/,"Action, Arcade, Side view, Platform, 2D scrolling"
33384,Mappy-Land,2015,,https://www.mobygames.com/game/33384/mappy-land/,"Action, Side view, Platform, 2D scrolling"
20537,Mario & Luigi: Partners in Time,2015,,https://www.mobygames.com/game/20537/mario-luigi-partners-in-time/,"Action, Isometric, Puzzle elements, Role-playing (RPG), Regional differences"
12026,Mario & Luigi: Superstar Saga,2014,,https://www.mobygames.com/game/12026/mario-luigi-superstar-saga/,"Action, Isometric, Puzzle elements, Role-playing (RPG), Turn-based, Japanese-style RPG (JRPG)"
62688,Mario & Sonic at the Olympic Winter Games: Sochi 2014,2013,5.87,https://www.mobygames.com/game/62688/mario-sonic-at-the-olympic-winter-games-sochi-2014/,"Sports, Hockey, Olympiad / mixed sports, Licensed, Snowboarding / skiing, 3rd-person (Other)"
80068,Mario & Sonic at the Rio 2016 Olympic Games,2016,6.64,https://www.mobygames.com/game/80068/mario-sonic-at-the-rio-2016-olympic-games/,"Sports, Boxing, Olympiad / mixed sports, Football (European) / Soccer, Rugby, Volleyball, Licensed, Horse / derby, 3rd-person (Other), Athletics, South America"
7301,Mario Bros.,2013,,https://www.mobygames.com/game/7301/mario-bros/,"Action, Arcade, Side view, Platform, Fixed / flip-screen"
3538,Mario Golf,2015,,https://www.mobygames.com/game/3538/mario-golf/,"Sports, Golf, Math / logic, Licensed, Behind view"
22074,Mario Golf: Advance Tour,2014,,https://www.mobygames.com/game/22074/mario-golf-advance-tour/,"Sports, Top-down, Golf, Behind view, RPG elements"
24103,Mario Hoops 3 on 3,2016,,https://www.mobygames.com/game/24103/mario-hoops-3-on-3/,"Sports, Basketball, 3rd-person (Other)"
3535,Mario Kart 64,2016,,https://www.mobygames.com/game/3535/mario-kart-64/,"Racing / Driving, Arcade, Fantasy, Behind view, Direct control, Automobile, Track racing"
65975,Mario Kart 8,2014,8.62,https://www.mobygames.com/game/65975/mario-kart-8/,"Racing / Driving, Arcade, Motorcycle, Fantasy, Behind view, Direct control, Motion control, Automobile, Track racing"
66430,Mario Kart 8 (Limited Edition),2014,,https://www.mobygames.com/game/66430/mario-kart-8-limited-edition/,"Physical extras, Special edition"
78426,Mario Kart 8: Animal Crossing × Mario Kart 8,2015,,https://www.mobygames.com/game/78426/mario-kart-8-animal-crossing-mario-kart-8/,"Add-on, Map / level, Customization / outfit / skin, Player unit"
78431,Mario Kart 8: Mercedes-Benz × Mario Kart 8,2014,,https://www.mobygames.com/game/78431/mario-kart-8-mercedes-benz-mario-kart-8/,"Add-on, Licensed, Player unit"
78424,Mario Kart 8: The Legend of Zelda × Mario Kart 8,2014,,https://www.mobygames.com/game/78424/mario-kart-8-the-legend-of-zelda-mario-kart-8/,"Add-on, Map / level, Customization / outfit / skin, Player unit"
20164,Mario Kart DS,2015,,https://www.mobygames.com/game/20164/mario-kart-ds/,"Racing / Driving, Arcade, Fantasy, Behind view, Direct control, Automobile, Track racing"
4941,Mario Kart: Super Circuit,2014,,https://www.mobygames.com/game/4941/mario-kart-super-circuit/,"Racing / Driving, Arcade, Fantasy, Behind view, Direct control, Automobile, Track racing"
74612,Mario Party 10,2015,6.72,https://www.mobygames.com/game/74612/mario-party-10/,"Action, Strategy / tactics, Board game, Fantasy, Turn-based, Behind view, Diagonal-down, Mini-games, Party game, Direct control"
83153,Mario Party 10 (Bowser Amiibo Bundle),2016,,https://www.mobygames.com/game/83153/mario-party-10-bowser-amiibo-bundle/,"Physical extras, Special edition"
75600,Mario Party 10 (Mario Amiibo Bundle),2015,,https://www.mobygames.com/game/75600/mario-party-10-mario-amiibo-bundle/,"Physical extras, Special edition"
83154,Mario Party 10 (Peach Amiibo Bundle),2016,,https://www.mobygames.com/game/83154/mario-party-10-peach-amiibo-bundle/,"Physical extras, Special edition"
6521,Mario Party 2,2016,,https://www.mobygames.com/game/6521/mario-party-2/,"Action, Strategy / tactics, Top-down, Board game, Fantasy, Turn-based, Diagonal-down, 2D scrolling, Mini-games, Party game, Direct control"
23278,Mario Party Advance,2014,,https://www.mobygames.com/game/23278/mario-party-advance/,"Action, Strategy / tactics, Top-down, Side view, Isometric, Board game, Fantasy, 2D scrolling, Mini-games, Party game, Direct control"
33929,Mario Party DS,2016,,https://www.mobygames.com/game/33929/mario-party-ds/,"Action, Strategy / tactics, 1st-person, Platform, Board game, Fantasy, Turn-based, Diagonal-down, Mini-games, Party game, Direct control"
15298,Mario Pinball Land,2014,,https://www.mobygames.com/game/15298/mario-pinball-land/,"Action, Simulation, Pinball, Licensed, Diagonal-down"
52416,Mario Sports Mix,2015,,https://www.mobygames.com/game/52416/mario-sports-mix/,"Action, Sports, Board game, Basketball, Hockey, Volleyball, Dodgeball"
29116,Mario Strikers Charged,2016,,https://www.mobygames.com/game/29116/mario-strikers-charged/,"Action, Sports, Football (European) / Soccer, Diagonal-down"
36180,Mario Super Sluggers,2016,,https://www.mobygames.com/game/36180/mario-super-sluggers/,"Action, Sports, Arcade, Baseball, Behind view, Diagonal-down"
3548,Mario Tennis,2015,,https://www.mobygames.com/game/3548/mario-tennis/,"Sports, Tennis, Diagonal-down, 2D scrolling, Direct control"
21283,Mario Tennis: Power Tour,2014,,https://www.mobygames.com/game/21283/mario-tennis-power-tour/,"Sports, Tennis, Diagonal-down, 2D scrolling, RPG elements, Direct control"
75746,Mario Tennis: Ultra Smash,2015,5.9,https://www.mobygames.com/game/75746/mario-tennis-ultra-smash/,"Sports, Tennis, Diagonal-down, 2D scrolling, Direct control"
13829,Mario vs. Donkey Kong,2014,,https://www.mobygames.com/game/13829/mario-vs-donkey-kong/,"Action, Arcade, Side view, Platform, Puzzle elements, Fixed / flip-screen"
23822,Mario vs. Donkey Kong 2: March of the Minis,2015,,https://www.mobygames.com/game/23822/mario-vs-donkey-kong-2-march-of-the-minis/,"Action, Side view, Platform, Fantasy, Puzzle, 2D scrolling, Point and select"
74522,Mario vs. Donkey Kong: Tipping Stars,2015,7.11,https://www.mobygames.com/game/74522/mario-vs-donkey-kong-tipping-stars/,"Action, Side view, Platform, Puzzle, Fixed / flip-screen, Point and select"
23723,Mario's Super Picross,2013,,https://www.mobygames.com/game/23723/marios-super-picross/,"Top-down, Puzzle, Fixed / flip-screen, Point and select"
69869,Marvel Pinball: Vengeance and Virtue,2013,,https://www.mobygames.com/game/69869/marvel-pinball-vengeance-and-virtue/,"Pinball, Add-on, Licensed, Map / level"
69613,Marvelous: Mōhitotsu no Takarajima,2014,,https://www.mobygames.com/game/69613/marvelous-mohitotsu-no-takarajima/,"Adventure, Top-down, Anime / Manga, 2D scrolling, Action RPG"
109084,Masked Forces,2018,,https://www.mobygames.com/game/109084/masked-forces/,"Action, 1st-person, Shooter, 2D scrolling"
59086,Mass Effect 3: Special Edition,2012,8.1,https://www.mobygames.com/game/59086/mass-effect-3-special-edition/,"Action, Sci-fi / futuristic, Shooter, Role-playing (RPG), Behind view"
73624,Master Reboot,2014,,https://www.mobygames.com/game/73624/master-reboot/,"Action, Adventure, 1st-person, Sci-fi / futuristic, Puzzle elements, Horror"
92260,Maze,2015,,https://www.mobygames.com/game/92260/maze/,"Action, 1st-person, Puzzle"
85015,Maze Break,2017,,https://www.mobygames.com/game/85015/maze-break/,"Top-down, Puzzle"
61882,Medabots AX: Metabee Ver.,2015,,https://www.mobygames.com/game/61882/medabots-ax-metabee-ver/,"Action, Platform, Fighting, Anime / Manga"
61881,Medabots AX: Rokusho Ver.,2015,,https://www.mobygames.com/game/61881/medabots-ax-rokusho-ver/,"Action, Platform, Fighting, Anime / Manga"
13027,MedaBots: Metabee,2015,,https://www.mobygames.com/game/13027/medabots-metabee/,"Action, Strategy / tactics, Sci-fi / futuristic, Top-down, Side view, Role-playing (RPG), Anime / Manga, Mecha / giant robot, Turn-based, Fixed / flip-screen, Tactical RPG, Menu structures"
75151,Medabots: Rokusho,2015,,https://www.mobygames.com/game/75151/medabots-rokusho/,"Action, Strategy / tactics, Top-down, Side view, Fighting, Role-playing (RPG), Anime / Manga, Mecha / giant robot"
80279,Medarot Navi: Kabuto,2016,,https://www.mobygames.com/game/80279/medarot-navi-kabuto/,"Sci-fi / futuristic, Role-playing (RPG), Anime / Manga, Turn-based, 3rd-person (Other)"
80280,Medarot Navi: Kuwagata,2016,,https://www.mobygames.com/game/80280/medarot-navi-kuwagata/,"Sci-fi / futuristic, Role-playing (RPG), Anime / Manga, Turn-based, 3rd-person (Other)"
9828,Mega Bomberman,2014,,https://www.mobygames.com/game/9828/mega-bomberman/,"Action, Sci-fi / futuristic, Arcade, Top-down, Fixed / flip-screen, Direct control"
12768,Mega Man,2013,,https://www.mobygames.com/game/12768/mega-man/,"Action, Sci-fi / futuristic, Arcade, Side view, Platform, Anime / Manga, 2D scrolling"
6604,Mega Man & Bass,2015,,https://www.mobygames.com/game/6604/mega-man-bass/,"Action, Sci-fi / futuristic, Side view, Platform, Shooter, Anime / Manga, 2D scrolling"
5084,Mega Man 2,2013,,https://www.mobygames.com/game/5084/mega-man-2/,"Action, Sci-fi / futuristic, Side view, Platform, Shooter, Anime / Manga, 2D scrolling"
1558,Mega Man 3,2013,,https://www.mobygames.com/game/1558/mega-man-3/,"Action, Sci-fi / futuristic, Side view, Platform, Shooter, Anime / Manga, 2D scrolling"
5091,Mega Man 4,2013,,https://www.mobygames.com/game/5091/mega-man-4/,"Action, Sci-fi / futuristic, Side view, Platform, Shooter, Anime / Manga, 2D scrolling"
5108,Mega Man 5,2014,,https://www.mobygames.com/game/5108/mega-man-5/,"Action, Sci-fi / futuristic, Side view, Platform, Shooter, Anime / Manga, 2D scrolling"
5201,Mega Man 6,2014,,https://www.mobygames.com/game/5201/mega-man-6/,"Action, Sci-fi / futuristic, Side view, Platform, Shooter, Anime / Manga, 2D scrolling"
6586,Mega Man 7,2014,,https://www.mobygames.com/game/6586/mega-man-7/,"Action, Sci-fi / futuristic, Side view, Platform, Shooter, Anime / Manga, 2D scrolling"
5308,Mega Man Battle Network,2014,,https://www.mobygames.com/game/5308/mega-man-battle-network/,"Sci-fi / futuristic, Real-time, Isometric, Role-playing (RPG), Anime / Manga, Diagonal-down, Direct control"
7104,Mega Man Battle Network 2,2014,,https://www.mobygames.com/game/7104/mega-man-battle-network-2/,"Sci-fi / futuristic, Real-time, Isometric, Role-playing (RPG), Anime / Manga, Diagonal-down, Direct control"
9608,Mega Man Battle Network 3: Blue Version,2014,,https://www.mobygames.com/game/9608/mega-man-battle-network-3-blue-version/,"Sci-fi / futuristic, Real-time, Isometric, Role-playing (RPG), Anime / Manga, Diagonal-down, Direct control"
9609,Mega Man Battle Network 3: White Version,2014,,https://www.mobygames.com/game/9609/mega-man-battle-network-3-white-version/,"Sci-fi / futuristic, Real-time, Isometric, Role-playing (RPG), Anime / Manga, Diagonal-down, Direct control"
23461,Mega Man Battle Network 4: Blue Moon,2015,,https://www.mobygames.com/game/23461/mega-man-battle-network-4-blue-moon/,"Sci-fi / futuristic, Real-time, Isometric, Role-playing (RPG), Anime / Manga, Diagonal-down, Direct control"
23459,Mega Man Battle Network 4: Red Sun,2015,,https://www.mobygames.com/game/23459/mega-man-battle-network-4-red-sun/,"Sci-fi / futuristic, Real-time, Isometric, Role-playing (RPG), Anime / Manga, Diagonal-down, Direct control"
23347,Mega Man Battle Network 5: Team Colonel,2015,,https://www.mobygames.com/game/23347/mega-man-battle-network-5-team-colonel/,"Sci-fi / futuristic, Real-time, Isometric, Role-playing (RPG), Anime / Manga, Diagonal-down, Direct control"
20868,Mega Man Battle Network 5: Team Protoman,2015,,https://www.mobygames.com/game/20868/mega-man-battle-network-5-team-protoman/,"Sci-fi / futuristic, Real-time, Isometric, Role-playing (RPG), Anime / Manga, Diagonal-down, Direct control"
23374,Mega Man Battle Network 6: Cybeast Falzar,2015,,https://www.mobygames.com/game/23374/mega-man-battle-network-6-cybeast-falzar/,"Sci-fi / futuristic, Real-time, Isometric, Role-playing (RPG), Anime / Manga, Diagonal-down, Direct control"
23373,Mega Man Battle Network 6: Cybeast Gregar,2015,,https://www.mobygames.com/game/23373/mega-man-battle-network-6-cybeast-gregar/,"Sci-fi / futuristic, Real-time, Isometric, Role-playing (RPG), Anime / Manga, Diagonal-down, Direct control"
1334,Mega Man X,2013,,https://www.mobygames.com/game/1334/mega-man-x/,"Action, Sci-fi / futuristic, Arcade, Side view, Platform, Shooter, Anime / Manga, 2D scrolling"
6580,Mega Man X2,2014,,https://www.mobygames.com/game/6580/mega-man-x2/,"Action, Sci-fi / futuristic, Side view, Platform, Shooter, Anime / Manga, 2D scrolling"
3368,Mega Man X3,2014,,https://www.mobygames.com/game/3368/mega-man-x3/,"Action, Sci-fi / futuristic, Side view, Platform, Shooter, Anime / Manga"
6427,Mega Man Zero,2014,,https://www.mobygames.com/game/6427/mega-man-zero/,"Action, Sci-fi / futuristic, Side view, Platform, Shooter, Metroidvania, Anime / Manga, 2D scrolling"
10659,Mega Man Zero 2,2015,,https://www.mobygames.com/game/10659/mega-man-zero-2/,"Action, Sci-fi / futuristic, Side view, Metroidvania, Anime / Manga, 2D scrolling"
15040,Mega Man Zero 3,2015,,https://www.mobygames.com/game/15040/mega-man-zero-3/,"Action, Sci-fi / futuristic, Side view, Anime / Manga, 2D scrolling"
20190,Mega Man Zero 4,2015,,https://www.mobygames.com/game/20190/mega-man-zero-4/,"Action, Sci-fi / futuristic, Side view, Platform, Anime / Manga, 2D scrolling"
23348,Mega Man: Battle Chip Challenge,2014,,https://www.mobygames.com/game/23348/mega-man-battle-chip-challenge/,"Strategy / tactics, Sci-fi / futuristic, Isometric, Cards / tiles, Diagonal-down"
87643,Mega Maze,2017,,https://www.mobygames.com/game/87643/mega-maze/,"1st-person, Puzzle, Direct control"
11322,Megami Tensei Gaiden: Last Bible III,2015,,https://www.mobygames.com/game/11322/megami-tensei-gaiden-last-bible-iii/,"1st-person, Top-down, Role-playing (RPG), Fantasy, Turn-based"
73386,Meme Run,2014,,https://www.mobygames.com/game/73386/meme-run/,"Action, Side view, Platform, Comedy, 2D scrolling, Direct control"
19839,Mendel Palace,2014,,https://www.mobygames.com/game/19839/mendel-palace/,"Action, Strategy / tactics, Top-down"
4620,Metal Marines,2015,,https://www.mobygames.com/game/4620/metal-marines/,"Strategy / tactics, Sci-fi / futuristic, Isometric, Managerial / business simulation, Post-apocalyptic, Mecha / giant robot"
65314,Metal Slader Glory,2015,,https://www.mobygames.com/game/65314/metal-slader-glory/,"Adventure, Visual novel, Japanese-style adventure"
75963,Metal Slader Glory: Director's Cut,2015,,https://www.mobygames.com/game/75963/metal-slader-glory-directors-cut/,"Adventure, Real-time, Anime / Manga, Visual novel, Fixed / flip-screen, Japanese-style adventure, Menu structures"
9042,Metro Cross,2015,,https://www.mobygames.com/game/9042/metro-cross/,"Action, Sports, Side view, Skateboarding"
7303,Metroid,2013,,https://www.mobygames.com/game/7303/metroid/,"Action, Sci-fi / futuristic, Side view, Platform, Shooter, Metroidvania, 2D scrolling"
7812,Metroid Fusion,2014,,https://www.mobygames.com/game/7812/metroid-fusion/,"Action, Sci-fi / futuristic, Side view, Platform, Metroidvania, 2D scrolling"
42180,Metroid Prime Trilogy,2015,,https://www.mobygames.com/game/42180/metroid-prime-trilogy/,"Action, 1st-person, Sci-fi / futuristic, Shooter, Compilation, Direct control, Motion control"
21787,Metroid Prime: Hunters,2015,,https://www.mobygames.com/game/21787/metroid-prime-hunters/,"Action, 1st-person, Sci-fi / futuristic, Shooter, Puzzle elements"
48102,Metroid: Other M,2016,,https://www.mobygames.com/game/48102/metroid-other-m/,"Action, 1st-person, Sci-fi / futuristic, Side view, Shooter, Metroidvania, 2D scrolling"
12061,Metroid: Zero Mission,2014,,https://www.mobygames.com/game/12061/metroid-zero-mission/,"Action, Sci-fi / futuristic, Side view, Platform, Metroidvania, 2D scrolling"
100978,Midnight,2015,,https://www.mobygames.com/game/100978/midnight/,"Action, Sports, 1st-person, Side view, Golf"
100981,Midnight 2,2016,,https://www.mobygames.com/game/100981/midnight-2/,"Action, Sports, 1st-person, Side view, Golf"
99530,Midtown Crazy Race,2014,,https://www.mobygames.com/game/99530/midtown-crazy-race/,"Racing / Driving, Behind view, Automobile, Street racing"
13061,Mighty Bombjack,2014,,https://www.mobygames.com/game/13061/mighty-bombjack/,"Action, Arcade, Side view, Platform, Anime / Manga, 2D scrolling"
11085,Mighty Final Fight,2014,,https://www.mobygames.com/game/11085/mighty-final-fight/,"Action, Side view, Anime / Manga, Beat 'em up / brawler, 2D scrolling"
79484,Mighty No. 9,2016,,https://www.mobygames.com/game/79484/mighty-no-9/,Compilation
79460,Mighty No. 9,2016,5.64,https://www.mobygames.com/game/79460/mighty-no-9/,"Action, Sci-fi / futuristic, Side view, Platform, Shooter, 2D scrolling"
70274,Mighty Switch Force! 2,2013,,https://www.mobygames.com/game/70274/mighty-switch-force-2/,"Action, Sci-fi / futuristic, Side view, Platform, Shooter, Puzzle"
59513,Mighty Switch Force! Hyper Drive Edition,2012,7.9,https://www.mobygames.com/game/59513/mighty-switch-force-hyper-drive-edition/,"Action, Sci-fi / futuristic, Side view, Platform, Shooter, Puzzle elements"
10305,Mike Tyson's Punch-Out!!,2013,,https://www.mobygames.com/game/10305/mike-tysons-punch-out/,"Sports, Boxing, Licensed, Diagonal-down, Fixed / flip-screen, Direct control"
86206,Miko Mole,2017,,https://www.mobygames.com/game/86206/miko-mole/,"Action, Side view, Platform, 2D scrolling"
101491,MikroGame: Rotator,2016,,https://www.mobygames.com/game/101491/mikrogame-rotator/,"Action, Arcade, Behind view"
75295,Minecraft: Story Mode - Episode 1: The Order of the Stone,2016,,https://www.mobygames.com/game/75295/minecraft-story-mode-episode-1-the-order-of-the-stone/,"Adventure, Puzzle elements, Licensed, 3rd-person (Other), Graphic adventure, Quick Time Events (QTEs)"
94961,Minecraft: Story Mode - The Complete Adventure,2016,,https://www.mobygames.com/game/94961/minecraft-story-mode-the-complete-adventure/,"Adventure, Puzzle elements, Compilation, Licensed, 3rd-person (Other), Graphic adventure"
84852,Minecraft: Wii U Edition,2015,7.3,https://www.mobygames.com/game/84852/minecraft-wii-u-edition/,"Action, 1st-person, Fantasy, 3rd-person (Other), Sandbox / open world"
100492,Mini Mario & Friends: amiibo Challenge,2016,6.98,https://www.mobygames.com/game/100492/mini-mario-friends-amiibo-challenge/,"Action, Side view, Platform, Fantasy, Puzzle, Point and select"
101255,MM #1,2016,,https://www.mobygames.com/game/101255/mm-1/,"Action, Simulation, 1st-person, Arcade, Side view, Platform, Managerial / business simulation, Mini-games"
91258,Molly Maggot,2015,,https://www.mobygames.com/game/91258/molly-maggot/,"Action, Platform, 2D scrolling"
82547,Momonga Pinball Adventures,2015,,https://www.mobygames.com/game/82547/momonga-pinball-adventures/,"Action, Pinball, Diagonal-down, 2D scrolling"
99362,Mon Premier Karaoké,2015,,https://www.mobygames.com/game/99362/mon-premier-karaoke/,"Simulation, Educational, Music, Music / rhythm"
99204,Monkey Pirates,2014,,https://www.mobygames.com/game/99204/monkey-pirates/,"Action, Naval / watercraft, Diagonal-down, Party game"
100931,Monster High: 13 Wishes,2013,,https://www.mobygames.com/game/100931/monster-high-13-wishes/,"Action, Platform, Fantasy, Licensed, Behind view"
84664,Monster High: New Ghoul in School,2015,,https://www.mobygames.com/game/84664/monster-high-new-ghoul-in-school/,"Adventure, Fantasy, Licensed, 3rd-person (Other), Life / social simulation"
60776,Monster Hunter 3: Ultimate,2013,7.97,https://www.mobygames.com/game/60776/monster-hunter-3-ultimate/,"Role-playing (RPG), Fantasy, Behind view, Action RPG, Direct control"
86933,MOP: Operation Cleanup,2017,,https://www.mobygames.com/game/86933/mop-operation-cleanup/,"Action, Side view, Platform, 2D scrolling"
101051,Mortar Melon,2015,,https://www.mobygames.com/game/101051/mortar-melon/,"Action, 1st-person, Arcade, Fixed / flip-screen, Direct control"
29870,Mother 3,2015,,https://www.mobygames.com/game/29870/mother-3/,"Sci-fi / futuristic, Role-playing (RPG), Turn-based, Diagonal-down, 2D scrolling, Japanese-style RPG (JRPG)"
17783,Moto Roader,2014,,https://www.mobygames.com/game/17783/moto-roader/,"Action, Racing / Driving, Top-down, Shooter"
54462,Moto Roader II,2017,,https://www.mobygames.com/game/54462/moto-roader-ii/,"Racing / Driving, Sci-fi / futuristic, Arcade, Top-down, Motorcycle, 2D scrolling, Track racing"
55260,Motoroader MC,2017,,https://www.mobygames.com/game/55260/motoroader-mc/,"Action, Racing / Driving, Top-down"
