ID,Title,Release Year,Moby Score,URL,Genres
61028,Dragon Quest X: Mezameshi Itsutsu no Shuzoku Online,2013,,https://www.mobygames.com/game/61028/dragon-quest-x-mezameshi-itsutsu-no-shuzoku-online/,"Role-playing (RPG), Anime / Manga, Fantasy, Persistent, Behind view, Massively Multiplayer"
101442,Dragon Skills,2016,,https://www.mobygames.com/game/101442/dragon-skills/,"Action, Arcade, Top-down, Paddle / Pong, Fantasy, Fixed / flip-screen"
101313,Draw 2 Survive,2016,,https://www.mobygames.com/game/101313/draw-2-survive/,"Action, 1st-person, 2D scrolling, Direct control"
98806,Draw a Stickman: Epic 2,2017,,https://www.mobygames.com/game/98806/draw-a-stickman-epic-2/,"Action, 3rd-person (Other), 2D scrolling, Graphic adventure"
86894,Dreamals,2016,,https://www.mobygames.com/game/86894/dreamals/,"Action, Side view, Platform, Fantasy, Puzzle, Fixed / flip-screen"
87052,Dreamals: Dream Quest,2016,,https://www.mobygames.com/game/87052/dreamals-dream-quest/,"Action, Side view, Platform, Fantasy, Puzzle, Fixed / flip-screen"
175533,DreamWorks Penguins of Madagascar,2014,,https://www.mobygames.com/game/175533/dreamworks-penguins-of-madagascar/,"Action, Platform, Fantasy, Licensed, Stealth, Puzzle, 3rd-person (Other), Direct control"
85076,DreamWorks Rise of the Guardians,2012,,https://www.mobygames.com/game/85076/dreamworks-rise-of-the-guardians/,"Action, Fantasy, Licensed, Diagonal-down, 2D scrolling"
21288,Drill Dozer,2015,,https://www.mobygames.com/game/21288/drill-dozer/,"Action, Side view, Platform"
138047,Drop It: Block Paradise,2017,,https://www.mobygames.com/game/138047/drop-it-block-paradise/,"Arcade, Side view, Puzzle, Fixed / flip-screen, Point and select"
203853,Dual Core,2016,,https://www.mobygames.com/game/203853/dual-core/,"Action, Sci-fi / futuristic, Shooter, Diagonal-down, 2D scrolling, RPG elements, Direct control"
32588,Dungeon Explorer,2017,,https://www.mobygames.com/game/32588/dungeon-explorer/,"Action, Top-down, Role-playing (RPG), Fantasy"
37753,Dungeon Explorer II,2015,,https://www.mobygames.com/game/37753/dungeon-explorer-ii/,"Action, Top-down, Role-playing (RPG), Anime / Manga, Fantasy"
101498,Dungeon Hearts DX,2016,,https://www.mobygames.com/game/101498/dungeon-hearts-dx/,"Strategy / tactics, Real-time, Fantasy, Puzzle, Fixed / flip-screen"
63714,Dungeons & Dragons: Chronicles of Mystara,2013,7.22,https://www.mobygames.com/game/63714/dungeons-dragons-chronicles-of-mystara/,"Action, Side view, Fantasy, Licensed, Beat 'em up / brawler, 2D scrolling, Direct control"
145555,Dying is Dangerous!,2020,,https://www.mobygames.com/game/145555/dying-is-dangerous/,"1st-person, Side view, Horror, Mental training, Puzzle, 2D scrolling, Fixed / flip-screen, Point and select"
21623,Earth Defense Force,2015,,https://www.mobygames.com/game/21623/earth-defense-force/,"Action, Sci-fi / futuristic, Arcade, Side view, Shooter, 2D scrolling"
6676,EarthBound,2013,8.29,https://www.mobygames.com/game/6676/earthbound/,"Sci-fi / futuristic, Isometric, Role-playing (RPG), Anime / Manga, Fantasy, Turn-based, Comedy, Diagonal-down, 2D scrolling, Japanese-style RPG (JRPG), Regional differences"
13529,EarthBound Beginnings,2015,6.7,https://www.mobygames.com/game/13529/earthbound-beginnings/,"Role-playing (RPG), Turn-based, Diagonal-down, 2D scrolling, Japanese-style RPG (JRPG), Regional differences"
83036,Earthlock: Festival of Magic,2017,,https://www.mobygames.com/game/83036/earthlock-festival-of-magic/,"Adventure, Role-playing (RPG), Anime / Manga, Fantasy, Turn-based, 3rd-person (Other), Direct control"
93015,Eba & Egg: A Hatch Trip,2017,,https://www.mobygames.com/game/93015/eba-egg-a-hatch-trip/,"Action, Platform, Fantasy, 2D scrolling"
91239,Ectoplaza,2016,,https://www.mobygames.com/game/91239/ectoplaza/,"Action, Platform, 2D scrolling"
41029,Edge,2013,,https://www.mobygames.com/game/41029/edge/,"Action, Platform, Puzzle, Diagonal-down, Direct control"
101308,Educational Pack of Kids Games,2016,,https://www.mobygames.com/game/101308/educational-pack-of-kids-games/,"Action, 1st-person, Educational, Side view, Math / logic, Reading / writing, Music, Mini-games"
148576,El Silla: Arcade Edition,2019,,https://www.mobygames.com/game/148576/el-silla-arcade-edition/,"Action, Arcade, Side view, Anime / Manga, Comedy, Mini-games, Direct control"
79913,Electronic Super Joy,2015,,https://www.mobygames.com/game/79913/electronic-super-joy/,Compilation
95872,Electronic Super Joy: Groove City,2015,,https://www.mobygames.com/game/95872/electronic-super-joy-groove-city/,"Action, Arcade, Side view, Platform, Fantasy, 2D scrolling"
10914,Elevator Action,2014,,https://www.mobygames.com/game/10914/elevator-action/,"Action, Side view, Platform, Shooter, Spy / espionage, Stealth, 2D scrolling, Direct control"
88302,Elliot Quest,2015,,https://www.mobygames.com/game/88302/elliot-quest/,"Action, Side view, Platform, Metroidvania, Fantasy, Diagonal-down, 2D scrolling, RPG elements"
101309,Emojikara: A Clever Emoji Match Game,2016,,https://www.mobygames.com/game/101309/emojikara-a-clever-emoji-match-game/,"1st-person, Puzzle, Fixed / flip-screen, Word construction"
101052,Endless Golf,2015,,https://www.mobygames.com/game/101052/endless-golf/,"Sports, 1st-person, Side view, Golf"
88022,Epic Dumpster Bear,2016,6.82,https://www.mobygames.com/game/88022/epic-dumpster-bear/,"Action, Side view, Platform, 2D scrolling"
101366,Escape From Flare Industries,2016,,https://www.mobygames.com/game/101366/escape-from-flare-industries/,"Action, Arcade, Side view, Platform, Puzzle elements, Fixed / flip-screen"
54668,Esper Dream,2015,,https://www.mobygames.com/game/54668/esper-dream/,"Role-playing (RPG), Fantasy, Diagonal-down, 2D scrolling, Action RPG"
96185,ESPN Sports Connection,2012,4.31,https://www.mobygames.com/game/96185/espn-sports-connection/,"Action, Sports, Racing / Driving, Football (American), Baseball, Golf, Tennis, Football (European) / Soccer, Licensed, 3rd-person (Other), Behind view, Mini-games, Automobile, Track racing"
97691,Evofish,2014,,https://www.mobygames.com/game/97691/evofish/,"Action, Top-down, Party game"
7469,Excitebike,2013,,https://www.mobygames.com/game/7469/excitebike/,"Sports, Racing / Driving, Side view, Motorcycle, Tricks / stunts, 2D scrolling"
6213,Excitebike 64,2016,,https://www.mobygames.com/game/6213/excitebike-64/,"Racing / Driving, Motorcycle, Off-roading, 3rd-person (Other), Behind view, Vehicle simulator, Track racing"
51185,ExciteBots: Trick Racing,2016,,https://www.mobygames.com/game/51185/excitebots-trick-racing/,"Racing / Driving, Arcade, Off-roading, Tricks / stunts, Behind view, Vehicle simulator, Automobile, Track racing"
19664,Exerion,2015,,https://www.mobygames.com/game/19664/exerion/,"Action, Sci-fi / futuristic, Arcade, Shooter, Behind view, Space flight, Direct control"
87334,Exile's End,2016,,https://www.mobygames.com/game/87334/exiles-end/,"Action, Sci-fi / futuristic, Side view, Platform, Puzzle elements, 2D scrolling, Direct control"
101088,Explody Bomb,2015,,https://www.mobygames.com/game/101088/explody-bomb/,"Action, Arcade, Side view, Shooter, Fantasy, 2D scrolling, Direct control"
86882,Extreme Exorcism,2015,,https://www.mobygames.com/game/86882/extreme-exorcism/,"Action, Arcade, Side view, Platform, Shooter, Horror, Fixed / flip-screen, Direct control"
6630,F-Zero,2013,,https://www.mobygames.com/game/6630/f-zero/,"Racing / Driving, Sci-fi / futuristic, Behind view, Hovercraft, Track racing"
4047,F-Zero X,2016,,https://www.mobygames.com/game/4047/f-zero-x/,"Racing / Driving, Sci-fi / futuristic, Anime / Manga, Behind view, Hovercraft, Track racing"
76058,F-Zero: Climax,2015,,https://www.mobygames.com/game/76058/f-zero-climax/,"Racing / Driving, Sci-fi / futuristic, Anime / Manga, Behind view, Hovercraft, Track racing"
15753,F-Zero: GP Legend,2014,,https://www.mobygames.com/game/15753/f-zero-gp-legend/,"Racing / Driving, Sci-fi / futuristic, Anime / Manga, Behind view, Hovercraft, Track racing"
4533,F-Zero: Maximum Velocity,2014,,https://www.mobygames.com/game/4533/f-zero-maximum-velocity/,"Racing / Driving, Sci-fi / futuristic, Behind view, Hovercraft, Track racing"
92600,F1 Race Stars: Powered Up Edition,2014,,https://www.mobygames.com/game/92600/f1-race-stars-powered-up-edition/,"Racing / Driving, Arcade, Licensed, Behind view, Vehicle simulator, Automobile, Track racing"
88454,Factotum,2015,,https://www.mobygames.com/game/88454/factotum/,"Sci-fi / futuristic, Puzzle, 3rd-person (Other)"
77523,The Fall,2014,,https://www.mobygames.com/game/77523/the-fall/,"Action, Adventure, Sci-fi / futuristic, Side view, Shooter, Puzzle elements, Stealth, 2D scrolling"
85142,Falling Skies: The Game,2014,,https://www.mobygames.com/game/85142/falling-skies-the-game/,"Strategy / tactics, Sci-fi / futuristic, Licensed, Turn-based, 3rd-person (Other)"
65961,Famicom Bunko: Hajimari no Mori,2013,,https://www.mobygames.com/game/65961/famicom-bunko-hajimari-no-mori/,"Adventure, Anime / Manga"
64981,Famicom Mukashibanashi: Shin Onigashima,2013,,https://www.mobygames.com/game/64981/famicom-mukashibanashi-shin-onigashima/,"Adventure, Side view, Fantasy, Fixed / flip-screen, Menu structures"
15407,Famicom Tantei Club Part II: Ushiro ni Tatsu Shōjo,2013,,https://www.mobygames.com/game/15407/famicom-tantei-club-part-ii-ushiro-ni-tatsu-shojo/,"Adventure, 1st-person, Puzzle elements, Detective / mystery"
64984,Famicom Tantei Club: Kieta Kōkeisha,2014,,https://www.mobygames.com/game/64984/famicom-tantei-club-kieta-kokeisha/,"Adventure, Detective / mystery, Anime / Manga"
30697,Famicom Wars,2014,,https://www.mobygames.com/game/30697/famicom-wars/,"Strategy / tactics, Top-down, Turn-based, Turn-based strategy (TBS)"
84972,Family Party: 30 Great Games - Obstacle Arcade,2012,3.77,https://www.mobygames.com/game/84972/family-party-30-great-games-obstacle-arcade/,"Action, Mini-games, Party game"
62063,Family Tennis Advance,2015,,https://www.mobygames.com/game/62063/family-tennis-advance/,"Sports, Tennis, 3rd-person (Other)"
86636,Family Tennis SP,2014,,https://www.mobygames.com/game/86636/family-tennis-sp/,"Sports, Tennis, Anime / Manga, Behind view"
60731,Fast & Furious: Showdown,2013,,https://www.mobygames.com/game/60731/fast-furious-showdown/,"Action, Racing / Driving, 1st-person, Licensed, Behind view, Automobile, Street racing"
88449,Fast Racing Neo,2015,8.02,https://www.mobygames.com/game/88449/fast-racing-neo/,"Racing / Driving, Sci-fi / futuristic, Behind view"
86862,Fat City,2015,,https://www.mobygames.com/game/86862/fat-city/,"Top-down, Puzzle, Crime, North America"
103581,Fat Dragons,2018,,https://www.mobygames.com/game/103581/fat-dragons/,"Action, Arcade, Side view, Platform, Fantasy, 2D scrolling, Direct control"
84814,Fatal Frame: Maiden of Black Water,2014,6.64,https://www.mobygames.com/game/84814/fatal-frame-maiden-of-black-water/,"Action, Adventure, 1st-person, Fantasy, Survival horror, 3rd-person (Other)"
51339,Field Combat,2015,,https://www.mobygames.com/game/51339/field-combat/,"Action, Shooter, Diagonal-down, 2D scrolling"
58015,FIFA Soccer 13,2012,,https://www.mobygames.com/game/58015/fifa-soccer-13/,"Sports, Football (European) / Soccer, Licensed, 3rd-person (Other)"
100476,Fifteen,2017,,https://www.mobygames.com/game/100476/fifteen/,"1st-person, Puzzle, Timed input"
7313,Final Fantasy,2013,,https://www.mobygames.com/game/7313/final-fantasy/,"Role-playing (RPG), Anime / Manga, Fantasy, Turn-based, Diagonal-down, Japanese-style RPG (JRPG), Regional differences"
15750,Final Fantasy I & II: Dawn of Souls,2016,,https://www.mobygames.com/game/15750/final-fantasy-i-ii-dawn-of-souls/,"Top-down, Role-playing (RPG), Anime / Manga, Compilation, Fantasy, Turn-based"
4572,Final Fantasy II,2014,,https://www.mobygames.com/game/4572/final-fantasy-ii/,"Real-time, Role-playing (RPG), Fantasy, Turn-based, Diagonal-down, 2D scrolling, Japanese-style RPG (JRPG), Direct control, Menu structures"
7321,Final Fantasy II,2013,,https://www.mobygames.com/game/7321/final-fantasy-ii/,"Top-down, Role-playing (RPG), Fantasy, Turn-based, Japanese-style RPG (JRPG)"
7322,Final Fantasy III,2014,,https://www.mobygames.com/game/7322/final-fantasy-iii/,"Top-down, Role-playing (RPG), Fantasy, Turn-based"
5202,Final Fantasy III,2013,,https://www.mobygames.com/game/5202/final-fantasy-iii/,"Sci-fi / futuristic, Real-time, Role-playing (RPG), Anime / Manga, Fantasy, Turn-based, Diagonal-down, 2D scrolling, Japanese-style RPG (JRPG), Direct control, Menu structures, Steampunk, Regional differences"
10325,Final Fantasy Tactics Advance,2016,,https://www.mobygames.com/game/10325/final-fantasy-tactics-advance/,"Action, Strategy / tactics, Isometric, Role-playing (RPG), Fantasy, Turn-based, Tactical RPG"
4876,Final Fantasy V,2014,,https://www.mobygames.com/game/4876/final-fantasy-v/,"Real-time, Role-playing (RPG), Anime / Manga, Fantasy, Turn-based, Diagonal-down"
61502,Final Fantasy V Advance,2016,,https://www.mobygames.com/game/61502/final-fantasy-v-advance/,"Real-time, Role-playing (RPG), Anime / Manga, Fantasy, Turn-based, Diagonal-down, 2D scrolling, Japanese-style RPG (JRPG), Direct control, Menu structures"
7197,Final Fantasy: Mystic Quest,2014,,https://www.mobygames.com/game/7197/final-fantasy-mystic-quest/,"Top-down, Role-playing (RPG), Fantasy, Turn-based, 3rd-person (Other), Japanese-style RPG (JRPG)"
9836,Final Fight,2013,,https://www.mobygames.com/game/9836/final-fight/,"Action, Side view, Beat 'em up / brawler, 2D scrolling, Regional differences"
9845,Final Fight 2,2013,,https://www.mobygames.com/game/9845/final-fight-2/,"Action, Side view, Martial arts, Beat 'em up / brawler, 2D scrolling, Regional differences"
10058,Final Fight 3,2013,,https://www.mobygames.com/game/10058/final-fight-3/,"Action, Side view, Anime / Manga, Beat 'em up / brawler, 2D scrolling"
196282,Final Fight One,2015,,https://www.mobygames.com/game/196282/final-fight-one/,"Action, Side view, Beat 'em up / brawler, 2D scrolling, Regional differences"
28459,Final Soldier,2014,,https://www.mobygames.com/game/28459/final-soldier/,"Action, Sci-fi / futuristic, Top-down, Shooter"
72071,Fire,2016,,https://www.mobygames.com/game/72071/fire/,"Adventure, Side view, Puzzle elements, Comedy, Graphic adventure, Point and select, Prehistoric"
11200,Fire Emblem,2014,,https://www.mobygames.com/game/11200/fire-emblem/,"Strategy / tactics, Top-down, Role-playing (RPG), Fantasy, Turn-based"
12931,Fire Emblem Gaiden,2014,,https://www.mobygames.com/game/12931/fire-emblem-gaiden/,"Strategy / tactics, Top-down, Role-playing (RPG), Anime / Manga, Fantasy, Turn-based"
27029,Fire Emblem: Fūin no Tsurugi,2015,,https://www.mobygames.com/game/27029/fire-emblem-fuin-no-tsurugi/,"Strategy / tactics, Role-playing (RPG), Anime / Manga, Fantasy, Turn-based"
21347,Fire Emblem: Monshō no Nazo,2013,,https://www.mobygames.com/game/21347/fire-emblem-monsho-no-nazo/,"Strategy / tactics, Top-down, Role-playing (RPG), Anime / Manga, Fantasy, Turn-based"
20195,Fire Emblem: Seisen no Keifu,2013,,https://www.mobygames.com/game/20195/fire-emblem-seisen-no-keifu/,"Strategy / tactics, Top-down, Role-playing (RPG), Anime / Manga, Fantasy, Turn-based"
35590,Fire Emblem: Shadow Dragon,2015,,https://www.mobygames.com/game/35590/fire-emblem-shadow-dragon/,"Strategy / tactics, Top-down, Role-playing (RPG), Anime / Manga, Fantasy"
18647,Fire Emblem: Shadow Dragon & the Blade of Light,2014,,https://www.mobygames.com/game/18647/fire-emblem-shadow-dragon-the-blade-of-light/,"Strategy / tactics, Top-down, Role-playing (RPG), Anime / Manga, Fantasy, Turn-based"
17966,Fire Emblem: The Sacred Stones,2014,,https://www.mobygames.com/game/17966/fire-emblem-the-sacred-stones/,"Strategy / tactics, Top-down, Role-playing (RPG), Fantasy, Turn-based"
21407,Fire Emblem: Thracia 776,2013,,https://www.mobygames.com/game/21407/fire-emblem-thracia-776/,"Strategy / tactics, Top-down, Role-playing (RPG), Anime / Manga, Fantasy, Turn-based, 3rd-person (Other)"
100764,The First Skunk Bundle,2016,,https://www.mobygames.com/game/100764/the-first-skunk-bundle/,"Action, 1st-person, Arcade, Horror, Survival horror, Puzzle, Diagonal-down, Mini-games"
60805,Fist of the North Star: Ken's Rage 2,2013,,https://www.mobygames.com/game/60805/fist-of-the-north-star-kens-rage-2/,"Action, Martial arts, Anime / Manga, Post-apocalyptic, Licensed, Beat 'em up / brawler, 3rd-person (Other)"
91723,Fit Music,2014,,https://www.mobygames.com/game/91723/fit-music/,"Sports, Music / rhythm, 3rd-person (Other)"
100457,Flapp & Zegeta,2014,,https://www.mobygames.com/game/100457/flapp-zegeta/,"Action, Sci-fi / futuristic, Side view, Flight / aviation, 2D scrolling"
93842,Flight of Light,2017,,https://www.mobygames.com/game/93842/flight-of-light/,"Action, Flight / aviation, Music / rhythm, Behind view"
91067,Flowerworks,2014,,https://www.mobygames.com/game/91067/flowerworks/,"Action, Side view, Fantasy, Fixed / flip-screen"
33273,Flying Dragon: The Secret Scroll,2014,,https://www.mobygames.com/game/33273/flying-dragon-the-secret-scroll/,"Action, Side view, Martial arts, Fighting, 2D scrolling"
33212,Flying Warriors,2015,,https://www.mobygames.com/game/33212/flying-warriors/,"Action, Side view, Martial arts, Fighting, Role-playing (RPG), 2D scrolling"
99019,Forest Escape,2018,,https://www.mobygames.com/game/99019/forest-escape/,"Action, 1st-person"
84984,forma.8,2017,,https://www.mobygames.com/game/84984/forma8/,"Action, Sci-fi / futuristic, Side view, Platform, Metroidvania, Fantasy, 2D scrolling"
88147,Frederic: The Resurrection of Music,2014,,https://www.mobygames.com/game/88147/frederic-the-resurrection-of-music/,"Action, Anime / Manga, Music / rhythm, Fixed / flip-screen"
100760,Free Balling,2016,,https://www.mobygames.com/game/100760/free-balling/,"Simulation, 1st-person, City building / construction simulation, Track racing"
74215,Freedom Planet,2015,7.77,https://www.mobygames.com/game/74215/freedom-planet/,"Action, Sci-fi / futuristic, Side view, Platform, Fantasy, 2D scrolling"
87372,Freeze Me,2016,,https://www.mobygames.com/game/87372/freeze-me/,"Action, Platform, Fantasy, Behind view"
92898,Frenchy Bird,2015,,https://www.mobygames.com/game/92898/frenchy-bird/,"Action, Arcade, Side view, 2D scrolling"
13914,Front Line,2016,,https://www.mobygames.com/game/13914/front-line/,"Action, Arcade, Shooter, Diagonal-down, 2D scrolling"
101087,FullBlast,2015,,https://www.mobygames.com/game/101087/fullblast/,"Action, Sci-fi / futuristic, Flight / aviation, Shooter, Diagonal-down, 2D scrolling"
87075,Funk of Titans,2015,,https://www.mobygames.com/game/87075/funk-of-titans/,"Action, Side view, Platform, Fantasy, Comedy, 2D scrolling"
99552,Funky Barn 3D,2012,,https://www.mobygames.com/game/99552/funky-barn-3d/,"Action, Diagonal-down"
100708,Funky Physics,2015,,https://www.mobygames.com/game/100708/funky-physics/,"Real-time, Side view, Puzzle, Direct control"
86746,Futuridium Extended Play Deluxe,2016,,https://www.mobygames.com/game/86746/futuridium-extended-play-deluxe/,"Action, Sci-fi / futuristic, Flight / aviation, Shooter, Behind view, Space flight"
209611,Gaia no Monshō,2017,,https://www.mobygames.com/game/209611/gaia-no-monsho/,"Strategy / tactics, Top-down, Fantasy, Turn-based, Fixed / flip-screen, Menu structures, Turn-based strategy (TBS)"
100857,Gaiabreaker,2014,,https://www.mobygames.com/game/100857/gaiabreaker/,"Action, Arcade, Flight / aviation, Shooter, Diagonal-down, 2D scrolling"
65528,Gaiflame,2016,,https://www.mobygames.com/game/65528/gaiflame/,"Strategy / tactics, Sci-fi / futuristic, Top-down, Mecha / giant robot, Turn-based"
67313,Gakkō de atta Kowai Hanashi,2014,,https://www.mobygames.com/game/67313/gakko-de-atta-kowai-hanashi/,"Adventure, Survival horror, Visual novel"
8402,Galaga,2013,,https://www.mobygames.com/game/8402/galaga/,"Action, Sci-fi / futuristic, Arcade, Top-down, Shooter, Fixed / flip-screen"
92530,Galaxy Blaster,2017,,https://www.mobygames.com/game/92530/galaxy-blaster/,"Action, Sci-fi / futuristic, Arcade, Side view, Shooter"
62672,Game & Wario,2013,6.04,https://www.mobygames.com/game/62672/game-wario/,"Action, 1st-person, 3rd-person (Other)"
7672,Game & Watch Gallery 4,2015,,https://www.mobygames.com/game/7672/game-watch-gallery-4/,"Action, Side view, Platform, Puzzle elements, Boxing, Compilation, Fixed / flip-screen"
34686,Game Boy Wars Advance 1+2,2014,,https://www.mobygames.com/game/34686/game-boy-wars-advance-12/,Compilation
79798,Game Party: Champions,2012,4.24,https://www.mobygames.com/game/79798/game-party-champions/,"Action, Licensed, 3rd-person (Other), Party game"
100761,Games for Toddlers,2016,,https://www.mobygames.com/game/100761/games-for-toddlers/,"Action, Arcade, Diagonal-down, Mini-games"
26469,Ganbare Goemon 2,2015,,https://www.mobygames.com/game/26469/ganbare-goemon-2/,"Action, Arcade, Side view, Anime / Manga, Fantasy"
7809,Ganbare Goemon 2: Kiteretsu Shogun Magginesu,2013,,https://www.mobygames.com/game/7809/ganbare-goemon-2-kiteretsu-shogun-magginesu/,"Action, Side view, Anime / Manga, 2D scrolling"
26869,Ganbare Goemon 3: Shishi Jūrokubee no Karakuri Manji-gatame,2013,,https://www.mobygames.com/game/26869/ganbare-goemon-3-shishi-jurokubee-no-karakuri-manji-gatame/,"Action, Arcade, Top-down, Side view, Anime / Manga"
13469,Ganbare Goemon Gaiden: Kieta Ōgon Kiseru,2015,,https://www.mobygames.com/game/13469/ganbare-goemon-gaiden-kieta-ogon-kiseru/,"Top-down, Role-playing (RPG), Anime / Manga, Turn-based"
26313,Ganbare Goemon! Karakuri Dōchū,2014,,https://www.mobygames.com/game/26313/ganbare-goemon-karakuri-dochu/,"Action, Arcade, Side view, Anime / Manga, Fantasy"
18166,Gargoyle's Quest II,2014,,https://www.mobygames.com/game/18166/gargoyles-quest-ii/,"Action, Top-down, Side view, Platform, Metroidvania, Fantasy, Horror, 2D scrolling, Direct control"
96267,Gear Gauntlet,2016,,https://www.mobygames.com/game/96267/gear-gauntlet/,"Action, Arcade, Side view, 2D scrolling"
92262,The Gem Collector,2016,,https://www.mobygames.com/game/92262/the-gem-collector/,"Action, Side view, Platform, 2D scrolling"
101091,Gemology,2015,,https://www.mobygames.com/game/101091/gemology/,"1st-person, Puzzle, Fixed / flip-screen, Tile matching puzzle"
1927,Genghis Khan II: Clan of the Gray Wolf,2015,,https://www.mobygames.com/game/1927/genghis-khan-ii-clan-of-the-gray-wolf/,"Strategy / tactics, Historical events, Turn-based, Diagonal-down, Asia, Turn-based strategy (TBS)"
98904,Geom,2014,,https://www.mobygames.com/game/98904/geom/,"Puzzle, Tile matching puzzle"
100943,GetClose,2014,,https://www.mobygames.com/game/100943/getclose/,"Action, Arcade, Side view, Shooter, Fixed / flip-screen"
13471,Getsufūma Den,2015,,https://www.mobygames.com/game/13471/getsufuma-den/,"Action, 1st-person, Top-down, Platform, Metroidvania, Fantasy"
84427,Ghost Blade HD,2017,,https://www.mobygames.com/game/84427/ghost-blade-hd/,"Action, Arcade, Top-down, Shooter, 2D scrolling"
582,Ghosts 'N Goblins,2013,,https://www.mobygames.com/game/582/ghosts-n-goblins/,"Action, Side view, Platform, Shooter, Fantasy, 2D scrolling, Direct control"
58277,Giana Sisters: Twisted Dreams,2013,,https://www.mobygames.com/game/58277/giana-sisters-twisted-dreams/,"Action, Side view, Platform, Fantasy, 2D scrolling"
89239,The Girl and the Robot,2017,,https://www.mobygames.com/game/89239/the-girl-and-the-robot/,"Action, Platform, Puzzle elements, Behind view"
99361,Girls Like Robots,2015,,https://www.mobygames.com/game/99361/girls-like-robots/,"Top-down, Puzzle"
5413,Golden Sun,2014,,https://www.mobygames.com/game/5413/golden-sun/,"Top-down, Isometric, Puzzle elements, Role-playing (RPG), Fantasy, 3rd-person (Other)"
8962,Golden Sun: The Lost Age,2014,,https://www.mobygames.com/game/8962/golden-sun-the-lost-age/,"Puzzle elements, Role-playing (RPG), Fantasy"
7316,Golf,2013,,https://www.mobygames.com/game/7316/golf/,"Sports, Top-down, Golf, Behind view"
45711,Gomoku Narabe Renju,2014,,https://www.mobygames.com/game/45711/gomoku-narabe-renju/,"Strategy / tactics, Top-down, Board game"
4512,Gradius,2013,,https://www.mobygames.com/game/4512/gradius/,"Action, Sci-fi / futuristic, Arcade, Side view, Shooter, 2D scrolling, Space flight"
79221,Granbo,2016,,https://www.mobygames.com/game/79221/granbo/,"Sci-fi / futuristic, Role-playing (RPG), Anime / Manga"
87367,Grand Prix Rock 'N Racing,2016,,https://www.mobygames.com/game/87367/grand-prix-rock-n-racing/,"Racing / Driving, Diagonal-down, 2D scrolling, Automobile, Track racing"
100798,GravBlocks+,2015,,https://www.mobygames.com/game/100798/gravblocks/,"Sci-fi / futuristic, Top-down, Puzzle, Fixed / flip-screen, Tile matching puzzle"
70784,Gravity Badgers,2014,,https://www.mobygames.com/game/70784/gravity-badgers/,"Sci-fi / futuristic, Side view, Puzzle, Fixed / flip-screen"
101307,Gravity+,2016,,https://www.mobygames.com/game/101307/gravity/,"Action, Sci-fi / futuristic, Side view, Platform, Puzzle, Fixed / flip-screen"
101304,The Grumpy Reaper,2016,,https://www.mobygames.com/game/101304/the-grumpy-reaper/,"Action, Arcade, Fantasy, Diagonal-down, 2D scrolling, Direct control"
67173,Guacamelee! Super Turbo Championship Edition,2014,,https://www.mobygames.com/game/67173/guacamelee-super-turbo-championship-edition/,"Action, Side view, Platform, Metroidvania, Compilation, 2D scrolling"
75375,Guitar Hero Live,2015,,https://www.mobygames.com/game/75375/guitar-hero-live/,"Action, Simulation, Music / rhythm, 3rd-person (Other)"
74802,Gunman Clive: HD Collection,2015,,https://www.mobygames.com/game/74802/gunman-clive-hd-collection/,"Action, Side view, Platform, Shooter, Compilation, 2D scrolling, Direct control, Western"
21710,Gyakuten Saiban,2015,,https://www.mobygames.com/game/21710/gyakuten-saiban/,"Adventure, 1st-person, Puzzle elements, Detective / mystery"
65117,Hanjuku Hero,2014,,https://www.mobygames.com/game/65117/hanjuku-hero/,"Strategy / tactics, Real-time, Role-playing (RPG), Fantasy, Diagonal-down, Free camera"
